benchmarks/microkernels/DpAnsor/a100/log/a100_relu.log_droplet.log
{"i": [["[\"relu_layer\", 4096, 4096]", "cuda -keys=cuda,gpu -arch=sm_80 -max_num_threads=1024 -thread_warp_size=32", [-1, 16, 64, 49152, 2147483647, 1024, 8, 32], "", 0, []], [[], [["FU", 1, [0, 1]], ["SP", 1, 0, 16777216, [64], 1], ["AN", 1, 0, 5], ["AN", 1, 1, 6]]]], "r": [[0.00019726], 0, 1.9234, 1710117816], "v": "v0.6"}
{"i": [["[\"relu_layer\", 4096, 4096]", "cuda -keys=cuda,gpu -arch=sm_80 -max_num_threads=1024 -thread_warp_size=32", [-1, 16, 64, 49152, 2147483647, 1024, 8, 32], "", 0, []], [[], [["FU", 1, [0, 1]], ["SP", 1, 0, 16777216, [64], 1], ["AN", 1, 0, 5], ["AN", 1, 1, 6]]]], "r": [[0.000220671, 0.000221184, 0.000220671], 0, 1.263, 1710134820], "v": "v0.6"}
