benchmarks/microkernels/DpAnsor/a100/log/reduce.log
{"i": [["[\"reduction_layer\", [128, 512, 1024], 2, false]", "cuda -keys=cuda,gpu -arch=sm_75 -max_num_threads=1024 -thread_warp_size=32", [-1, 16, 64, 49152, 2147483647, 1024, 8, 32], "", 0, []], [[], [["SP", 1, 2, 1024, [64], 1], ["AN", 1, 3, 6], ["FU", 1, [0, 1]], ["AN", 1, 0, 5], ["PR", 1, 0, "auto_unroll_max_step$0"]]]], "r": [[0.00149116], 0, 2.06591, 1710088218], "v": "v0.6"}
{"i": [["[\"reduction_layer\", [128, 512, 1024], 2, false]", "cuda -keys=cuda,gpu -arch=sm_75 -max_num_threads=1024 -thread_warp_size=32", [-1, 16, 64, 49152, 2147483647, 1024, 8, 32], "", 0, []], [[], [["SP", 1, 2, 1024, [4], 1], ["AN", 1, 3, 6], ["FU", 1, [0, 1]], ["AN", 1, 0, 5], ["PR", 1, 0, "auto_unroll_max_step$64"]]]], "r": [[0.00185432], 0, 2.06142, 1710088219], "v": "v0.6"}
{"i": [["[\"reduction_layer\", [128, 512, 1024], 2, false]", "cuda -keys=cuda,gpu -arch=sm_75 -max_num_threads=1024 -thread_warp_size=32", [-1, 16, 64, 49152, 2147483647, 1024, 8, 32], "", 0, []], [[], [["SP", 1, 2, 1024, [64], 1], ["AN", 1, 3, 6], ["FU", 1, [0, 1]], ["AN", 1, 0, 5], ["PR", 1, 0, "auto_unroll_max_step$1024"]]]], "r": [[0.00153418], 0, 2.05768, 1710088221], "v": "v0.6"}
{"i": [["[\"reduction_layer\", [128, 512, 1024], 2, false]", "cuda -keys=cuda,gpu -arch=sm_75 -max_num_threads=1024 -thread_warp_size=32", [-1, 16, 64, 49152, 2147483647, 1024, 8, 32], "", 0, []], [[], [["FU", 1, [0, 1]], ["SP", 1, 0, 65536, [2], 1], ["AN", 1, 0, 5], ["AN", 1, 1, 6], ["PR", 1, 0, "auto_unroll_max_step$16"]]]], "r": [[0.00554067], 0, 2.27456, 1710088223], "v": "v0.6"}
{"i": [["[\"reduction_layer\", [128, 512, 1024], 2, false]", "cuda -keys=cuda,gpu -arch=sm_75 -max_num_threads=1024 -thread_warp_size=32", [-1, 16, 64, 49152, 2147483647, 1024, 8, 32], "", 0, []], [[], [["FU", 1, [0, 1]], ["SP", 1, 0, 65536, [8], 1], ["AN", 1, 0, 5], ["AN", 1, 1, 6], ["PR", 1, 0, "auto_unroll_max_step$1024"]]]], "r": [[0.0055779], 0, 2.09657, 1710088224], "v": "v0.6"}
{"i": [["[\"reduction_layer\", [128, 512, 1024], 2, false]", "cuda -keys=cuda,gpu -arch=sm_75 -max_num_threads=1024 -thread_warp_size=32", [-1, 16, 64, 49152, 2147483647, 1024, 8, 32], "", 0, []], [[], [["SP", 1, 2, 1024, [4], 1], ["AN", 1, 3, 6], ["FU", 1, [0, 1]], ["AN", 1, 0, 5], ["PR", 1, 0, "auto_unroll_max_step$1024"]]]], "r": [[0.0018347], 0, 2.06525, 1710088226], "v": "v0.6"}
{"i": [["[\"reduction_layer\", [128, 512, 1024], 2, false]", "cuda -keys=cuda,gpu -arch=sm_75 -max_num_threads=1024 -thread_warp_size=32", [-1, 16, 64, 49152, 2147483647, 1024, 8, 32], "", 0, []], [[], [["SP", 1, 2, 1024, [2], 1], ["AN", 1, 3, 6], ["FU", 1, [0, 1]], ["AN", 1, 0, 5], ["PR", 1, 0, "auto_unroll_max_step$64"]]]], "r": [[0.00324446], 0, 2.17802, 1710088227], "v": "v0.6"}
{"i": [["[\"reduction_layer\", [128, 512, 1024], 2, false]", "cuda -keys=cuda,gpu -arch=sm_75 -max_num_threads=1024 -thread_warp_size=32", [-1, 16, 64, 49152, 2147483647, 1024, 8, 32], "", 0, []], [[], [["SP", 1, 2, 1024, [8], 1], ["AN", 1, 3, 6], ["FU", 1, [0, 1]], ["AN", 1, 0, 5], ["PR", 1, 0, "auto_unroll_max_step$0"]]]], "r": [[0.00149331], 0, 2.12891, 1710088229], "v": "v0.6"}
{"i": [["[\"reduction_layer\", [128, 512, 1024], 2, false]", "cuda -keys=cuda,gpu -arch=sm_75 -max_num_threads=1024 -thread_warp_size=32", [-1, 16, 64, 49152, 2147483647, 1024, 8, 32], "", 0, []], [[], [["FU", 1, [0, 1]], ["SP", 1, 0, 65536, [8], 1], ["AN", 1, 0, 5], ["AN", 1, 1, 6], ["PR", 1, 0, "auto_unroll_max_step$64"]]]], "r": [[0.00564301], 0, 2.06667, 1710088230], "v": "v0.6"}
{"i": [["[\"reduction_layer\", [128, 512, 1024], 2, false]", "cuda -keys=cuda,gpu -arch=sm_75 -max_num_threads=1024 -thread_warp_size=32", [-1, 16, 64, 49152, 2147483647, 1024, 8, 32], "", 0, []], [[], [["SP", 1, 2, 1024, [32], 1], ["AN", 1, 3, 6], ["FU", 1, [0, 1]], ["AN", 1, 0, 5], ["PR", 1, 0, "auto_unroll_max_step$16"]]]], "r": [[0.00150367], 0, 2.03669, 1710088232], "v": "v0.6"}
