benchmarks/microkernels/DpAnsor/a100/log/reduce.log_droplet.log
{"i": [["[\"reduction_layer\", [128, 512, 1024], 2, false]", "cuda -keys=cuda,gpu -arch=sm_75 -max_num_threads=1024 -thread_warp_size=32", [-1, 16, 64, 49152, 2147483647, 1024, 8, 32], "", 0, []], [[], [["SP", 1, 2, 1024, [64], 1], ["AN", 1, 3, 6], ["FU", 1, [0, 1]], ["AN", 1, 0, 5], ["PR", 1, 0, "auto_unroll_max_step$0"]]]], "r": [[0.00149116], 0, 2.06591, 1710088218], "v": "v0.6"}
{"i": [["[\"reduction_layer\", [128, 512, 1024], 2, false]", "cuda -keys=cuda,gpu -arch=sm_75 -max_num_threads=1024 -thread_warp_size=32", [-1, 16, 64, 49152, 2147483647, 1024, 8, 32], "", 0, []], [[], [["SP", 1, 2, 1024, [64], 1], ["AN", 1, 3, 6], ["FU", 1, [0, 1]], ["AN", 1, 0, 5], ["PR", 1, 0, "auto_unroll_max_step$0"]]]], "r": [[0.0014608, 0.00144691, 0.00144714], 0, 1.68253, 1710088236], "v": "v0.6"}
