benchmarks/microkernels/original/log/depthwise_128_84_83_83_5_5_2_SAME.log
{"input": ["cuda -keys=cuda,gpu -arch=sm_86 -max_num_threads=1024 -thread_warp_size=32", "depthwise_conv2d_nchw.cuda", [["TENSOR", [128, 84, 83, 83], "float32"], ["TENSOR", [84, 1, 5, 5], "float32"], 2, "SAME", 1, "float32"], {}], "config": {"index": 0, "code_hash": null, "entity": [["tile_f", "sp", [-1, 1, 1, 1]], ["tile_y", "sp", [-1, 1, 1, 1]], ["tile_x", "sp", [-1, 1, 1, 1]], ["auto_unroll_max_step", "ot", 0], ["unroll_explicit", "ot", 0]]}, "result": [[0.06378265749999999], 0, 2.3435277938842773, 1702481624.3975914], "version": 0.2, "tvm_version": "0.10.0"}
