benchmarks/microkernels/autotvm/log/conv2d_128_128_28_28_128_3_3_1_SAME.log
{"input": ["cuda -keys=cuda,gpu -arch=sm_86 -max_num_threads=1024 -thread_warp_size=32", "conv2d_nchw.cuda", [["TENSOR", [128, 128, 28, 28], "float32"], ["TENSOR", [128, 128, 3, 3], "float32"], 1, "SAME", 1, "float32"], {}], "config": {"index": 32865896, "code_hash": null, "entity": [["tile_f", "sp", [-1, 4, 8, 2]], ["tile_y", "sp", [-1, 4, 1, 1]], ["tile_x", "sp", [-1, 2, 2, 1]], ["tile_rc", "sp", [-1, 8]], ["tile_ry", "sp", [-1, 3]], ["tile_rx", "sp", [-1, 1]], ["auto_unroll_max_step", "ot", 1500], ["unroll_explicit", "ot", 1]]}, "result": [[0.014547414428571428], 0, 2.0202438831329346, 1702579674.1106634], "version": 0.2, "tvm_version": "0.10.0"}
{"input": ["cuda -keys=cuda,gpu -arch=sm_86 -max_num_threads=1024 -thread_warp_size=32", "conv2d_nchw.cuda", [["TENSOR", [128, 128, 28, 28], "float32"], ["TENSOR", [128, 128, 3, 3], "float32"], 1, "SAME", 1, "float32"], {}], "config": {"index": 23703364, "code_hash": null, "entity": [["tile_f", "sp", [-1, 16, 1, 1]], ["tile_y", "sp", [-1, 7, 2, 1]], ["tile_x", "sp", [-1, 1, 1, 2]], ["tile_rc", "sp", [-1, 8]], ["tile_ry", "sp", [-1, 3]], ["tile_rx", "sp", [-1, 3]], ["auto_unroll_max_step", "ot", 0], ["unroll_explicit", "ot", 1]]}, "result": [[0.0967633895], 0, 2.357243299484253, 1702579675.3566246], "version": 0.2, "tvm_version": "0.10.0"}
{"input": ["cuda -keys=cuda,gpu -arch=sm_86 -max_num_threads=1024 -thread_warp_size=32", "conv2d_nchw.cuda", [["TENSOR", [128, 128, 28, 28], "float32"], ["TENSOR", [128, 128, 3, 3], "float32"], 1, "SAME", 1, "float32"], {}], "config": {"index": 25158417, "code_hash": null, "entity": [["tile_f", "sp", [-1, 8, 8, 2]], ["tile_y", "sp", [-1, 2, 7, 1]], ["tile_x", "sp", [-1, 2, 1, 1]], ["tile_rc", "sp", [-1, 8]], ["tile_ry", "sp", [-1, 1]], ["tile_rx", "sp", [-1, 1]], ["auto_unroll_max_step", "ot", 512], ["unroll_explicit", "ot", 1]]}, "result": [[0.006837686], 0, 2.2246272563934326, 1702579676.2676663], "version": 0.2, "tvm_version": "0.10.0"}
{"input": ["cuda -keys=cuda,gpu -arch=sm_86 -max_num_threads=1024 -thread_warp_size=32", "conv2d_nchw.cuda", [["TENSOR", [128, 128, 28, 28], "float32"], ["TENSOR", [128, 128, 3, 3], "float32"], 1, "SAME", 1, "float32"], {}], "config": {"index": 29739490, "code_hash": null, "entity": [["tile_f", "sp", [-1, 4, 2, 1]], ["tile_y", "sp", [-1, 1, 7, 4]], ["tile_x", "sp", [-1, 1, 4, 7]], ["tile_rc", "sp", [-1, 4]], ["tile_ry", "sp", [-1, 3]], ["tile_rx", "sp", [-1, 3]], ["auto_unroll_max_step", "ot", 512], ["unroll_explicit", "ot", 1]]}, "result": [[0.0024657681395348838], 0, 3.631165027618408, 1702579677.1324553], "version": 0.2, "tvm_version": "0.10.0"}
{"input": ["cuda -keys=cuda,gpu -arch=sm_86 -max_num_threads=1024 -thread_warp_size=32", "conv2d_nchw.cuda", [["TENSOR", [128, 128, 28, 28], "float32"], ["TENSOR", [128, 128, 3, 3], "float32"], 1, "SAME", 1, "float32"], {}], "config": {"index": 3242359, "code_hash": null, "entity": [["tile_f", "sp", [-1, 1, 8, 4]], ["tile_y", "sp", [-1, 2, 1, 2]], ["tile_x", "sp", [-1, 1, 4, 7]], ["tile_rc", "sp", [-1, 1]], ["tile_ry", "sp", [-1, 1]], ["tile_rx", "sp", [-1, 3]], ["auto_unroll_max_step", "ot", 0], ["unroll_explicit", "ot", 0]]}, "result": [[0.0034467819], 0, 1.516404390335083, 1702579678.0128853], "version": 0.2, "tvm_version": "0.10.0"}
{"input": ["cuda -keys=cuda,gpu -arch=sm_86 -max_num_threads=1024 -thread_warp_size=32", "conv2d_nchw.cuda", [["TENSOR", [128, 128, 28, 28], "float32"], ["TENSOR", [128, 128, 3, 3], "float32"], 1, "SAME", 1, "float32"], {}], "config": {"index": 15674269, "code_hash": null, "entity": [["tile_f", "sp", [-1, 1, 8, 16]], ["tile_y", "sp", [-1, 1, 1, 2]], ["tile_x", "sp", [-1, 2, 7, 2]], ["tile_rc", "sp", [-1, 2]], ["tile_ry", "sp", [-1, 1]], ["tile_rx", "sp", [-1, 3]], ["auto_unroll_max_step", "ot", 1500], ["unroll_explicit", "ot", 0]]}, "result": [[0.002944995444444444], 0, 1.942305326461792, 1702579678.8994145], "version": 0.2, "tvm_version": "0.10.0"}
{"input": ["cuda -keys=cuda,gpu -arch=sm_86 -max_num_threads=1024 -thread_warp_size=32", "conv2d_nchw.cuda", [["TENSOR", [128, 128, 28, 28], "float32"], ["TENSOR", [128, 128, 3, 3], "float32"], 1, "SAME", 1, "float32"], {}], "config": {"index": 34263266, "code_hash": null, "entity": [["tile_f", "sp", [-1, 1, 16, 1]], ["tile_y", "sp", [-1, 2, 2, 1]], ["tile_x", "sp", [-1, 1, 1, 2]], ["tile_rc", "sp", [-1, 4]], ["tile_ry", "sp", [-1, 1]], ["tile_rx", "sp", [-1, 3]], ["auto_unroll_max_step", "ot", 1500], ["unroll_explicit", "ot", 1]]}, "result": [[0.011935971555555557], 0, 1.5667219161987305, 1702579679.8145983], "version": 0.2, "tvm_version": "0.10.0"}
{"input": ["cuda -keys=cuda,gpu -arch=sm_86 -max_num_threads=1024 -thread_warp_size=32", "conv2d_nchw.cuda", [["TENSOR", [128, 128, 28, 28], "float32"], ["TENSOR", [128, 128, 3, 3], "float32"], 1, "SAME", 1, "float32"], {}], "config": {"index": 6778964, "code_hash": null, "entity": [["tile_f", "sp", [-1, 2, 2, 2]], ["tile_y", "sp", [-1, 7, 4, 1]], ["tile_x", "sp", [-1, 1, 7, 1]], ["tile_rc", "sp", [-1, 8]], ["tile_ry", "sp", [-1, 1]], ["tile_rx", "sp", [-1, 1]], ["auto_unroll_max_step", "ot", 512], ["unroll_explicit", "ot", 0]]}, "result": [[0.012205283222222222], 0, 1.9027740955352783, 1702579680.7336187], "version": 0.2, "tvm_version": "0.10.0"}
{"input": ["cuda -keys=cuda,gpu -arch=sm_86 -max_num_threads=1024 -thread_warp_size=32", "conv2d_nchw.cuda", [["TENSOR", [128, 128, 28, 28], "float32"], ["TENSOR", [128, 128, 3, 3], "float32"], 1, "SAME", 1, "float32"], {}], "config": {"index": 10754433, "code_hash": null, "entity": [["tile_f", "sp", [-1, 1, 64, 1]], ["tile_y", "sp", [-1, 7, 1, 2]], ["tile_x", "sp", [-1, 1, 1, 1]], ["tile_rc", "sp", [-1, 1]], ["tile_ry", "sp", [-1, 3]], ["tile_rx", "sp", [-1, 3]], ["auto_unroll_max_step", "ot", 512], ["unroll_explicit", "ot", 0]]}, "result": [[0.009347351], 0, 1.3087177276611328, 1702579681.6391828], "version": 0.2, "tvm_version": "0.10.0"}
{"input": ["cuda -keys=cuda,gpu -arch=sm_86 -max_num_threads=1024 -thread_warp_size=32", "conv2d_nchw.cuda", [["TENSOR", [128, 128, 28, 28], "float32"], ["TENSOR", [128, 128, 3, 3], "float32"], 1, "SAME", 1, "float32"], {}], "config": {"index": 10988785, "code_hash": null, "entity": [["tile_f", "sp", [-1, 16, 8, 1]], ["tile_y", "sp", [-1, 2, 7, 1]], ["tile_x", "sp", [-1, 14, 2, 1]], ["tile_rc", "sp", [-1, 2]], ["tile_ry", "sp", [-1, 3]], ["tile_rx", "sp", [-1, 3]], ["auto_unroll_max_step", "ot", 512], ["unroll_explicit", "ot", 0]]}, "result": [[0.0990824965], 0, 3.113468647003174, 1702579682.8850377], "version": 0.2, "tvm_version": "0.10.0"}
{"input": ["cuda -keys=cuda,gpu -arch=sm_86 -max_num_threads=1024 -thread_warp_size=32", "conv2d_nchw.cuda", [["TENSOR", [128, 128, 28, 28], "float32"], ["TENSOR", [128, 128, 3, 3], "float32"], 1, "SAME", 1, "float32"], {}], "config": {"index": 32604958, "code_hash": null, "entity": [["tile_f", "sp", [-1, 1, 2, 64]], ["tile_y", "sp", [-1, 1, 1, 4]], ["tile_x", "sp", [-1, 4, 1, 7]], ["tile_rc", "sp", [-1, 2]], ["tile_ry", "sp", [-1, 3]], ["tile_rx", "sp", [-1, 1]], ["auto_unroll_max_step", "ot", 1500], ["unroll_explicit", "ot", 1]]}, "result": [[1.43538964825], 0, 11.797780990600586, 1702579690.8289924], "version": 0.2, "tvm_version": "0.10.0"}
{"input": ["cuda -keys=cuda,gpu -arch=sm_86 -max_num_threads=1024 -thread_warp_size=32", "conv2d_nchw.cuda", [["TENSOR", [128, 128, 28, 28], "float32"], ["TENSOR", [128, 128, 3, 3], "float32"], 1, "SAME", 1, "float32"], {}], "config": {"index": 35550528, "code_hash": null, "entity": [["tile_f", "sp", [-1, 32, 2, 2]], ["tile_y", "sp", [-1, 4, 7, 1]], ["tile_x", "sp", [-1, 1, 2, 1]], ["tile_rc", "sp", [-1, 2]], ["tile_ry", "sp", [-1, 3]], ["tile_rx", "sp", [-1, 3]], ["auto_unroll_max_step", "ot", 1500], ["unroll_explicit", "ot", 1]]}, "result": [[0.0360855025], 0, 5.074622869491577, 1702579701.819291], "version": 0.2, "tvm_version": "0.10.0"}
{"input": ["cuda -keys=cuda,gpu -arch=sm_86 -max_num_threads=1024 -thread_warp_size=32", "conv2d_nchw.cuda", [["TENSOR", [128, 128, 28, 28], "float32"], ["TENSOR", [128, 128, 3, 3], "float32"], 1, "SAME", 1, "float32"], {}], "config": {"index": 22552583, "code_hash": null, "entity": [["tile_f", "sp", [-1, 4, 8, 1]], ["tile_y", "sp", [-1, 1, 1, 2]], ["tile_x", "sp", [-1, 1, 1, 2]], ["tile_rc", "sp", [-1, 32]], ["tile_ry", "sp", [-1, 1]], ["tile_rx", "sp", [-1, 3]], ["auto_unroll_max_step", "ot", 0], ["unroll_explicit", "ot", 1]]}, "result": [[0.07418188475], 0, 1.6091618537902832, 1702579702.9410203], "version": 0.2, "tvm_version": "0.10.0"}
{"input": ["cuda -keys=cuda,gpu -arch=sm_86 -max_num_threads=1024 -thread_warp_size=32", "conv2d_nchw.cuda", [["TENSOR", [128, 128, 28, 28], "float32"], ["TENSOR", [128, 128, 3, 3], "float32"], 1, "SAME", 1, "float32"], {}], "config": {"index": 14056228, "code_hash": null, "entity": [["tile_f", "sp", [-1, 4, 16, 1]], ["tile_y", "sp", [-1, 1, 14, 1]], ["tile_x", "sp", [-1, 7, 2, 1]], ["tile_rc", "sp", [-1, 2]], ["tile_ry", "sp", [-1, 3]], ["tile_rx", "sp", [-1, 1]], ["auto_unroll_max_step", "ot", 1500], ["unroll_explicit", "ot", 0]]}, "result": [[0.0028881503783783785], 0, 1.510707139968872, 1702579703.8282099], "version": 0.2, "tvm_version": "0.10.0"}
{"input": ["cuda -keys=cuda,gpu -arch=sm_86 -max_num_threads=1024 -thread_warp_size=32", "conv2d_nchw.cuda", [["TENSOR", [128, 128, 28, 28], "float32"], ["TENSOR", [128, 128, 3, 3], "float32"], 1, "SAME", 1, "float32"], {}], "config": {"index": 32305053, "code_hash": null, "entity": [["tile_f", "sp", [-1, 8, 2, 8]], ["tile_y", "sp", [-1, 7, 2, 1]], ["tile_x", "sp", [-1, 1, 4, 1]], ["tile_rc", "sp", [-1, 1]], ["tile_ry", "sp", [-1, 3]], ["tile_rx", "sp", [-1, 1]], ["auto_unroll_max_step", "ot", 1500], ["unroll_explicit", "ot", 1]]}, "result": [[0.042655487], 0, 4.894542932510376, 1702579704.8114197], "version": 0.2, "tvm_version": "0.10.0"}
{"input": ["cuda -keys=cuda,gpu -arch=sm_86 -max_num_threads=1024 -thread_warp_size=32", "conv2d_nchw.cuda", [["TENSOR", [128, 128, 28, 28], "float32"], ["TENSOR", [128, 128, 3, 3], "float32"], 1, "SAME", 1, "float32"], {}], "config": {"index": 17446260, "code_hash": null, "entity": [["tile_f", "sp", [-1, 4, 16, 2]], ["tile_y", "sp", [-1, 2, 7, 2]], ["tile_x", "sp", [-1, 2, 2, 7]], ["tile_rc", "sp", [-1, 4]], ["tile_ry", "sp", [-1, 3]], ["tile_rx", "sp", [-1, 3]], ["auto_unroll_max_step", "ot", 1500], ["unroll_explicit", "ot", 0]]}, "result": [[0.03685785675], 0, 3.0193817615509033, 1702579705.7549279], "version": 0.2, "tvm_version": "0.10.0"}
{"input": ["cuda -keys=cuda,gpu -arch=sm_86 -max_num_threads=1024 -thread_warp_size=32", "conv2d_nchw.cuda", [["TENSOR", [128, 128, 28, 28], "float32"], ["TENSOR", [128, 128, 3, 3], "float32"], 1, "SAME", 1, "float32"], {}], "config": {"index": 34230185, "code_hash": null, "entity": [["tile_f", "sp", [-1, 2, 1, 4]], ["tile_y", "sp", [-1, 7, 4, 1]], ["tile_x", "sp", [-1, 7, 4, 1]], ["tile_rc", "sp", [-1, 4]], ["tile_ry", "sp", [-1, 1]], ["tile_rx", "sp", [-1, 3]], ["auto_unroll_max_step", "ot", 1500], ["unroll_explicit", "ot", 1]]}, "result": [[0.1364691925], 0, 5.832858085632324, 1702579707.2045133], "version": 0.2, "tvm_version": "0.10.0"}
{"input": ["cuda -keys=cuda,gpu -arch=sm_86 -max_num_threads=1024 -thread_warp_size=32", "conv2d_nchw.cuda", [["TENSOR", [128, 128, 28, 28], "float32"], ["TENSOR", [128, 128, 3, 3], "float32"], 1, "SAME", 1, "float32"], {}], "config": {"index": 25133700, "code_hash": null, "entity": [["tile_f", "sp", [-1, 4, 16, 2]], ["tile_y", "sp", [-1, 2, 2, 1]], ["tile_x", "sp", [-1, 1, 1, 14]], ["tile_rc", "sp", [-1, 4]], ["tile_ry", "sp", [-1, 1]], ["tile_rx", "sp", [-1, 1]], ["auto_unroll_max_step", "ot", 512], ["unroll_explicit", "ot", 1]]}, "result": [[0.0051979198], 0, 2.1575915813446045, 1702579708.093392], "version": 0.2, "tvm_version": "0.10.0"}
{"input": ["cuda -keys=cuda,gpu -arch=sm_86 -max_num_threads=1024 -thread_warp_size=32", "conv2d_nchw.cuda", [["TENSOR", [128, 128, 28, 28], "float32"], ["TENSOR", [128, 128, 3, 3], "float32"], 1, "SAME", 1, "float32"], {}], "config": {"index": 17321936, "code_hash": null, "entity": [["tile_f", "sp", [-1, 4, 8, 2]], ["tile_y", "sp", [-1, 1, 7, 4]], ["tile_x", "sp", [-1, 7, 2, 1]], ["tile_rc", "sp", [-1, 4]], ["tile_ry", "sp", [-1, 3]], ["tile_rx", "sp", [-1, 3]], ["auto_unroll_max_step", "ot", 1500], ["unroll_explicit", "ot", 0]]}, "result": [[0.010411007600000001], 0, 2.49920654296875, 1702579708.9973714], "version": 0.2, "tvm_version": "0.10.0"}
{"input": ["cuda -keys=cuda,gpu -arch=sm_86 -max_num_threads=1024 -thread_warp_size=32", "conv2d_nchw.cuda", [["TENSOR", [128, 128, 28, 28], "float32"], ["TENSOR", [128, 128, 3, 3], "float32"], 1, "SAME", 1, "float32"], {}], "config": {"index": 13976680, "code_hash": null, "entity": [["tile_f", "sp", [-1, 16, 1, 2]], ["tile_y", "sp", [-1, 4, 1, 7]], ["tile_x", "sp", [-1, 2, 1, 7]], ["tile_rc", "sp", [-1, 1]], ["tile_ry", "sp", [-1, 3]], ["tile_rx", "sp", [-1, 1]], ["auto_unroll_max_step", "ot", 1500], ["unroll_explicit", "ot", 0]]}, "result": [[5.4662856445], 0, 36.887075901031494, 1702579737.0872307], "version": 0.2, "tvm_version": "0.10.0"}
{"input": ["cuda -keys=cuda,gpu -arch=sm_86 -max_num_threads=1024 -thread_warp_size=32", "conv2d_nchw.cuda", [["TENSOR", [128, 128, 28, 28], "float32"], ["TENSOR", [128, 128, 3, 3], "float32"], 1, "SAME", 1, "float32"], {}], "config": {"index": 24929092, "code_hash": null, "entity": [["tile_f", "sp", [-1, 8, 4, 2]], ["tile_y", "sp", [-1, 1, 2, 2]], ["tile_x", "sp", [-1, 1, 2, 7]], ["tile_rc", "sp", [-1, 2]], ["tile_ry", "sp", [-1, 1]], ["tile_rx", "sp", [-1, 1]], ["auto_unroll_max_step", "ot", 512], ["unroll_explicit", "ot", 1]]}, "result": [[0.019267072], 0, 2.7208335399627686, 1702579738.0536838], "version": 0.2, "tvm_version": "0.10.0"}
{"input": ["cuda -keys=cuda,gpu -arch=sm_86 -max_num_threads=1024 -thread_warp_size=32", "conv2d_nchw.cuda", [["TENSOR", [128, 128, 28, 28], "float32"], ["TENSOR", [128, 128, 3, 3], "float32"], 1, "SAME", 1, "float32"], {}], "config": {"index": 14421359, "code_hash": null, "entity": [["tile_f", "sp", [-1, 1, 1, 128]], ["tile_y", "sp", [-1, 1, 28, 1]], ["tile_x", "sp", [-1, 14, 1, 1]], ["tile_rc", "sp", [-1, 8]], ["tile_ry", "sp", [-1, 3]], ["tile_rx", "sp", [-1, 1]], ["auto_unroll_max_step", "ot", 1500], ["unroll_explicit", "ot", 0]]}, "result": [[0.25466983025], 0, 4.168338775634766, 1702579750.1308942], "version": 0.2, "tvm_version": "0.10.0"}
{"input": ["cuda -keys=cuda,gpu -arch=sm_86 -max_num_threads=1024 -thread_warp_size=32", "conv2d_nchw.cuda", [["TENSOR", [128, 128, 28, 28], "float32"], ["TENSOR", [128, 128, 3, 3], "float32"], 1, "SAME", 1, "float32"], {}], "config": {"index": 1135684, "code_hash": null, "entity": [["tile_f", "sp", [-1, 16, 1, 1]], ["tile_y", "sp", [-1, 1, 7, 2]], ["tile_x", "sp", [-1, 1, 1, 14]], ["tile_rc", "sp", [-1, 32]], ["tile_ry", "sp", [-1, 1]], ["tile_rx", "sp", [-1, 1]], ["auto_unroll_max_step", "ot", 0], ["unroll_explicit", "ot", 0]]}, "result": [[0.22535859675], 0, 3.8277549743652344, 1702579752.0245788], "version": 0.2, "tvm_version": "0.10.0"}
{"input": ["cuda -keys=cuda,gpu -arch=sm_86 -max_num_threads=1024 -thread_warp_size=32", "conv2d_nchw.cuda", [["TENSOR", [128, 128, 28, 28], "float32"], ["TENSOR", [128, 128, 3, 3], "float32"], 1, "SAME", 1, "float32"], {}], "config": {"index": 29627110, "code_hash": null, "entity": [["tile_f", "sp", [-1, 1, 2, 4]], ["tile_y", "sp", [-1, 1, 7, 1]], ["tile_x", "sp", [-1, 1, 7, 1]], ["tile_rc", "sp", [-1, 4]], ["tile_ry", "sp", [-1, 3]], ["tile_rx", "sp", [-1, 3]], ["auto_unroll_max_step", "ot", 512], ["unroll_explicit", "ot", 1]]}, "result": [[0.005841003789473684], 0, 1.5890564918518066, 1702579752.9316297], "version": 0.2, "tvm_version": "0.10.0"}
{"input": ["cuda -keys=cuda,gpu -arch=sm_86 -max_num_threads=1024 -thread_warp_size=32", "conv2d_nchw.cuda", [["TENSOR", [128, 128, 28, 28], "float32"], ["TENSOR", [128, 128, 3, 3], "float32"], 1, "SAME", 1, "float32"], {}], "config": {"index": 22580832, "code_hash": null, "entity": [["tile_f", "sp", [-1, 4, 2, 4]], ["tile_y", "sp", [-1, 2, 7, 1]], ["tile_x", "sp", [-1, 1, 7, 2]], ["tile_rc", "sp", [-1, 32]], ["tile_ry", "sp", [-1, 1]], ["tile_rx", "sp", [-1, 3]], ["auto_unroll_max_step", "ot", 0], ["unroll_explicit", "ot", 1]]}, "result": [[0.0068319188], 0, 1.3672711849212646, 1702579753.852527], "version": 0.2, "tvm_version": "0.10.0"}
{"input": ["cuda -keys=cuda,gpu -arch=sm_86 -max_num_threads=1024 -thread_warp_size=32", "conv2d_nchw.cuda", [["TENSOR", [128, 128, 28, 28], "float32"], ["TENSOR", [128, 128, 3, 3], "float32"], 1, "SAME", 1, "float32"], {}], "config": {"index": 12610072, "code_hash": null, "entity": [["tile_f", "sp", [-1, 4, 1, 32]], ["tile_y", "sp", [-1, 7, 1, 1]], ["tile_x", "sp", [-1, 1, 1, 4]], ["tile_rc", "sp", [-1, 2]], ["tile_ry", "sp", [-1, 1]], ["tile_rx", "sp", [-1, 1]], ["auto_unroll_max_step", "ot", 1500], ["unroll_explicit", "ot", 0]]}, "result": [[3.29925390625], 0, 18.91184091567993, 1702579771.1231666], "version": 0.2, "tvm_version": "0.10.0"}
{"input": ["cuda -keys=cuda,gpu -arch=sm_86 -max_num_threads=1024 -thread_warp_size=32", "conv2d_nchw.cuda", [["TENSOR", [128, 128, 28, 28], "float32"], ["TENSOR", [128, 128, 3, 3], "float32"], 1, "SAME", 1, "float32"], {}], "config": {"index": 2213096, "code_hash": null, "entity": [["tile_f", "sp", [-1, 4, 8, 2]], ["tile_y", "sp", [-1, 4, 1, 1]], ["tile_x", "sp", [-1, 14, 1, 2]], ["tile_rc", "sp", [-1, 8]], ["tile_ry", "sp", [-1, 3]], ["tile_rx", "sp", [-1, 1]], ["auto_unroll_max_step", "ot", 0], ["unroll_explicit", "ot", 0]]}, "result": [[0.5207472532499999], 0, 8.249993801116943, 1702579774.507841], "version": 0.2, "tvm_version": "0.10.0"}
{"input": ["cuda -keys=cuda,gpu -arch=sm_86 -max_num_threads=1024 -thread_warp_size=32", "conv2d_nchw.cuda", [["TENSOR", [128, 128, 28, 28], "float32"], ["TENSOR", [128, 128, 3, 3], "float32"], 1, "SAME", 1, "float32"], {}], "config": {"index": 6269404, "code_hash": null, "entity": [["tile_f", "sp", [-1, 16, 1, 1]], ["tile_y", "sp", [-1, 28, 1, 1]], ["tile_x", "sp", [-1, 1, 14, 2]], ["tile_rc", "sp", [-1, 1]], ["tile_ry", "sp", [-1, 1]], ["tile_rx", "sp", [-1, 1]], ["auto_unroll_max_step", "ot", 512], ["unroll_explicit", "ot", 0]]}, "result": [[0.32247525], 0, 6.486046075820923, 1702579776.8991623], "version": 0.2, "tvm_version": "0.10.0"}
{"input": ["cuda -keys=cuda,gpu -arch=sm_86 -max_num_threads=1024 -thread_warp_size=32", "conv2d_nchw.cuda", [["TENSOR", [128, 128, 28, 28], "float32"], ["TENSOR", [128, 128, 3, 3], "float32"], 1, "SAME", 1, "float32"], {}], "config": {"index": 18569409, "code_hash": null, "entity": [["tile_f", "sp", [-1, 2, 2, 1]], ["tile_y", "sp", [-1, 2, 7, 2]], ["tile_x", "sp", [-1, 7, 1, 4]], ["tile_rc", "sp", [-1, 1]], ["tile_ry", "sp", [-1, 1]], ["tile_rx", "sp", [-1, 1]], ["auto_unroll_max_step", "ot", 0], ["unroll_explicit", "ot", 1]]}, "result": [[0.28689434799999997], 0, 4.372786521911621, 1702579779.106286], "version": 0.2, "tvm_version": "0.10.0"}
{"input": ["cuda -keys=cuda,gpu -arch=sm_86 -max_num_threads=1024 -thread_warp_size=32", "conv2d_nchw.cuda", [["TENSOR", [128, 128, 28, 28], "float32"], ["TENSOR", [128, 128, 3, 3], "float32"], 1, "SAME", 1, "float32"], {}], "config": {"index": 32508614, "code_hash": null, "entity": [["tile_f", "sp", [-1, 64, 2, 1]], ["tile_y", "sp", [-1, 2, 7, 2]], ["tile_x", "sp", [-1, 1, 7, 1]], ["tile_rc", "sp", [-1, 2]], ["tile_ry", "sp", [-1, 3]], ["tile_rx", "sp", [-1, 1]], ["auto_unroll_max_step", "ot", 1500], ["unroll_explicit", "ot", 1]]}, "result": [[0.007475703071428571], 0, 3.2487096786499023, 1702579780.00512], "version": 0.2, "tvm_version": "0.10.0"}
{"input": ["cuda -keys=cuda,gpu -arch=sm_86 -max_num_threads=1024 -thread_warp_size=32", "conv2d_nchw.cuda", [["TENSOR", [128, 128, 28, 28], "float32"], ["TENSOR", [128, 128, 3, 3], "float32"], 1, "SAME", 1, "float32"], {}], "config": {"index": 23287385, "code_hash": null, "entity": [["tile_f", "sp", [-1, 2, 1, 4]], ["tile_y", "sp", [-1, 14, 1, 2]], ["tile_x", "sp", [-1, 7, 4, 1]], ["tile_rc", "sp", [-1, 2]], ["tile_ry", "sp", [-1, 3]], ["tile_rx", "sp", [-1, 3]], ["auto_unroll_max_step", "ot", 0], ["unroll_explicit", "ot", 1]]}, "result": [[1.22493725575], 0, 11.450828075408936, 1702579786.9050608], "version": 0.2, "tvm_version": "0.10.0"}
{"input": ["cuda -keys=cuda,gpu -arch=sm_86 -max_num_threads=1024 -thread_warp_size=32", "conv2d_nchw.cuda", [["TENSOR", [128, 128, 28, 28], "float32"], ["TENSOR", [128, 128, 3, 3], "float32"], 1, "SAME", 1, "float32"], {}], "config": {"index": 24816861, "code_hash": null, "entity": [["tile_f", "sp", [-1, 1, 8, 1]], ["tile_y", "sp", [-1, 2, 2, 1]], ["tile_x", "sp", [-1, 1, 4, 1]], ["tile_rc", "sp", [-1, 2]], ["tile_ry", "sp", [-1, 1]], ["tile_rx", "sp", [-1, 1]], ["auto_unroll_max_step", "ot", 512], ["unroll_explicit", "ot", 1]]}, "result": [[0.018714623666666666], 0, 1.3371388912200928, 1702579798.7148612], "version": 0.2, "tvm_version": "0.10.0"}
{"input": ["cuda -keys=cuda,gpu -arch=sm_86 -max_num_threads=1024 -thread_warp_size=32", "conv2d_nchw.cuda", [["TENSOR", [128, 128, 28, 28], "float32"], ["TENSOR", [128, 128, 3, 3], "float32"], 1, "SAME", 1, "float32"], {}], "config": {"index": 6193246, "code_hash": null, "entity": [["tile_f", "sp", [-1, 8, 2, 2]], ["tile_y", "sp", [-1, 1, 4, 1]], ["tile_x", "sp", [-1, 1, 4, 1]], ["tile_rc", "sp", [-1, 1]], ["tile_ry", "sp", [-1, 1]], ["tile_rx", "sp", [-1, 1]], ["auto_unroll_max_step", "ot", 512], ["unroll_explicit", "ot", 0]]}, "result": [[0.014440008857142857], 0, 1.4342224597930908, 1702579799.6470826], "version": 0.2, "tvm_version": "0.10.0"}
{"input": ["cuda -keys=cuda,gpu -arch=sm_86 -max_num_threads=1024 -thread_warp_size=32", "conv2d_nchw.cuda", [["TENSOR", [128, 128, 28, 28], "float32"], ["TENSOR", [128, 128, 3, 3], "float32"], 1, "SAME", 1, "float32"], {}], "config": {"index": 4929510, "code_hash": null, "entity": [["tile_f", "sp", [-1, 1, 32, 1]], ["tile_y", "sp", [-1, 1, 1, 28]], ["tile_x", "sp", [-1, 1, 14, 2]], ["tile_rc", "sp", [-1, 2]], ["tile_ry", "sp", [-1, 3]], ["tile_rx", "sp", [-1, 3]], ["auto_unroll_max_step", "ot", 0], ["unroll_explicit", "ot", 0]]}, "result": [[0.0025093993902439026], 0, 1.4504027366638184, 1702579800.533575], "version": 0.2, "tvm_version": "0.10.0"}
{"input": ["cuda -keys=cuda,gpu -arch=sm_86 -max_num_threads=1024 -thread_warp_size=32", "conv2d_nchw.cuda", [["TENSOR", [128, 128, 28, 28], "float32"], ["TENSOR", [128, 128, 3, 3], "float32"], 1, "SAME", 1, "float32"], {}], "config": {"index": 26968210, "code_hash": null, "entity": [["tile_f", "sp", [-1, 4, 2, 1]], ["tile_y", "sp", [-1, 1, 14, 1]], ["tile_x", "sp", [-1, 1, 1, 2]], ["tile_rc", "sp", [-1, 16]], ["tile_ry", "sp", [-1, 3]], ["tile_rx", "sp", [-1, 1]], ["auto_unroll_max_step", "ot", 512], ["unroll_explicit", "ot", 1]]}, "result": [[0.00996473], 0, 2.251343011856079, 1702579801.4528525], "version": 0.2, "tvm_version": "0.10.0"}
{"input": ["cuda -keys=cuda,gpu -arch=sm_86 -max_num_threads=1024 -thread_warp_size=32", "conv2d_nchw.cuda", [["TENSOR", [128, 128, 28, 28], "float32"], ["TENSOR", [128, 128, 3, 3], "float32"], 1, "SAME", 1, "float32"], {}], "config": {"index": 9557525, "code_hash": null, "entity": [["tile_f", "sp", [-1, 32, 1, 1]], ["tile_y", "sp", [-1, 1, 2, 1]], ["tile_x", "sp", [-1, 2, 1, 7]], ["tile_rc", "sp", [-1, 2]], ["tile_ry", "sp", [-1, 1]], ["tile_rx", "sp", [-1, 3]], ["auto_unroll_max_step", "ot", 512], ["unroll_explicit", "ot", 0]]}, "result": [[1.1904693602499998], 0, 8.45107388496399, 1702579808.1790974], "version": 0.2, "tvm_version": "0.10.0"}
{"input": ["cuda -keys=cuda,gpu -arch=sm_86 -max_num_threads=1024 -thread_warp_size=32", "conv2d_nchw.cuda", [["TENSOR", [128, 128, 28, 28], "float32"], ["TENSOR", [128, 128, 3, 3], "float32"], 1, "SAME", 1, "float32"], {}], "config": {"index": 34493522, "code_hash": null, "entity": [["tile_f", "sp", [-1, 4, 1, 1]], ["tile_y", "sp", [-1, 1, 2, 1]], ["tile_x", "sp", [-1, 1, 14, 2]], ["tile_rc", "sp", [-1, 8]], ["tile_ry", "sp", [-1, 1]], ["tile_rx", "sp", [-1, 3]], ["auto_unroll_max_step", "ot", 1500], ["unroll_explicit", "ot", 1]]}, "result": [[0.005768299684210527], 0, 2.4011223316192627, 1702579809.102536], "version": 0.2, "tvm_version": "0.10.0"}
{"input": ["cuda -keys=cuda,gpu -arch=sm_86 -max_num_threads=1024 -thread_warp_size=32", "conv2d_nchw.cuda", [["TENSOR", [128, 128, 28, 28], "float32"], ["TENSOR", [128, 128, 3, 3], "float32"], 1, "SAME", 1, "float32"], {}], "config": {"index": 32348745, "code_hash": null, "entity": [["tile_f", "sp", [-1, 2, 2, 16]], ["tile_y", "sp", [-1, 1, 7, 1]], ["tile_x", "sp", [-1, 2, 1, 2]], ["tile_rc", "sp", [-1, 1]], ["tile_ry", "sp", [-1, 3]], ["tile_rx", "sp", [-1, 1]], ["auto_unroll_max_step", "ot", 1500], ["unroll_explicit", "ot", 1]]}, "result": [[0.005517084578947369], 0, 2.9510345458984375, 1702579810.007117], "version": 0.2, "tvm_version": "0.10.0"}
{"input": ["cuda -keys=cuda,gpu -arch=sm_86 -max_num_threads=1024 -thread_warp_size=32", "conv2d_nchw.cuda", [["TENSOR", [128, 128, 28, 28], "float32"], ["TENSOR", [128, 128, 3, 3], "float32"], 1, "SAME", 1, "float32"], {}], "config": {"index": 15904251, "code_hash": null, "entity": [["tile_f", "sp", [-1, 4, 4, 2]], ["tile_y", "sp", [-1, 1, 14, 1]], ["tile_x", "sp", [-1, 1, 2, 7]], ["tile_rc", "sp", [-1, 4]], ["tile_ry", "sp", [-1, 1]], ["tile_rx", "sp", [-1, 3]], ["auto_unroll_max_step", "ot", 1500], ["unroll_explicit", "ot", 0]]}, "result": [[0.0030003500294117644], 0, 1.759056568145752, 1702579947.4526527], "version": 0.2, "tvm_version": "0.10.0"}
{"input": ["cuda -keys=cuda,gpu -arch=sm_86 -max_num_threads=1024 -thread_warp_size=32", "conv2d_nchw.cuda", [["TENSOR", [128, 128, 28, 28], "float32"], ["TENSOR", [128, 128, 3, 3], "float32"], 1, "SAME", 1, "float32"], {}], "config": {"index": 34336251, "code_hash": null, "entity": [["tile_f", "sp", [-1, 4, 4, 2]], ["tile_y", "sp", [-1, 1, 14, 1]], ["tile_x", "sp", [-1, 1, 2, 7]], ["tile_rc", "sp", [-1, 4]], ["tile_ry", "sp", [-1, 1]], ["tile_rx", "sp", [-1, 3]], ["auto_unroll_max_step", "ot", 1500], ["unroll_explicit", "ot", 1]]}, "result": [[0.0029295176857142857], 0, 2.3720343112945557, 1702579948.3242488], "version": 0.2, "tvm_version": "0.10.0"}
{"input": ["cuda -keys=cuda,gpu -arch=sm_86 -max_num_threads=1024 -thread_warp_size=32", "conv2d_nchw.cuda", [["TENSOR", [128, 128, 28, 28], "float32"], ["TENSOR", [128, 128, 3, 3], "float32"], 1, "SAME", 1, "float32"], {}], "config": {"index": 34335895, "code_hash": null, "entity": [["tile_f", "sp", [-1, 2, 8, 2]], ["tile_y", "sp", [-1, 1, 7, 1]], ["tile_x", "sp", [-1, 1, 2, 7]], ["tile_rc", "sp", [-1, 4]], ["tile_ry", "sp", [-1, 1]], ["tile_rx", "sp", [-1, 3]], ["auto_unroll_max_step", "ot", 1500], ["unroll_explicit", "ot", 1]]}, "result": [[0.002993181257142857], 0, 2.728929281234741, 1702579949.2096217], "version": 0.2, "tvm_version": "0.10.0"}
{"input": ["cuda -keys=cuda,gpu -arch=sm_86 -max_num_threads=1024 -thread_warp_size=32", "conv2d_nchw.cuda", [["TENSOR", [128, 128, 28, 28], "float32"], ["TENSOR", [128, 128, 3, 3], "float32"], 1, "SAME", 1, "float32"], {}], "config": {"index": 15903895, "code_hash": null, "entity": [["tile_f", "sp", [-1, 2, 8, 2]], ["tile_y", "sp", [-1, 1, 7, 1]], ["tile_x", "sp", [-1, 1, 2, 7]], ["tile_rc", "sp", [-1, 4]], ["tile_ry", "sp", [-1, 1]], ["tile_rx", "sp", [-1, 3]], ["auto_unroll_max_step", "ot", 1500], ["unroll_explicit", "ot", 0]]}, "result": [[0.003019429428571429], 0, 1.7852694988250732, 1702579950.088946], "version": 0.2, "tvm_version": "0.10.0"}
{"input": ["cuda -keys=cuda,gpu -arch=sm_86 -max_num_threads=1024 -thread_warp_size=32", "conv2d_nchw.cuda", [["TENSOR", [128, 128, 28, 28], "float32"], ["TENSOR", [128, 128, 3, 3], "float32"], 1, "SAME", 1, "float32"], {}], "config": {"index": 14368250, "code_hash": null, "entity": [["tile_f", "sp", [-1, 2, 4, 2]], ["tile_y", "sp", [-1, 1, 14, 1]], ["tile_x", "sp", [-1, 1, 2, 7]], ["tile_rc", "sp", [-1, 4]], ["tile_ry", "sp", [-1, 3]], ["tile_rx", "sp", [-1, 1]], ["auto_unroll_max_step", "ot", 1500], ["unroll_explicit", "ot", 0]]}, "result": [[0.003486554774193548], 0, 2.000706672668457, 1702579950.9729447], "version": 0.2, "tvm_version": "0.10.0"}
{"input": ["cuda -keys=cuda,gpu -arch=sm_86 -max_num_threads=1024 -thread_warp_size=32", "conv2d_nchw.cuda", [["TENSOR", [128, 128, 28, 28], "float32"], ["TENSOR", [128, 128, 3, 3], "float32"], 1, "SAME", 1, "float32"], {}], "config": {"index": 32800250, "code_hash": null, "entity": [["tile_f", "sp", [-1, 2, 4, 2]], ["tile_y", "sp", [-1, 1, 14, 1]], ["tile_x", "sp", [-1, 1, 2, 7]], ["tile_rc", "sp", [-1, 4]], ["tile_ry", "sp", [-1, 3]], ["tile_rx", "sp", [-1, 1]], ["auto_unroll_max_step", "ot", 1500], ["unroll_explicit", "ot", 1]]}, "result": [[0.0035046730000000002], 0, 2.8037219047546387, 1702579951.8695607], "version": 0.2, "tvm_version": "0.10.0"}
{"input": ["cuda -keys=cuda,gpu -arch=sm_86 -max_num_threads=1024 -thread_warp_size=32", "conv2d_nchw.cuda", [["TENSOR", [128, 128, 28, 28], "float32"], ["TENSOR", [128, 128, 3, 3], "float32"], 1, "SAME", 1, "float32"], {}], "config": {"index": 9759895, "code_hash": null, "entity": [["tile_f", "sp", [-1, 2, 8, 2]], ["tile_y", "sp", [-1, 1, 7, 1]], ["tile_x", "sp", [-1, 1, 2, 7]], ["tile_rc", "sp", [-1, 4]], ["tile_ry", "sp", [-1, 1]], ["tile_rx", "sp", [-1, 3]], ["auto_unroll_max_step", "ot", 512], ["unroll_explicit", "ot", 0]]}, "result": [[0.0030401683142857144], 0, 1.6235706806182861, 1702579952.7443962], "version": 0.2, "tvm_version": "0.10.0"}
{"input": ["cuda -keys=cuda,gpu -arch=sm_86 -max_num_threads=1024 -thread_warp_size=32", "conv2d_nchw.cuda", [["TENSOR", [128, 128, 28, 28], "float32"], ["TENSOR", [128, 128, 3, 3], "float32"], 1, "SAME", 1, "float32"], {}], "config": {"index": 22047895, "code_hash": null, "entity": [["tile_f", "sp", [-1, 2, 8, 2]], ["tile_y", "sp", [-1, 1, 7, 1]], ["tile_x", "sp", [-1, 1, 2, 7]], ["tile_rc", "sp", [-1, 4]], ["tile_ry", "sp", [-1, 1]], ["tile_rx", "sp", [-1, 3]], ["auto_unroll_max_step", "ot", 0], ["unroll_explicit", "ot", 1]]}, "result": [[0.003528469333333333], 0, 1.4627397060394287, 1702579953.6259272], "version": 0.2, "tvm_version": "0.10.0"}
{"input": ["cuda -keys=cuda,gpu -arch=sm_86 -max_num_threads=1024 -thread_warp_size=32", "conv2d_nchw.cuda", [["TENSOR", [128, 128, 28, 28], "float32"], ["TENSOR", [128, 128, 3, 3], "float32"], 1, "SAME", 1, "float32"], {}], "config": {"index": 28191895, "code_hash": null, "entity": [["tile_f", "sp", [-1, 2, 8, 2]], ["tile_y", "sp", [-1, 1, 7, 1]], ["tile_x", "sp", [-1, 1, 2, 7]], ["tile_rc", "sp", [-1, 4]], ["tile_ry", "sp", [-1, 1]], ["tile_rx", "sp", [-1, 3]], ["auto_unroll_max_step", "ot", 512], ["unroll_explicit", "ot", 1]]}, "result": [[0.0030523978], 0, 1.9731721878051758, 1702579954.5029018], "version": 0.2, "tvm_version": "0.10.0"}
{"input": ["cuda -keys=cuda,gpu -arch=sm_86 -max_num_threads=1024 -thread_warp_size=32", "conv2d_nchw.cuda", [["TENSOR", [128, 128, 28, 28], "float32"], ["TENSOR", [128, 128, 3, 3], "float32"], 1, "SAME", 1, "float32"], {}], "config": {"index": 3615895, "code_hash": null, "entity": [["tile_f", "sp", [-1, 2, 8, 2]], ["tile_y", "sp", [-1, 1, 7, 1]], ["tile_x", "sp", [-1, 1, 2, 7]], ["tile_rc", "sp", [-1, 4]], ["tile_ry", "sp", [-1, 1]], ["tile_rx", "sp", [-1, 3]], ["auto_unroll_max_step", "ot", 0], ["unroll_explicit", "ot", 0]]}, "result": [[0.0035087018], 0, 1.5061171054840088, 1702579955.3951511], "version": 0.2, "tvm_version": "0.10.0"}
{"input": ["cuda -keys=cuda,gpu -arch=sm_86 -max_num_threads=1024 -thread_warp_size=32", "conv2d_nchw.cuda", [["TENSOR", [128, 128, 28, 28], "float32"], ["TENSOR", [128, 128, 3, 3], "float32"], 1, "SAME", 1, "float32"], {}], "config": {"index": 3616251, "code_hash": null, "entity": [["tile_f", "sp", [-1, 4, 4, 2]], ["tile_y", "sp", [-1, 1, 14, 1]], ["tile_x", "sp", [-1, 1, 2, 7]], ["tile_rc", "sp", [-1, 4]], ["tile_ry", "sp", [-1, 1]], ["tile_rx", "sp", [-1, 3]], ["auto_unroll_max_step", "ot", 0], ["unroll_explicit", "ot", 0]]}, "result": [[0.003106334], 0, 1.5529613494873047, 1702579956.2905848], "version": 0.2, "tvm_version": "0.10.0"}
{"input": ["cuda -keys=cuda,gpu -arch=sm_86 -max_num_threads=1024 -thread_warp_size=32", "conv2d_nchw.cuda", [["TENSOR", [128, 128, 28, 28], "float32"], ["TENSOR", [128, 128, 3, 3], "float32"], 1, "SAME", 1, "float32"], {}], "config": {"index": 28192251, "code_hash": null, "entity": [["tile_f", "sp", [-1, 4, 4, 2]], ["tile_y", "sp", [-1, 1, 14, 1]], ["tile_x", "sp", [-1, 1, 2, 7]], ["tile_rc", "sp", [-1, 4]], ["tile_ry", "sp", [-1, 1]], ["tile_rx", "sp", [-1, 3]], ["auto_unroll_max_step", "ot", 512], ["unroll_explicit", "ot", 1]]}, "result": [[0.0030618804411764707], 0, 1.8038537502288818, 1702579957.16895], "version": 0.2, "tvm_version": "0.10.0"}
{"input": ["cuda -keys=cuda,gpu -arch=sm_86 -max_num_threads=1024 -thread_warp_size=32", "conv2d_nchw.cuda", [["TENSOR", [128, 128, 28, 28], "float32"], ["TENSOR", [128, 128, 3, 3], "float32"], 1, "SAME", 1, "float32"], {}], "config": {"index": 22048251, "code_hash": null, "entity": [["tile_f", "sp", [-1, 4, 4, 2]], ["tile_y", "sp", [-1, 1, 14, 1]], ["tile_x", "sp", [-1, 1, 2, 7]], ["tile_rc", "sp", [-1, 4]], ["tile_ry", "sp", [-1, 1]], ["tile_rx", "sp", [-1, 3]], ["auto_unroll_max_step", "ot", 0], ["unroll_explicit", "ot", 1]]}, "result": [[0.0031154596470588237], 0, 1.5357160568237305, 1702579958.0633812], "version": 0.2, "tvm_version": "0.10.0"}
{"input": ["cuda -keys=cuda,gpu -arch=sm_86 -max_num_threads=1024 -thread_warp_size=32", "conv2d_nchw.cuda", [["TENSOR", [128, 128, 28, 28], "float32"], ["TENSOR", [128, 128, 3, 3], "float32"], 1, "SAME", 1, "float32"], {}], "config": {"index": 9760251, "code_hash": null, "entity": [["tile_f", "sp", [-1, 4, 4, 2]], ["tile_y", "sp", [-1, 1, 14, 1]], ["tile_x", "sp", [-1, 1, 2, 7]], ["tile_rc", "sp", [-1, 4]], ["tile_ry", "sp", [-1, 1]], ["tile_rx", "sp", [-1, 3]], ["auto_unroll_max_step", "ot", 512], ["unroll_explicit", "ot", 0]]}, "result": [[0.0031183509705882354], 0, 1.6213860511779785, 1702579958.9733233], "version": 0.2, "tvm_version": "0.10.0"}
{"input": ["cuda -keys=cuda,gpu -arch=sm_86 -max_num_threads=1024 -thread_warp_size=32", "conv2d_nchw.cuda", [["TENSOR", [128, 128, 28, 28], "float32"], ["TENSOR", [128, 128, 3, 3], "float32"], 1, "SAME", 1, "float32"], {}], "config": {"index": 9577517, "code_hash": null, "entity": [["tile_f", "sp", [-1, 4, 4, 4]], ["tile_y", "sp", [-1, 1, 7, 1]], ["tile_x", "sp", [-1, 1, 4, 7]], ["tile_rc", "sp", [-1, 2]], ["tile_ry", "sp", [-1, 1]], ["tile_rx", "sp", [-1, 3]], ["auto_unroll_max_step", "ot", 512], ["unroll_explicit", "ot", 0]]}, "result": [[0.0023856014666666665], 0, 1.435384750366211, 1702579959.846072], "version": 0.2, "tvm_version": "0.10.0"}
{"input": ["cuda -keys=cuda,gpu -arch=sm_86 -max_num_threads=1024 -thread_warp_size=32", "conv2d_nchw.cuda", [["TENSOR", [128, 128, 28, 28], "float32"], ["TENSOR", [128, 128, 3, 3], "float32"], 1, "SAME", 1, "float32"], {}], "config": {"index": 3433517, "code_hash": null, "entity": [["tile_f", "sp", [-1, 4, 4, 4]], ["tile_y", "sp", [-1, 1, 7, 1]], ["tile_x", "sp", [-1, 1, 4, 7]], ["tile_rc", "sp", [-1, 2]], ["tile_ry", "sp", [-1, 1]], ["tile_rx", "sp", [-1, 3]], ["auto_unroll_max_step", "ot", 0], ["unroll_explicit", "ot", 0]]}, "result": [[0.002412171613636364], 0, 1.4363856315612793, 1702579960.7586298], "version": 0.2, "tvm_version": "0.10.0"}
{"input": ["cuda -keys=cuda,gpu -arch=sm_86 -max_num_threads=1024 -thread_warp_size=32", "conv2d_nchw.cuda", [["TENSOR", [128, 128, 28, 28], "float32"], ["TENSOR", [128, 128, 3, 3], "float32"], 1, "SAME", 1, "float32"], {}], "config": {"index": 21865517, "code_hash": null, "entity": [["tile_f", "sp", [-1, 4, 4, 4]], ["tile_y", "sp", [-1, 1, 7, 1]], ["tile_x", "sp", [-1, 1, 4, 7]], ["tile_rc", "sp", [-1, 2]], ["tile_ry", "sp", [-1, 1]], ["tile_rx", "sp", [-1, 3]], ["auto_unroll_max_step", "ot", 0], ["unroll_explicit", "ot", 1]]}, "result": [[0.0026558247368421053], 0, 1.6443641185760498, 1702579963.561172], "version": 0.2, "tvm_version": "0.10.0"}
{"input": ["cuda -keys=cuda,gpu -arch=sm_86 -max_num_threads=1024 -thread_warp_size=32", "conv2d_nchw.cuda", [["TENSOR", [128, 128, 28, 28], "float32"], ["TENSOR", [128, 128, 3, 3], "float32"], 1, "SAME", 1, "float32"], {}], "config": {"index": 28009517, "code_hash": null, "entity": [["tile_f", "sp", [-1, 4, 4, 4]], ["tile_y", "sp", [-1, 1, 7, 1]], ["tile_x", "sp", [-1, 1, 4, 7]], ["tile_rc", "sp", [-1, 2]], ["tile_ry", "sp", [-1, 1]], ["tile_rx", "sp", [-1, 3]], ["auto_unroll_max_step", "ot", 512], ["unroll_explicit", "ot", 1]]}, "result": [[0.00228149314893617], 0, 2.128011703491211, 1702579964.4373693], "version": 0.2, "tvm_version": "0.10.0"}
{"input": ["cuda -keys=cuda,gpu -arch=sm_86 -max_num_threads=1024 -thread_warp_size=32", "conv2d_nchw.cuda", [["TENSOR", [128, 128, 28, 28], "float32"], ["TENSOR", [128, 128, 3, 3], "float32"], 1, "SAME", 1, "float32"], {}], "config": {"index": 9769496, "code_hash": null, "entity": [["tile_f", "sp", [-1, 4, 8, 2]], ["tile_y", "sp", [-1, 1, 7, 1]], ["tile_x", "sp", [-1, 1, 4, 7]], ["tile_rc", "sp", [-1, 4]], ["tile_ry", "sp", [-1, 1]], ["tile_rx", "sp", [-1, 3]], ["auto_unroll_max_step", "ot", 512], ["unroll_explicit", "ot", 0]]}, "result": [[0.002378751909090909], 0, 1.4927079677581787, 1702579965.3086576], "version": 0.2, "tvm_version": "0.10.0"}
{"input": ["cuda -keys=cuda,gpu -arch=sm_86 -max_num_threads=1024 -thread_warp_size=32", "conv2d_nchw.cuda", [["TENSOR", [128, 128, 28, 28], "float32"], ["TENSOR", [128, 128, 3, 3], "float32"], 1, "SAME", 1, "float32"], {}], "config": {"index": 22057496, "code_hash": null, "entity": [["tile_f", "sp", [-1, 4, 8, 2]], ["tile_y", "sp", [-1, 1, 7, 1]], ["tile_x", "sp", [-1, 1, 4, 7]], ["tile_rc", "sp", [-1, 4]], ["tile_ry", "sp", [-1, 1]], ["tile_rx", "sp", [-1, 3]], ["auto_unroll_max_step", "ot", 0], ["unroll_explicit", "ot", 1]]}, "result": [[0.0023845235454545456], 0, 1.5158374309539795, 1702579966.2184262], "version": 0.2, "tvm_version": "0.10.0"}
{"input": ["cuda -keys=cuda,gpu -arch=sm_86 -max_num_threads=1024 -thread_warp_size=32", "conv2d_nchw.cuda", [["TENSOR", [128, 128, 28, 28], "float32"], ["TENSOR", [128, 128, 3, 3], "float32"], 1, "SAME", 1, "float32"], {}], "config": {"index": 28201496, "code_hash": null, "entity": [["tile_f", "sp", [-1, 4, 8, 2]], ["tile_y", "sp", [-1, 1, 7, 1]], ["tile_x", "sp", [-1, 1, 4, 7]], ["tile_rc", "sp", [-1, 4]], ["tile_ry", "sp", [-1, 1]], ["tile_rx", "sp", [-1, 3]], ["auto_unroll_max_step", "ot", 512], ["unroll_explicit", "ot", 1]]}, "result": [[0.0022852063260869566], 0, 1.7183690071105957, 1702579967.0877848], "version": 0.2, "tvm_version": "0.10.0"}
{"input": ["cuda -keys=cuda,gpu -arch=sm_86 -max_num_threads=1024 -thread_warp_size=32", "conv2d_nchw.cuda", [["TENSOR", [128, 128, 28, 28], "float32"], ["TENSOR", [128, 128, 3, 3], "float32"], 1, "SAME", 1, "float32"], {}], "config": {"index": 3625496, "code_hash": null, "entity": [["tile_f", "sp", [-1, 4, 8, 2]], ["tile_y", "sp", [-1, 1, 7, 1]], ["tile_x", "sp", [-1, 1, 4, 7]], ["tile_rc", "sp", [-1, 4]], ["tile_ry", "sp", [-1, 1]], ["tile_rx", "sp", [-1, 3]], ["auto_unroll_max_step", "ot", 0], ["unroll_explicit", "ot", 0]]}, "result": [[0.002388898840909091], 0, 1.524106740951538, 1702579968.0156643], "version": 0.2, "tvm_version": "0.10.0"}
{"input": ["cuda -keys=cuda,gpu -arch=sm_86 -max_num_threads=1024 -thread_warp_size=32", "conv2d_nchw.cuda", [["TENSOR", [128, 128, 28, 28], "float32"], ["TENSOR", [128, 128, 3, 3], "float32"], 1, "SAME", 1, "float32"], {}], "config": {"index": 14367895, "code_hash": null, "entity": [["tile_f", "sp", [-1, 2, 8, 2]], ["tile_y", "sp", [-1, 1, 7, 1]], ["tile_x", "sp", [-1, 1, 2, 7]], ["tile_rc", "sp", [-1, 4]], ["tile_ry", "sp", [-1, 3]], ["tile_rx", "sp", [-1, 1]], ["auto_unroll_max_step", "ot", 1500], ["unroll_explicit", "ot", 0]]}, "result": [[0.0032652509090909092], 0, 1.9014265537261963, 1702579968.9130917], "version": 0.2, "tvm_version": "0.10.0"}
{"input": ["cuda -keys=cuda,gpu -arch=sm_86 -max_num_threads=1024 -thread_warp_size=32", "conv2d_nchw.cuda", [["TENSOR", [128, 128, 28, 28], "float32"], ["TENSOR", [128, 128, 3, 3], "float32"], 1, "SAME", 1, "float32"], {}], "config": {"index": 32799895, "code_hash": null, "entity": [["tile_f", "sp", [-1, 2, 8, 2]], ["tile_y", "sp", [-1, 1, 7, 1]], ["tile_x", "sp", [-1, 1, 2, 7]], ["tile_rc", "sp", [-1, 4]], ["tile_ry", "sp", [-1, 3]], ["tile_rx", "sp", [-1, 1]], ["auto_unroll_max_step", "ot", 1500], ["unroll_explicit", "ot", 1]]}, "result": [[0.0031908732941176472], 0, 2.682781457901001, 1702579969.806643], "version": 0.2, "tvm_version": "0.10.0"}
{"input": ["cuda -keys=cuda,gpu -arch=sm_86 -max_num_threads=1024 -thread_warp_size=32", "conv2d_nchw.cuda", [["TENSOR", [128, 128, 28, 28], "float32"], ["TENSOR", [128, 128, 3, 3], "float32"], 1, "SAME", 1, "float32"], {}], "config": {"index": 34345491, "code_hash": null, "entity": [["tile_f", "sp", [-1, 4, 4, 2]], ["tile_y", "sp", [-1, 1, 7, 1]], ["tile_x", "sp", [-1, 1, 4, 7]], ["tile_rc", "sp", [-1, 4]], ["tile_ry", "sp", [-1, 1]], ["tile_rx", "sp", [-1, 3]], ["auto_unroll_max_step", "ot", 1500], ["unroll_explicit", "ot", 1]]}, "result": [[0.002011211814814815], 0, 2.268575668334961, 1702579970.6992137], "version": 0.2, "tvm_version": "0.10.0"}
{"input": ["cuda -keys=cuda,gpu -arch=sm_86 -max_num_threads=1024 -thread_warp_size=32", "conv2d_nchw.cuda", [["TENSOR", [128, 128, 28, 28], "float32"], ["TENSOR", [128, 128, 3, 3], "float32"], 1, "SAME", 1, "float32"], {}], "config": {"index": 15913491, "code_hash": null, "entity": [["tile_f", "sp", [-1, 4, 4, 2]], ["tile_y", "sp", [-1, 1, 7, 1]], ["tile_x", "sp", [-1, 1, 4, 7]], ["tile_rc", "sp", [-1, 4]], ["tile_ry", "sp", [-1, 1]], ["tile_rx", "sp", [-1, 3]], ["auto_unroll_max_step", "ot", 1500], ["unroll_explicit", "ot", 0]]}, "result": [[0.002468977813953488], 0, 1.7251176834106445, 1702579971.5768616], "version": 0.2, "tvm_version": "0.10.0"}
{"input": ["cuda -keys=cuda,gpu -arch=sm_86 -max_num_threads=1024 -thread_warp_size=32", "conv2d_nchw.cuda", [["TENSOR", [128, 128, 28, 28], "float32"], ["TENSOR", [128, 128, 3, 3], "float32"], 1, "SAME", 1, "float32"], {}], "config": {"index": 34153517, "code_hash": null, "entity": [["tile_f", "sp", [-1, 4, 4, 4]], ["tile_y", "sp", [-1, 1, 7, 1]], ["tile_x", "sp", [-1, 1, 4, 7]], ["tile_rc", "sp", [-1, 2]], ["tile_ry", "sp", [-1, 1]], ["tile_rx", "sp", [-1, 3]], ["auto_unroll_max_step", "ot", 1500], ["unroll_explicit", "ot", 1]]}, "result": [[0.002252691063829787], 0, 2.387446165084839, 1702579972.4572303], "version": 0.2, "tvm_version": "0.10.0"}
{"input": ["cuda -keys=cuda,gpu -arch=sm_86 -max_num_threads=1024 -thread_warp_size=32", "conv2d_nchw.cuda", [["TENSOR", [128, 128, 28, 28], "float32"], ["TENSOR", [128, 128, 3, 3], "float32"], 1, "SAME", 1, "float32"], {}], "config": {"index": 15721517, "code_hash": null, "entity": [["tile_f", "sp", [-1, 4, 4, 4]], ["tile_y", "sp", [-1, 1, 7, 1]], ["tile_x", "sp", [-1, 1, 4, 7]], ["tile_rc", "sp", [-1, 2]], ["tile_ry", "sp", [-1, 1]], ["tile_rx", "sp", [-1, 3]], ["auto_unroll_max_step", "ot", 1500], ["unroll_explicit", "ot", 0]]}, "result": [[0.0026072832], 0, 1.7977573871612549, 1702579973.3434541], "version": 0.2, "tvm_version": "0.10.0"}
{"input": ["cuda -keys=cuda,gpu -arch=sm_86 -max_num_threads=1024 -thread_warp_size=32", "conv2d_nchw.cuda", [["TENSOR", [128, 128, 28, 28], "float32"], ["TENSOR", [128, 128, 3, 3], "float32"], 1, "SAME", 1, "float32"], {}], "config": {"index": 8224250, "code_hash": null, "entity": [["tile_f", "sp", [-1, 2, 4, 2]], ["tile_y", "sp", [-1, 1, 14, 1]], ["tile_x", "sp", [-1, 1, 2, 7]], ["tile_rc", "sp", [-1, 4]], ["tile_ry", "sp", [-1, 3]], ["tile_rx", "sp", [-1, 1]], ["auto_unroll_max_step", "ot", 512], ["unroll_explicit", "ot", 0]]}, "result": [[0.0034756540967741936], 0, 1.661250352859497, 1702579974.2364876], "version": 0.2, "tvm_version": "0.10.0"}
{"input": ["cuda -keys=cuda,gpu -arch=sm_86 -max_num_threads=1024 -thread_warp_size=32", "conv2d_nchw.cuda", [["TENSOR", [128, 128, 28, 28], "float32"], ["TENSOR", [128, 128, 3, 3], "float32"], 1, "SAME", 1, "float32"], {}], "config": {"index": 20512250, "code_hash": null, "entity": [["tile_f", "sp", [-1, 2, 4, 2]], ["tile_y", "sp", [-1, 1, 14, 1]], ["tile_x", "sp", [-1, 1, 2, 7]], ["tile_rc", "sp", [-1, 4]], ["tile_ry", "sp", [-1, 3]], ["tile_rx", "sp", [-1, 1]], ["auto_unroll_max_step", "ot", 0], ["unroll_explicit", "ot", 1]]}, "result": [[0.00423498826923077], 0, 1.4012970924377441, 1702579975.1301098], "version": 0.2, "tvm_version": "0.10.0"}
{"input": ["cuda -keys=cuda,gpu -arch=sm_86 -max_num_threads=1024 -thread_warp_size=32", "conv2d_nchw.cuda", [["TENSOR", [128, 128, 28, 28], "float32"], ["TENSOR", [128, 128, 3, 3], "float32"], 1, "SAME", 1, "float32"], {}], "config": {"index": 2080250, "code_hash": null, "entity": [["tile_f", "sp", [-1, 2, 4, 2]], ["tile_y", "sp", [-1, 1, 14, 1]], ["tile_x", "sp", [-1, 1, 2, 7]], ["tile_rc", "sp", [-1, 4]], ["tile_ry", "sp", [-1, 3]], ["tile_rx", "sp", [-1, 1]], ["auto_unroll_max_step", "ot", 0], ["unroll_explicit", "ot", 0]]}, "result": [[0.004246447923076923], 0, 1.423835039138794, 1702579976.0262978], "version": 0.2, "tvm_version": "0.10.0"}
{"input": ["cuda -keys=cuda,gpu -arch=sm_86 -max_num_threads=1024 -thread_warp_size=32", "conv2d_nchw.cuda", [["TENSOR", [128, 128, 28, 28], "float32"], ["TENSOR", [128, 128, 3, 3], "float32"], 1, "SAME", 1, "float32"], {}], "config": {"index": 26656250, "code_hash": null, "entity": [["tile_f", "sp", [-1, 2, 4, 2]], ["tile_y", "sp", [-1, 1, 14, 1]], ["tile_x", "sp", [-1, 1, 2, 7]], ["tile_rc", "sp", [-1, 4]], ["tile_ry", "sp", [-1, 3]], ["tile_rx", "sp", [-1, 1]], ["auto_unroll_max_step", "ot", 512], ["unroll_explicit", "ot", 1]]}, "result": [[0.0034182770967741936], 0, 1.9805686473846436, 1702579976.909582], "version": 0.2, "tvm_version": "0.10.0"}
{"input": ["cuda -keys=cuda,gpu -arch=sm_86 -max_num_threads=1024 -thread_warp_size=32", "conv2d_nchw.cuda", [["TENSOR", [128, 128, 28, 28], "float32"], ["TENSOR", [128, 128, 3, 3], "float32"], 1, "SAME", 1, "float32"], {}], "config": {"index": 15913496, "code_hash": null, "entity": [["tile_f", "sp", [-1, 4, 8, 2]], ["tile_y", "sp", [-1, 1, 7, 1]], ["tile_x", "sp", [-1, 1, 4, 7]], ["tile_rc", "sp", [-1, 4]], ["tile_ry", "sp", [-1, 1]], ["tile_rx", "sp", [-1, 3]], ["auto_unroll_max_step", "ot", 1500], ["unroll_explicit", "ot", 0]]}, "result": [[0.00298303496], 0, 1.8778281211853027, 1702579979.6887045], "version": 0.2, "tvm_version": "0.10.0"}
{"input": ["cuda -keys=cuda,gpu -arch=sm_86 -max_num_threads=1024 -thread_warp_size=32", "conv2d_nchw.cuda", [["TENSOR", [128, 128, 28, 28], "float32"], ["TENSOR", [128, 128, 3, 3], "float32"], 1, "SAME", 1, "float32"], {}], "config": {"index": 34345496, "code_hash": null, "entity": [["tile_f", "sp", [-1, 4, 8, 2]], ["tile_y", "sp", [-1, 1, 7, 1]], ["tile_x", "sp", [-1, 1, 4, 7]], ["tile_rc", "sp", [-1, 4]], ["tile_ry", "sp", [-1, 1]], ["tile_rx", "sp", [-1, 3]], ["auto_unroll_max_step", "ot", 1500], ["unroll_explicit", "ot", 1]]}, "result": [[0.0020765715882352944], 0, 2.2764017581939697, 1702579980.5775657], "version": 0.2, "tvm_version": "0.10.0"}
{"input": ["cuda -keys=cuda,gpu -arch=sm_86 -max_num_threads=1024 -thread_warp_size=32", "conv2d_nchw.cuda", [["TENSOR", [128, 128, 28, 28], "float32"], ["TENSOR", [128, 128, 3, 3], "float32"], 1, "SAME", 1, "float32"], {}], "config": {"index": 34335896, "code_hash": null, "entity": [["tile_f", "sp", [-1, 4, 8, 2]], ["tile_y", "sp", [-1, 1, 7, 1]], ["tile_x", "sp", [-1, 1, 2, 7]], ["tile_rc", "sp", [-1, 4]], ["tile_ry", "sp", [-1, 1]], ["tile_rx", "sp", [-1, 3]], ["auto_unroll_max_step", "ot", 1500], ["unroll_explicit", "ot", 1]]}, "result": [[0.0022933896595744682], 0, 2.3613345623016357, 1702579981.4637408], "version": 0.2, "tvm_version": "0.10.0"}
{"input": ["cuda -keys=cuda,gpu -arch=sm_86 -max_num_threads=1024 -thread_warp_size=32", "conv2d_nchw.cuda", [["TENSOR", [128, 128, 28, 28], "float32"], ["TENSOR", [128, 128, 3, 3], "float32"], 1, "SAME", 1, "float32"], {}], "config": {"index": 15903896, "code_hash": null, "entity": [["tile_f", "sp", [-1, 4, 8, 2]], ["tile_y", "sp", [-1, 1, 7, 1]], ["tile_x", "sp", [-1, 1, 2, 7]], ["tile_rc", "sp", [-1, 4]], ["tile_ry", "sp", [-1, 1]], ["tile_rx", "sp", [-1, 3]], ["auto_unroll_max_step", "ot", 1500], ["unroll_explicit", "ot", 0]]}, "result": [[0.0027195338461538463], 0, 1.8066582679748535, 1702579982.3377166], "version": 0.2, "tvm_version": "0.10.0"}
{"input": ["cuda -keys=cuda,gpu -arch=sm_86 -max_num_threads=1024 -thread_warp_size=32", "conv2d_nchw.cuda", [["TENSOR", [128, 128, 28, 28], "float32"], ["TENSOR", [128, 128, 3, 3], "float32"], 1, "SAME", 1, "float32"], {}], "config": {"index": 2079895, "code_hash": null, "entity": [["tile_f", "sp", [-1, 2, 8, 2]], ["tile_y", "sp", [-1, 1, 7, 1]], ["tile_x", "sp", [-1, 1, 2, 7]], ["tile_rc", "sp", [-1, 4]], ["tile_ry", "sp", [-1, 3]], ["tile_rx", "sp", [-1, 1]], ["auto_unroll_max_step", "ot", 0], ["unroll_explicit", "ot", 0]]}, "result": [[0.003988972962962963], 0, 1.4621615409851074, 1702579983.2208438], "version": 0.2, "tvm_version": "0.10.0"}
{"input": ["cuda -keys=cuda,gpu -arch=sm_86 -max_num_threads=1024 -thread_warp_size=32", "conv2d_nchw.cuda", [["TENSOR", [128, 128, 28, 28], "float32"], ["TENSOR", [128, 128, 3, 3], "float32"], 1, "SAME", 1, "float32"], {}], "config": {"index": 20511895, "code_hash": null, "entity": [["tile_f", "sp", [-1, 2, 8, 2]], ["tile_y", "sp", [-1, 1, 7, 1]], ["tile_x", "sp", [-1, 1, 2, 7]], ["tile_rc", "sp", [-1, 4]], ["tile_ry", "sp", [-1, 3]], ["tile_rx", "sp", [-1, 1]], ["auto_unroll_max_step", "ot", 0], ["unroll_explicit", "ot", 1]]}, "result": [[0.00395093337037037], 0, 1.4551124572753906, 1702579984.145683], "version": 0.2, "tvm_version": "0.10.0"}
{"input": ["cuda -keys=cuda,gpu -arch=sm_86 -max_num_threads=1024 -thread_warp_size=32", "conv2d_nchw.cuda", [["TENSOR", [128, 128, 28, 28], "float32"], ["TENSOR", [128, 128, 3, 3], "float32"], 1, "SAME", 1, "float32"], {}], "config": {"index": 26655895, "code_hash": null, "entity": [["tile_f", "sp", [-1, 2, 8, 2]], ["tile_y", "sp", [-1, 1, 7, 1]], ["tile_x", "sp", [-1, 1, 2, 7]], ["tile_rc", "sp", [-1, 4]], ["tile_ry", "sp", [-1, 3]], ["tile_rx", "sp", [-1, 1]], ["auto_unroll_max_step", "ot", 512], ["unroll_explicit", "ot", 1]]}, "result": [[0.003233995323529412], 0, 1.8787026405334473, 1702579985.0214338], "version": 0.2, "tvm_version": "0.10.0"}
{"input": ["cuda -keys=cuda,gpu -arch=sm_86 -max_num_threads=1024 -thread_warp_size=32", "conv2d_nchw.cuda", [["TENSOR", [128, 128, 28, 28], "float32"], ["TENSOR", [128, 128, 3, 3], "float32"], 1, "SAME", 1, "float32"], {}], "config": {"index": 8223895, "code_hash": null, "entity": [["tile_f", "sp", [-1, 2, 8, 2]], ["tile_y", "sp", [-1, 1, 7, 1]], ["tile_x", "sp", [-1, 1, 2, 7]], ["tile_rc", "sp", [-1, 4]], ["tile_ry", "sp", [-1, 3]], ["tile_rx", "sp", [-1, 1]], ["auto_unroll_max_step", "ot", 512], ["unroll_explicit", "ot", 0]]}, "result": [[0.00335267209375], 0, 1.6408393383026123, 1702579985.9162076], "version": 0.2, "tvm_version": "0.10.0"}
{"input": ["cuda -keys=cuda,gpu -arch=sm_86 -max_num_threads=1024 -thread_warp_size=32", "conv2d_nchw.cuda", [["TENSOR", [128, 128, 28, 28], "float32"], ["TENSOR", [128, 128, 3, 3], "float32"], 1, "SAME", 1, "float32"], {}], "config": {"index": 15904250, "code_hash": null, "entity": [["tile_f", "sp", [-1, 2, 4, 2]], ["tile_y", "sp", [-1, 1, 14, 1]], ["tile_x", "sp", [-1, 1, 2, 7]], ["tile_rc", "sp", [-1, 4]], ["tile_ry", "sp", [-1, 1]], ["tile_rx", "sp", [-1, 3]], ["auto_unroll_max_step", "ot", 1500], ["unroll_explicit", "ot", 0]]}, "result": [[0.004239274625], 0, 1.761889934539795, 1702579986.8090093], "version": 0.2, "tvm_version": "0.10.0"}
{"input": ["cuda -keys=cuda,gpu -arch=sm_86 -max_num_threads=1024 -thread_warp_size=32", "conv2d_nchw.cuda", [["TENSOR", [128, 128, 28, 28], "float32"], ["TENSOR", [128, 128, 3, 3], "float32"], 1, "SAME", 1, "float32"], {}], "config": {"index": 34336250, "code_hash": null, "entity": [["tile_f", "sp", [-1, 2, 4, 2]], ["tile_y", "sp", [-1, 1, 14, 1]], ["tile_x", "sp", [-1, 1, 2, 7]], ["tile_rc", "sp", [-1, 4]], ["tile_ry", "sp", [-1, 1]], ["tile_rx", "sp", [-1, 3]], ["auto_unroll_max_step", "ot", 1500], ["unroll_explicit", "ot", 1]]}, "result": [[0.004117586039999999], 0, 2.5231919288635254, 1702579987.6936083], "version": 0.2, "tvm_version": "0.10.0"}
{"input": ["cuda -keys=cuda,gpu -arch=sm_86 -max_num_threads=1024 -thread_warp_size=32", "conv2d_nchw.cuda", [["TENSOR", [128, 128, 28, 28], "float32"], ["TENSOR", [128, 128, 3, 3], "float32"], 1, "SAME", 1, "float32"], {}], "config": {"index": 15913495, "code_hash": null, "entity": [["tile_f", "sp", [-1, 2, 8, 2]], ["tile_y", "sp", [-1, 1, 7, 1]], ["tile_x", "sp", [-1, 1, 4, 7]], ["tile_rc", "sp", [-1, 4]], ["tile_ry", "sp", [-1, 1]], ["tile_rx", "sp", [-1, 3]], ["auto_unroll_max_step", "ot", 1500], ["unroll_explicit", "ot", 0]]}, "result": [[0.002475599581395349], 0, 1.6451869010925293, 1702579988.5753736], "version": 0.2, "tvm_version": "0.10.0"}
{"input": ["cuda -keys=cuda,gpu -arch=sm_86 -max_num_threads=1024 -thread_warp_size=32", "conv2d_nchw.cuda", [["TENSOR", [128, 128, 28, 28], "float32"], ["TENSOR", [128, 128, 3, 3], "float32"], 1, "SAME", 1, "float32"], {}], "config": {"index": 34345495, "code_hash": null, "entity": [["tile_f", "sp", [-1, 2, 8, 2]], ["tile_y", "sp", [-1, 1, 7, 1]], ["tile_x", "sp", [-1, 1, 4, 7]], ["tile_rc", "sp", [-1, 4]], ["tile_ry", "sp", [-1, 1]], ["tile_rx", "sp", [-1, 3]], ["auto_unroll_max_step", "ot", 1500], ["unroll_explicit", "ot", 1]]}, "result": [[0.002261141291666667], 0, 2.4601950645446777, 1702579989.464083], "version": 0.2, "tvm_version": "0.10.0"}
{"input": ["cuda -keys=cuda,gpu -arch=sm_86 -max_num_threads=1024 -thread_warp_size=32", "conv2d_nchw.cuda", [["TENSOR", [128, 128, 28, 28], "float32"], ["TENSOR", [128, 128, 3, 3], "float32"], 1, "SAME", 1, "float32"], {}], "config": {"index": 3615896, "code_hash": null, "entity": [["tile_f", "sp", [-1, 4, 8, 2]], ["tile_y", "sp", [-1, 1, 7, 1]], ["tile_x", "sp", [-1, 1, 2, 7]], ["tile_rc", "sp", [-1, 4]], ["tile_ry", "sp", [-1, 1]], ["tile_rx", "sp", [-1, 3]], ["auto_unroll_max_step", "ot", 0], ["unroll_explicit", "ot", 0]]}, "result": [[0.002823545342105263], 0, 1.4873661994934082, 1702579990.3549635], "version": 0.2, "tvm_version": "0.10.0"}
{"input": ["cuda -keys=cuda,gpu -arch=sm_86 -max_num_threads=1024 -thread_warp_size=32", "conv2d_nchw.cuda", [["TENSOR", [128, 128, 28, 28], "float32"], ["TENSOR", [128, 128, 3, 3], "float32"], 1, "SAME", 1, "float32"], {}], "config": {"index": 9759896, "code_hash": null, "entity": [["tile_f", "sp", [-1, 4, 8, 2]], ["tile_y", "sp", [-1, 1, 7, 1]], ["tile_x", "sp", [-1, 1, 2, 7]], ["tile_rc", "sp", [-1, 4]], ["tile_ry", "sp", [-1, 1]], ["tile_rx", "sp", [-1, 3]], ["auto_unroll_max_step", "ot", 512], ["unroll_explicit", "ot", 0]]}, "result": [[0.0028282071052631577], 0, 1.5613765716552734, 1702579991.2710195], "version": 0.2, "tvm_version": "0.10.0"}
{"input": ["cuda -keys=cuda,gpu -arch=sm_86 -max_num_threads=1024 -thread_warp_size=32", "conv2d_nchw.cuda", [["TENSOR", [128, 128, 28, 28], "float32"], ["TENSOR", [128, 128, 3, 3], "float32"], 1, "SAME", 1, "float32"], {}], "config": {"index": 28192256, "code_hash": null, "entity": [["tile_f", "sp", [-1, 4, 8, 2]], ["tile_y", "sp", [-1, 1, 14, 1]], ["tile_x", "sp", [-1, 1, 2, 7]], ["tile_rc", "sp", [-1, 4]], ["tile_ry", "sp", [-1, 1]], ["tile_rx", "sp", [-1, 3]], ["auto_unroll_max_step", "ot", 512], ["unroll_explicit", "ot", 1]]}, "result": [[0.0028490171621621623], 0, 1.6910028457641602, 1702579992.1669095], "version": 0.2, "tvm_version": "0.10.0"}
{"input": ["cuda -keys=cuda,gpu -arch=sm_86 -max_num_threads=1024 -thread_warp_size=32", "conv2d_nchw.cuda", [["TENSOR", [128, 128, 28, 28], "float32"], ["TENSOR", [128, 128, 3, 3], "float32"], 1, "SAME", 1, "float32"], {}], "config": {"index": 22048256, "code_hash": null, "entity": [["tile_f", "sp", [-1, 4, 8, 2]], ["tile_y", "sp", [-1, 1, 14, 1]], ["tile_x", "sp", [-1, 1, 2, 7]], ["tile_rc", "sp", [-1, 4]], ["tile_ry", "sp", [-1, 1]], ["tile_rx", "sp", [-1, 3]], ["auto_unroll_max_step", "ot", 0], ["unroll_explicit", "ot", 1]]}, "result": [[0.0028676836111111107], 0, 1.4565887451171875, 1702579993.0304203], "version": 0.2, "tvm_version": "0.10.0"}
{"input": ["cuda -keys=cuda,gpu -arch=sm_86 -max_num_threads=1024 -thread_warp_size=32", "conv2d_nchw.cuda", [["TENSOR", [128, 128, 28, 28], "float32"], ["TENSOR", [128, 128, 3, 3], "float32"], 1, "SAME", 1, "float32"], {}], "config": {"index": 3616256, "code_hash": null, "entity": [["tile_f", "sp", [-1, 4, 8, 2]], ["tile_y", "sp", [-1, 1, 14, 1]], ["tile_x", "sp", [-1, 1, 2, 7]], ["tile_rc", "sp", [-1, 4]], ["tile_ry", "sp", [-1, 1]], ["tile_rx", "sp", [-1, 3]], ["auto_unroll_max_step", "ot", 0], ["unroll_explicit", "ot", 0]]}, "result": [[0.0032716138064516126], 0, 1.4071438312530518, 1702579996.486549], "version": 0.2, "tvm_version": "0.10.0"}
{"input": ["cuda -keys=cuda,gpu -arch=sm_86 -max_num_threads=1024 -thread_warp_size=32", "conv2d_nchw.cuda", [["TENSOR", [128, 128, 28, 28], "float32"], ["TENSOR", [128, 128, 3, 3], "float32"], 1, "SAME", 1, "float32"], {}], "config": {"index": 9760256, "code_hash": null, "entity": [["tile_f", "sp", [-1, 4, 8, 2]], ["tile_y", "sp", [-1, 1, 14, 1]], ["tile_x", "sp", [-1, 1, 2, 7]], ["tile_rc", "sp", [-1, 4]], ["tile_ry", "sp", [-1, 1]], ["tile_rx", "sp", [-1, 3]], ["auto_unroll_max_step", "ot", 512], ["unroll_explicit", "ot", 0]]}, "result": [[0.002839745783783784], 0, 1.4636480808258057, 1702579997.3519435], "version": 0.2, "tvm_version": "0.10.0"}
{"input": ["cuda -keys=cuda,gpu -arch=sm_86 -max_num_threads=1024 -thread_warp_size=32", "conv2d_nchw.cuda", [["TENSOR", [128, 128, 28, 28], "float32"], ["TENSOR", [128, 128, 3, 3], "float32"], 1, "SAME", 1, "float32"], {}], "config": {"index": 22057495, "code_hash": null, "entity": [["tile_f", "sp", [-1, 2, 8, 2]], ["tile_y", "sp", [-1, 1, 7, 1]], ["tile_x", "sp", [-1, 1, 4, 7]], ["tile_rc", "sp", [-1, 4]], ["tile_ry", "sp", [-1, 1]], ["tile_rx", "sp", [-1, 3]], ["auto_unroll_max_step", "ot", 0], ["unroll_explicit", "ot", 1]]}, "result": [[0.002527134476190476], 0, 1.390207290649414, 1702579998.2233336], "version": 0.2, "tvm_version": "0.10.0"}
{"input": ["cuda -keys=cuda,gpu -arch=sm_86 -max_num_threads=1024 -thread_warp_size=32", "conv2d_nchw.cuda", [["TENSOR", [128, 128, 28, 28], "float32"], ["TENSOR", [128, 128, 3, 3], "float32"], 1, "SAME", 1, "float32"], {}], "config": {"index": 9769495, "code_hash": null, "entity": [["tile_f", "sp", [-1, 2, 8, 2]], ["tile_y", "sp", [-1, 1, 7, 1]], ["tile_x", "sp", [-1, 1, 4, 7]], ["tile_rc", "sp", [-1, 4]], ["tile_ry", "sp", [-1, 1]], ["tile_rx", "sp", [-1, 3]], ["auto_unroll_max_step", "ot", 512], ["unroll_explicit", "ot", 0]]}, "result": [[0.0026874749487179484], 0, 1.458404302597046, 1702579999.0978181], "version": 0.2, "tvm_version": "0.10.0"}
{"input": ["cuda -keys=cuda,gpu -arch=sm_86 -max_num_threads=1024 -thread_warp_size=32", "conv2d_nchw.cuda", [["TENSOR", [128, 128, 28, 28], "float32"], ["TENSOR", [128, 128, 3, 3], "float32"], 1, "SAME", 1, "float32"], {}], "config": {"index": 3625495, "code_hash": null, "entity": [["tile_f", "sp", [-1, 2, 8, 2]], ["tile_y", "sp", [-1, 1, 7, 1]], ["tile_x", "sp", [-1, 1, 4, 7]], ["tile_rc", "sp", [-1, 4]], ["tile_ry", "sp", [-1, 1]], ["tile_rx", "sp", [-1, 3]], ["auto_unroll_max_step", "ot", 0], ["unroll_explicit", "ot", 0]]}, "result": [[0.002515772857142857], 0, 1.337867021560669, 1702579999.9720333], "version": 0.2, "tvm_version": "0.10.0"}
{"input": ["cuda -keys=cuda,gpu -arch=sm_86 -max_num_threads=1024 -thread_warp_size=32", "conv2d_nchw.cuda", [["TENSOR", [128, 128, 28, 28], "float32"], ["TENSOR", [128, 128, 3, 3], "float32"], 1, "SAME", 1, "float32"], {}], "config": {"index": 28201495, "code_hash": null, "entity": [["tile_f", "sp", [-1, 2, 8, 2]], ["tile_y", "sp", [-1, 1, 7, 1]], ["tile_x", "sp", [-1, 1, 4, 7]], ["tile_rc", "sp", [-1, 4]], ["tile_ry", "sp", [-1, 1]], ["tile_rx", "sp", [-1, 3]], ["auto_unroll_max_step", "ot", 512], ["unroll_explicit", "ot", 1]]}, "result": [[0.0022555015957446806], 0, 1.6839802265167236, 1702580000.8248906], "version": 0.2, "tvm_version": "0.10.0"}
{"input": ["cuda -keys=cuda,gpu -arch=sm_86 -max_num_threads=1024 -thread_warp_size=32", "conv2d_nchw.cuda", [["TENSOR", [128, 128, 28, 28], "float32"], ["TENSOR", [128, 128, 3, 3], "float32"], 1, "SAME", 1, "float32"], {}], "config": {"index": 34336252, "code_hash": null, "entity": [["tile_f", "sp", [-1, 8, 4, 2]], ["tile_y", "sp", [-1, 1, 14, 1]], ["tile_x", "sp", [-1, 1, 2, 7]], ["tile_rc", "sp", [-1, 4]], ["tile_ry", "sp", [-1, 1]], ["tile_rx", "sp", [-1, 3]], ["auto_unroll_max_step", "ot", 1500], ["unroll_explicit", "ot", 1]]}, "result": [[0.0021915732916666666], 0, 3.2636077404022217, 1702580001.709757], "version": 0.2, "tvm_version": "0.10.0"}
{"input": ["cuda -keys=cuda,gpu -arch=sm_86 -max_num_threads=1024 -thread_warp_size=32", "conv2d_nchw.cuda", [["TENSOR", [128, 128, 28, 28], "float32"], ["TENSOR", [128, 128, 3, 3], "float32"], 1, "SAME", 1, "float32"], {}], "config": {"index": 15904256, "code_hash": null, "entity": [["tile_f", "sp", [-1, 4, 8, 2]], ["tile_y", "sp", [-1, 1, 14, 1]], ["tile_x", "sp", [-1, 1, 2, 7]], ["tile_rc", "sp", [-1, 4]], ["tile_ry", "sp", [-1, 1]], ["tile_rx", "sp", [-1, 3]], ["auto_unroll_max_step", "ot", 1500], ["unroll_explicit", "ot", 0]]}, "result": [[0.0024660777441860462], 0, 1.7157416343688965, 1702580002.6002462], "version": 0.2, "tvm_version": "0.10.0"}
{"input": ["cuda -keys=cuda,gpu -arch=sm_86 -max_num_threads=1024 -thread_warp_size=32", "conv2d_nchw.cuda", [["TENSOR", [128, 128, 28, 28], "float32"], ["TENSOR", [128, 128, 3, 3], "float32"], 1, "SAME", 1, "float32"], {}], "config": {"index": 34336256, "code_hash": null, "entity": [["tile_f", "sp", [-1, 4, 8, 2]], ["tile_y", "sp", [-1, 1, 14, 1]], ["tile_x", "sp", [-1, 1, 2, 7]], ["tile_rc", "sp", [-1, 4]], ["tile_ry", "sp", [-1, 1]], ["tile_rx", "sp", [-1, 3]], ["auto_unroll_max_step", "ot", 1500], ["unroll_explicit", "ot", 1]]}, "result": [[0.002424226931818182], 0, 2.183627128601074, 1702580003.4820917], "version": 0.2, "tvm_version": "0.10.0"}
{"input": ["cuda -keys=cuda,gpu -arch=sm_86 -max_num_threads=1024 -thread_warp_size=32", "conv2d_nchw.cuda", [["TENSOR", [128, 128, 28, 28], "float32"], ["TENSOR", [128, 128, 3, 3], "float32"], 1, "SAME", 1, "float32"], {}], "config": {"index": 34340695, "code_hash": null, "entity": [["tile_f", "sp", [-1, 2, 8, 2]], ["tile_y", "sp", [-1, 1, 7, 1]], ["tile_x", "sp", [-1, 2, 2, 7]], ["tile_rc", "sp", [-1, 4]], ["tile_ry", "sp", [-1, 1]], ["tile_rx", "sp", [-1, 3]], ["auto_unroll_max_step", "ot", 1500], ["unroll_explicit", "ot", 1]]}, "result": [[0.002327841369565217], 0, 2.3119430541992188, 1702580004.3581586], "version": 0.2, "tvm_version": "0.10.0"}
{"input": ["cuda -keys=cuda,gpu -arch=sm_86 -max_num_threads=1024 -thread_warp_size=32", "conv2d_nchw.cuda", [["TENSOR", [128, 128, 28, 28], "float32"], ["TENSOR", [128, 128, 3, 3], "float32"], 1, "SAME", 1, "float32"], {}], "config": {"index": 32800252, "code_hash": null, "entity": [["tile_f", "sp", [-1, 8, 4, 2]], ["tile_y", "sp", [-1, 1, 14, 1]], ["tile_x", "sp", [-1, 1, 2, 7]], ["tile_rc", "sp", [-1, 4]], ["tile_ry", "sp", [-1, 3]], ["tile_rx", "sp", [-1, 1]], ["auto_unroll_max_step", "ot", 1500], ["unroll_explicit", "ot", 1]]}, "result": [[0.002623999975], 0, 3.388862133026123, 1702580005.267711], "version": 0.2, "tvm_version": "0.10.0"}
