benchmarks/microkernels/DpAnsor/log/rtx3080_reduce.log
{"i": [["[\"reduction_layer\", [128, 512, 1024], 2, false]", "cuda -keys=cuda,gpu -arch=sm_86 -max_num_threads=1024 -thread_warp_size=32", [-1, 16, 64, 49152, 2147483647, 1024, 8, 32], "", 0, []], [[], [["FU", 1, [0, 1]], ["SP", 1, 0, 65536, [2], 1], ["AN", 1, 0, 5], ["AN", 1, 1, 6], ["PR", 1, 0, "auto_unroll_max_step$512"]]]], "r": [[0.000611859], 0, 1.98504, 1710104715], "v": "v0.6"}
{"i": [["[\"reduction_layer\", [128, 512, 1024], 2, false]", "cuda -keys=cuda,gpu -arch=sm_86 -max_num_threads=1024 -thread_warp_size=32", [-1, 16, 64, 49152, 2147483647, 1024, 8, 32], "", 0, []], [[], [["SP", 1, 2, 1024, [8], 1], ["AN", 1, 3, 6], ["FU", 1, [0, 1]], ["AN", 1, 0, 5], ["PR", 1, 0, "auto_unroll_max_step$512"]]]], "r": [[0.000312704], 0, 2.20254, 1710104717], "v": "v0.6"}
{"i": [["[\"reduction_layer\", [128, 512, 1024], 2, false]", "cuda -keys=cuda,gpu -arch=sm_86 -max_num_threads=1024 -thread_warp_size=32", [-1, 16, 64, 49152, 2147483647, 1024, 8, 32], "", 0, []], [[], [["FU", 1, [0, 1]], ["SP", 1, 0, 65536, [1], 1], ["AN", 1, 0, 5], ["AN", 1, 1, 6], ["PR", 1, 0, "auto_unroll_max_step$64"]]]], "r": [[0.000979669], 0, 2.03593, 1710104719], "v": "v0.6"}
{"i": [["[\"reduction_layer\", [128, 512, 1024], 2, false]", "cuda -keys=cuda,gpu -arch=sm_86 -max_num_threads=1024 -thread_warp_size=32", [-1, 16, 64, 49152, 2147483647, 1024, 8, 32], "", 0, []], [[], [["SP", 1, 2, 1024, [16], 1], ["AN", 1, 3, 6], ["FU", 1, [0, 1]], ["AN", 1, 0, 5], ["PR", 1, 0, "auto_unroll_max_step$16"]]]], "r": [[0.000312546], 0, 2.19137, 1710104720], "v": "v0.6"}
{"i": [["[\"reduction_layer\", [128, 512, 1024], 2, false]", "cuda -keys=cuda,gpu -arch=sm_86 -max_num_threads=1024 -thread_warp_size=32", [-1, 16, 64, 49152, 2147483647, 1024, 8, 32], "", 0, []], [[], [["SP", 1, 2, 1024, [64], 1], ["AN", 1, 3, 6], ["FU", 1, [0, 1]], ["AN", 1, 0, 5], ["PR", 1, 0, "auto_unroll_max_step$1024"]]]], "r": [[0.000312504], 0, 2.1709, 1710104722], "v": "v0.6"}
{"i": [["[\"reduction_layer\", [128, 512, 1024], 2, false]", "cuda -keys=cuda,gpu -arch=sm_86 -max_num_threads=1024 -thread_warp_size=32", [-1, 16, 64, 49152, 2147483647, 1024, 8, 32], "", 0, []], [[], [["SP", 1, 2, 1024, [16], 1], ["AN", 1, 3, 6], ["FU", 1, [0, 1]], ["AN", 1, 0, 5], ["PR", 1, 0, "auto_unroll_max_step$1024"]]]], "r": [[0.000312508], 0, 2.20819, 1710104723], "v": "v0.6"}
{"i": [["[\"reduction_layer\", [128, 512, 1024], 2, false]", "cuda -keys=cuda,gpu -arch=sm_86 -max_num_threads=1024 -thread_warp_size=32", [-1, 16, 64, 49152, 2147483647, 1024, 8, 32], "", 0, []], [[], [["SP", 1, 2, 1024, [4], 1], ["AN", 1, 3, 6], ["FU", 1, [0, 1]], ["AN", 1, 0, 5], ["PR", 1, 0, "auto_unroll_max_step$16"]]]], "r": [[0.000320944], 0, 2.01242, 1710104725], "v": "v0.6"}
{"i": [["[\"reduction_layer\", [128, 512, 1024], 2, false]", "cuda -keys=cuda,gpu -arch=sm_86 -max_num_threads=1024 -thread_warp_size=32", [-1, 16, 64, 49152, 2147483647, 1024, 8, 32], "", 0, []], [[], [["FU", 1, [0, 1]], ["SP", 1, 0, 65536, [4], 1], ["AN", 1, 0, 5], ["AN", 1, 1, 6], ["PR", 1, 0, "auto_unroll_max_step$64"]]]], "r": [[0.000635535], 0, 2.01804, 1710104726], "v": "v0.6"}
{"i": [["[\"reduction_layer\", [128, 512, 1024], 2, false]", "cuda -keys=cuda,gpu -arch=sm_86 -max_num_threads=1024 -thread_warp_size=32", [-1, 16, 64, 49152, 2147483647, 1024, 8, 32], "", 0, []], [[], [["FU", 1, [0, 1]], ["SP", 1, 0, 65536, [2], 1], ["AN", 1, 0, 5], ["AN", 1, 1, 6], ["PR", 1, 0, "auto_unroll_max_step$1024"]]]], "r": [[0.000563205], 0, 2.03206, 1710104728], "v": "v0.6"}
{"i": [["[\"reduction_layer\", [128, 512, 1024], 2, false]", "cuda -keys=cuda,gpu -arch=sm_86 -max_num_threads=1024 -thread_warp_size=32", [-1, 16, 64, 49152, 2147483647, 1024, 8, 32], "", 0, []], [[], [["SP", 1, 2, 1024, [1], 1], ["AN", 1, 3, 6], ["FU", 1, [0, 1]], ["AN", 1, 0, 5], ["PR", 1, 0, "auto_unroll_max_step$64"]]]], "r": [[0.00110356], 0, 2.17255, 1710104729], "v": "v0.6"}
{"i": [["[\"reduction_layer\", [128, 512, 1024], 2, false]", "cuda -keys=cuda,gpu -arch=sm_86 -max_num_threads=1024 -thread_warp_size=32", [-1, 16, 64, 49152, 2147483647, 1024, 8, 32], "", 0, []], [[], [["SP", 1, 2, 1024, [32], 1], ["AN", 1, 3, 6], ["FU", 1, [0, 1]], ["AN", 1, 0, 5], ["PR", 1, 0, "auto_unroll_max_step$1024"]]]], "r": [[0.000312403], 0, 2.17481, 1710104731], "v": "v0.6"}
{"i": [["[\"reduction_layer\", [128, 512, 1024], 2, false]", "cuda -keys=cuda,gpu -arch=sm_86 -max_num_threads=1024 -thread_warp_size=32", [-1, 16, 64, 49152, 2147483647, 1024, 8, 32], "", 0, []], [[], [["SP", 1, 2, 1024, [2], 1], ["AN", 1, 3, 6], ["FU", 1, [0, 1]], ["AN", 1, 0, 5], ["PR", 1, 0, "auto_unroll_max_step$16"]]]], "r": [[0.000504917], 0, 2.01306, 1710104732], "v": "v0.6"}
{"i": [["[\"reduction_layer\", [128, 512, 1024], 2, false]", "cuda -keys=cuda,gpu -arch=sm_86 -max_num_threads=1024 -thread_warp_size=32", [-1, 16, 64, 49152, 2147483647, 1024, 8, 32], "", 0, []], [[], [["SP", 1, 2, 1024, [4], 1], ["AN", 1, 3, 6], ["FU", 1, [0, 1]], ["AN", 1, 0, 5], ["PR", 1, 0, "auto_unroll_max_step$512"]]]], "r": [[0.000321004], 0, 2.00556, 1710104734], "v": "v0.6"}
{"i": [["[\"reduction_layer\", [128, 512, 1024], 2, false]", "cuda -keys=cuda,gpu -arch=sm_86 -max_num_threads=1024 -thread_warp_size=32", [-1, 16, 64, 49152, 2147483647, 1024, 8, 32], "", 0, []], [[], [["SP", 1, 2, 1024, [8], 1], ["AN", 1, 3, 6], ["FU", 1, [0, 1]], ["AN", 1, 0, 5], ["PR", 1, 0, "auto_unroll_max_step$64"]]]], "r": [[0.00031268], 0, 2.1756, 1710104735], "v": "v0.6"}
{"i": [["[\"reduction_layer\", [128, 512, 1024], 2, false]", "cuda -keys=cuda,gpu -arch=sm_86 -max_num_threads=1024 -thread_warp_size=32", [-1, 16, 64, 49152, 2147483647, 1024, 8, 32], "", 0, []], [[], [["SP", 1, 2, 1024, [2], 1], ["AN", 1, 3, 6], ["FU", 1, [0, 1]], ["AN", 1, 0, 5], ["PR", 1, 0, "auto_unroll_max_step$64"]]]], "r": [[0.000507764], 0, 2.02891, 1710104737], "v": "v0.6"}
{"i": [["[\"reduction_layer\", [128, 512, 1024], 2, false]", "cuda -keys=cuda,gpu -arch=sm_86 -max_num_threads=1024 -thread_warp_size=32", [-1, 16, 64, 49152, 2147483647, 1024, 8, 32], "", 0, []], [[], [["FU", 1, [0, 1]], ["SP", 1, 0, 65536, [4], 1], ["AN", 1, 0, 5], ["AN", 1, 1, 6], ["PR", 1, 0, "auto_unroll_max_step$0"]]]], "r": [[0.000636377], 0, 2.01499, 1710104738], "v": "v0.6"}
{"i": [["[\"reduction_layer\", [128, 512, 1024], 2, false]", "cuda -keys=cuda,gpu -arch=sm_86 -max_num_threads=1024 -thread_warp_size=32", [-1, 16, 64, 49152, 2147483647, 1024, 8, 32], "", 0, []], [[], [["SP", 1, 2, 1024, [64], 1], ["AN", 1, 3, 6], ["FU", 1, [0, 1]], ["AN", 1, 0, 5], ["PR", 1, 0, "auto_unroll_max_step$16"]]]], "r": [[0.000312526], 0, 2.14059, 1710104740], "v": "v0.6"}
{"i": [["[\"reduction_layer\", [128, 512, 1024], 2, false]", "cuda -keys=cuda,gpu -arch=sm_86 -max_num_threads=1024 -thread_warp_size=32", [-1, 16, 64, 49152, 2147483647, 1024, 8, 32], "", 0, []], [[], [["FU", 1, [0, 1]], ["SP", 1, 0, 65536, [4], 1], ["AN", 1, 0, 5], ["AN", 1, 1, 6], ["PR", 1, 0, "auto_unroll_max_step$512"]]]], "r": [[0.000635437], 0, 2.03687, 1710104741], "v": "v0.6"}
{"i": [["[\"reduction_layer\", [128, 512, 1024], 2, false]", "cuda -keys=cuda,gpu -arch=sm_86 -max_num_threads=1024 -thread_warp_size=32", [-1, 16, 64, 49152, 2147483647, 1024, 8, 32], "", 0, []], [[], [["FU", 1, [0, 1]], ["SP", 1, 0, 65536, [1], 1], ["AN", 1, 0, 5], ["AN", 1, 1, 6], ["PR", 1, 0, "auto_unroll_max_step$1024"]]]], "r": [[0.000979322], 0, 1.99526, 1710104743], "v": "v0.6"}
{"i": [["[\"reduction_layer\", [128, 512, 1024], 2, false]", "cuda -keys=cuda,gpu -arch=sm_86 -max_num_threads=1024 -thread_warp_size=32", [-1, 16, 64, 49152, 2147483647, 1024, 8, 32], "", 0, []], [[], [["FU", 1, [0, 1]], ["SP", 1, 0, 65536, [8], 1], ["AN", 1, 0, 5], ["AN", 1, 1, 6], ["PR", 1, 0, "auto_unroll_max_step$1024"]]]], "r": [[0.000507077], 0, 2.00528, 1710104744], "v": "v0.6"}
{"i": [["[\"reduction_layer\", [128, 512, 1024], 2, false]", "cuda -keys=cuda,gpu -arch=sm_86 -max_num_threads=1024 -thread_warp_size=32", [-1, 16, 64, 49152, 2147483647, 1024, 8, 32], "", 0, []], [[], [["SP", 1, 2, 1024, [64], 1], ["AN", 1, 3, 6], ["FU", 1, [0, 1]], ["AN", 1, 0, 5], ["PR", 1, 0, "auto_unroll_max_step$512"]]]], "r": [[0.000312524], 0, 2.14542, 1710104746], "v": "v0.6"}
{"i": [["[\"reduction_layer\", [128, 512, 1024], 2, false]", "cuda -keys=cuda,gpu -arch=sm_86 -max_num_threads=1024 -thread_warp_size=32", [-1, 16, 64, 49152, 2147483647, 1024, 8, 32], "", 0, []], [[], [["FU", 1, [0, 1]], ["SP", 1, 0, 65536, [16], 1], ["AN", 1, 0, 5], ["AN", 1, 1, 6], ["PR", 1, 0, "auto_unroll_max_step$16"]]]], "r": [[0.000710954], 0, 2.01016, 1710104747], "v": "v0.6"}
{"i": [["[\"reduction_layer\", [128, 512, 1024], 2, false]", "cuda -keys=cuda,gpu -arch=sm_86 -max_num_threads=1024 -thread_warp_size=32", [-1, 16, 64, 49152, 2147483647, 1024, 8, 32], "", 0, []], [[], [["FU", 1, [0, 1]], ["SP", 1, 0, 65536, [16], 1], ["AN", 1, 0, 5], ["AN", 1, 1, 6], ["PR", 1, 0, "auto_unroll_max_step$512"]]]], "r": [[0.000710235], 0, 2.01146, 1710104749], "v": "v0.6"}
{"i": [["[\"reduction_layer\", [128, 512, 1024], 2, false]", "cuda -keys=cuda,gpu -arch=sm_86 -max_num_threads=1024 -thread_warp_size=32", [-1, 16, 64, 49152, 2147483647, 1024, 8, 32], "", 0, []], [[], [["SP", 1, 2, 1024, [32], 1], ["AN", 1, 3, 6], ["FU", 1, [0, 1]], ["AN", 1, 0, 5], ["PR", 1, 0, "auto_unroll_max_step$0"]]]], "r": [[0.000312427], 0, 2.1834, 1710104750], "v": "v0.6"}
{"i": [["[\"reduction_layer\", [128, 512, 1024], 2, false]", "cuda -keys=cuda,gpu -arch=sm_86 -max_num_threads=1024 -thread_warp_size=32", [-1, 16, 64, 49152, 2147483647, 1024, 8, 32], "", 0, []], [[], [["SP", 1, 2, 1024, [32], 1], ["AN", 1, 3, 6], ["FU", 1, [0, 1]], ["AN", 1, 0, 5], ["PR", 1, 0, "auto_unroll_max_step$16"]]]], "r": [[0.000312417], 0, 2.16604, 1710104752], "v": "v0.6"}
{"i": [["[\"reduction_layer\", [128, 512, 1024], 2, false]", "cuda -keys=cuda,gpu -arch=sm_86 -max_num_threads=1024 -thread_warp_size=32", [-1, 16, 64, 49152, 2147483647, 1024, 8, 32], "", 0, []], [[], [["FU", 1, [0, 1]], ["SP", 1, 0, 65536, [8], 1], ["AN", 1, 0, 5], ["AN", 1, 1, 6], ["PR", 1, 0, "auto_unroll_max_step$0"]]]], "r": [[0.000510194], 0, 2.01353, 1710104753], "v": "v0.6"}
{"i": [["[\"reduction_layer\", [128, 512, 1024], 2, false]", "cuda -keys=cuda,gpu -arch=sm_86 -max_num_threads=1024 -thread_warp_size=32", [-1, 16, 64, 49152, 2147483647, 1024, 8, 32], "", 0, []], [[], [["SP", 1, 2, 1024, [8], 1], ["AN", 1, 3, 6], ["FU", 1, [0, 1]], ["AN", 1, 0, 5], ["PR", 1, 0, "auto_unroll_max_step$0"]]]], "r": [[0.000312706], 0, 2.18625, 1710104755], "v": "v0.6"}
{"i": [["[\"reduction_layer\", [128, 512, 1024], 2, false]", "cuda -keys=cuda,gpu -arch=sm_86 -max_num_threads=1024 -thread_warp_size=32", [-1, 16, 64, 49152, 2147483647, 1024, 8, 32], "", 0, []], [[], [["FU", 1, [0, 1]], ["SP", 1, 0, 65536, [16], 1], ["AN", 1, 0, 5], ["AN", 1, 1, 6], ["PR", 1, 0, "auto_unroll_max_step$1024"]]]], "r": [[0.000710344], 0, 1.99725, 1710104756], "v": "v0.6"}
{"i": [["[\"reduction_layer\", [128, 512, 1024], 2, false]", "cuda -keys=cuda,gpu -arch=sm_86 -max_num_threads=1024 -thread_warp_size=32", [-1, 16, 64, 49152, 2147483647, 1024, 8, 32], "", 0, []], [[], [["FU", 1, [0, 1]], ["SP", 1, 0, 65536, [1], 1], ["AN", 1, 0, 5], ["AN", 1, 1, 6], ["PR", 1, 0, "auto_unroll_max_step$0"]]]], "r": [[0.000987367], 0, 2.01946, 1710104758], "v": "v0.6"}
{"i": [["[\"reduction_layer\", [128, 512, 1024], 2, false]", "cuda -keys=cuda,gpu -arch=sm_86 -max_num_threads=1024 -thread_warp_size=32", [-1, 16, 64, 49152, 2147483647, 1024, 8, 32], "", 0, []], [[], [["FU", 1, [0, 1]], ["SP", 1, 0, 65536, [64], 1], ["AN", 1, 0, 5], ["AN", 1, 1, 6], ["PR", 1, 0, "auto_unroll_max_step$1024"]]]], "r": [[0.00112114], 0, 2.0107, 1710104759], "v": "v0.6"}
{"i": [["[\"reduction_layer\", [128, 512, 1024], 2, false]", "cuda -keys=cuda,gpu -arch=sm_86 -max_num_threads=1024 -thread_warp_size=32", [-1, 16, 64, 49152, 2147483647, 1024, 8, 32], "", 0, []], [[], [["SP", 1, 2, 1024, [16], 1], ["AN", 1, 3, 6], ["FU", 1, [0, 1]], ["AN", 1, 0, 5], ["PR", 1, 0, "auto_unroll_max_step$64"]]]], "r": [[0.000312548], 0, 2.17126, 1710104761], "v": "v0.6"}
{"i": [["[\"reduction_layer\", [128, 512, 1024], 2, false]", "cuda -keys=cuda,gpu -arch=sm_86 -max_num_threads=1024 -thread_warp_size=32", [-1, 16, 64, 49152, 2147483647, 1024, 8, 32], "", 0, []], [[], [["SP", 1, 2, 1024, [1], 1], ["AN", 1, 3, 6], ["FU", 1, [0, 1]], ["AN", 1, 0, 5], ["PR", 1, 0, "auto_unroll_max_step$512"]]]], "r": [[0.000986222], 0, 1.99887, 1710104762], "v": "v0.6"}
{"i": [["[\"reduction_layer\", [128, 512, 1024], 2, false]", "cuda -keys=cuda,gpu -arch=sm_86 -max_num_threads=1024 -thread_warp_size=32", [-1, 16, 64, 49152, 2147483647, 1024, 8, 32], "", 0, []], [[], [["FU", 1, [0, 1]], ["SP", 1, 0, 65536, [32], 1], ["AN", 1, 0, 5], ["AN", 1, 1, 6], ["PR", 1, 0, "auto_unroll_max_step$1024"]]]], "r": [[0.00103578], 0, 1.99333, 1710104768], "v": "v0.6"}
{"i": [["[\"reduction_layer\", [128, 512, 1024], 2, false]", "cuda -keys=cuda,gpu -arch=sm_86 -max_num_threads=1024 -thread_warp_size=32", [-1, 16, 64, 49152, 2147483647, 1024, 8, 32], "", 0, []], [[], [["FU", 1, [0, 1]], ["SP", 1, 0, 65536, [64], 1], ["AN", 1, 0, 5], ["AN", 1, 1, 6], ["PR", 1, 0, "auto_unroll_max_step$64"]]]], "r": [[0.0011206], 0, 2.0029, 1710104770], "v": "v0.6"}
{"i": [["[\"reduction_layer\", [128, 512, 1024], 2, false]", "cuda -keys=cuda,gpu -arch=sm_86 -max_num_threads=1024 -thread_warp_size=32", [-1, 16, 64, 49152, 2147483647, 1024, 8, 32], "", 0, []], [[], [["FU", 1, [0, 1]], ["SP", 1, 0, 65536, [2], 1], ["AN", 1, 0, 5], ["AN", 1, 1, 6], ["PR", 1, 0, "auto_unroll_max_step$16"]]]], "r": [[0.000611884], 0, 2.03902, 1710104771], "v": "v0.6"}
{"i": [["[\"reduction_layer\", [128, 512, 1024], 2, false]", "cuda -keys=cuda,gpu -arch=sm_86 -max_num_threads=1024 -thread_warp_size=32", [-1, 16, 64, 49152, 2147483647, 1024, 8, 32], "", 0, []], [[], [["SP", 1, 2, 1024, [2], 1], ["AN", 1, 3, 6], ["FU", 1, [0, 1]], ["AN", 1, 0, 5], ["PR", 1, 0, "auto_unroll_max_step$1024"]]]], "r": [[0.000506011], 0, 2.02269, 1710104772], "v": "v0.6"}
{"i": [["[\"reduction_layer\", [128, 512, 1024], 2, false]", "cuda -keys=cuda,gpu -arch=sm_86 -max_num_threads=1024 -thread_warp_size=32", [-1, 16, 64, 49152, 2147483647, 1024, 8, 32], "", 0, []], [[], [["SP", 1, 2, 1024, [1], 1], ["AN", 1, 3, 6], ["FU", 1, [0, 1]], ["AN", 1, 0, 5], ["PR", 1, 0, "auto_unroll_max_step$16"]]]], "r": [[0.000983532], 0, 2.01184, 1710104774], "v": "v0.6"}
{"i": [["[\"reduction_layer\", [128, 512, 1024], 2, false]", "cuda -keys=cuda,gpu -arch=sm_86 -max_num_threads=1024 -thread_warp_size=32", [-1, 16, 64, 49152, 2147483647, 1024, 8, 32], "", 0, []], [[], [["FU", 1, [0, 1]], ["SP", 1, 0, 65536, [32], 1], ["AN", 1, 0, 5], ["AN", 1, 1, 6], ["PR", 1, 0, "auto_unroll_max_step$16"]]]], "r": [[0.00102472], 0, 2.17938, 1710104775], "v": "v0.6"}
{"i": [["[\"reduction_layer\", [128, 512, 1024], 2, false]", "cuda -keys=cuda,gpu -arch=sm_86 -max_num_threads=1024 -thread_warp_size=32", [-1, 16, 64, 49152, 2147483647, 1024, 8, 32], "", 0, []], [[], [["SP", 1, 2, 1024, [1], 1], ["AN", 1, 3, 6], ["FU", 1, [0, 1]], ["AN", 1, 0, 5], ["PR", 1, 0, "auto_unroll_max_step$1024"]]]], "r": [[0.000983391], 0, 2.0071, 1710104777], "v": "v0.6"}
{"i": [["[\"reduction_layer\", [128, 512, 1024], 2, false]", "cuda -keys=cuda,gpu -arch=sm_86 -max_num_threads=1024 -thread_warp_size=32", [-1, 16, 64, 49152, 2147483647, 1024, 8, 32], "", 0, []], [[], [["SP", 1, 2, 1024, [4], 1], ["AN", 1, 3, 6], ["FU", 1, [0, 1]], ["AN", 1, 0, 5], ["PR", 1, 0, "auto_unroll_max_step$64"]]]], "r": [[0.00032151], 0, 2.00868, 1710104778], "v": "v0.6"}
{"i": [["[\"reduction_layer\", [128, 512, 1024], 2, false]", "cuda -keys=cuda,gpu -arch=sm_86 -max_num_threads=1024 -thread_warp_size=32", [-1, 16, 64, 49152, 2147483647, 1024, 8, 32], "", 0, []], [[], [["FU", 1, [0, 1]], ["SP", 1, 0, 65536, [32], 1], ["AN", 1, 0, 5], ["AN", 1, 1, 6], ["PR", 1, 0, "auto_unroll_max_step$512"]]]], "r": [[0.00103766], 0, 2.0253, 1710104780], "v": "v0.6"}
{"i": [["[\"reduction_layer\", [128, 512, 1024], 2, false]", "cuda -keys=cuda,gpu -arch=sm_86 -max_num_threads=1024 -thread_warp_size=32", [-1, 16, 64, 49152, 2147483647, 1024, 8, 32], "", 0, []], [[], [["SP", 1, 2, 1024, [8], 1], ["AN", 1, 3, 6], ["FU", 1, [0, 1]], ["AN", 1, 0, 5], ["PR", 1, 0, "auto_unroll_max_step$16"]]]], "r": [[0.000312696], 0, 2.21581, 1710104781], "v": "v0.6"}
{"i": [["[\"reduction_layer\", [128, 512, 1024], 2, false]", "cuda -keys=cuda,gpu -arch=sm_86 -max_num_threads=1024 -thread_warp_size=32", [-1, 16, 64, 49152, 2147483647, 1024, 8, 32], "", 0, []], [[], [["FU", 1, [0, 1]], ["SP", 1, 0, 65536, [2], 1], ["AN", 1, 0, 5], ["AN", 1, 1, 6], ["PR", 1, 0, "auto_unroll_max_step$64"]]]], "r": [[0.0005641], 0, 2.03242, 1710104783], "v": "v0.6"}
{"i": [["[\"reduction_layer\", [128, 512, 1024], 2, false]", "cuda -keys=cuda,gpu -arch=sm_86 -max_num_threads=1024 -thread_warp_size=32", [-1, 16, 64, 49152, 2147483647, 1024, 8, 32], "", 0, []], [[], [["FU", 1, [0, 1]], ["SP", 1, 0, 65536, [64], 1], ["AN", 1, 0, 5], ["AN", 1, 1, 6], ["PR", 1, 0, "auto_unroll_max_step$512"]]]], "r": [[0.00112068], 0, 2.02881, 1710104784], "v": "v0.6"}
{"i": [["[\"reduction_layer\", [128, 512, 1024], 2, false]", "cuda -keys=cuda,gpu -arch=sm_86 -max_num_threads=1024 -thread_warp_size=32", [-1, 16, 64, 49152, 2147483647, 1024, 8, 32], "", 0, []], [[], [["FU", 1, [0, 1]], ["SP", 1, 0, 65536, [64], 1], ["AN", 1, 0, 5], ["AN", 1, 1, 6], ["PR", 1, 0, "auto_unroll_max_step$0"]]]], "r": [[0.00112365], 0, 2.01135, 1710104786], "v": "v0.6"}
{"i": [["[\"reduction_layer\", [128, 512, 1024], 2, false]", "cuda -keys=cuda,gpu -arch=sm_86 -max_num_threads=1024 -thread_warp_size=32", [-1, 16, 64, 49152, 2147483647, 1024, 8, 32], "", 0, []], [[], [["FU", 1, [0, 1]], ["SP", 1, 0, 65536, [1], 1], ["AN", 1, 0, 5], ["AN", 1, 1, 6], ["PR", 1, 0, "auto_unroll_max_step$16"]]]], "r": [[0.000983933], 0, 1.98477, 1710104787], "v": "v0.6"}
{"i": [["[\"reduction_layer\", [128, 512, 1024], 2, false]", "cuda -keys=cuda,gpu -arch=sm_86 -max_num_threads=1024 -thread_warp_size=32", [-1, 16, 64, 49152, 2147483647, 1024, 8, 32], "", 0, []], [[], [["FU", 1, [0, 1]], ["SP", 1, 0, 65536, [16], 1], ["AN", 1, 0, 5], ["AN", 1, 1, 6], ["PR", 1, 0, "auto_unroll_max_step$64"]]]], "r": [[0.000737664], 0, 1.98332, 1710104789], "v": "v0.6"}
{"i": [["[\"reduction_layer\", [128, 512, 1024], 2, false]", "cuda -keys=cuda,gpu -arch=sm_86 -max_num_threads=1024 -thread_warp_size=32", [-1, 16, 64, 49152, 2147483647, 1024, 8, 32], "", 0, []], [[], [["SP", 1, 2, 1024, [1], 1], ["AN", 1, 3, 6], ["FU", 1, [0, 1]], ["AN", 1, 0, 5], ["PR", 1, 0, "auto_unroll_max_step$0"]]]], "r": [[0.000977264], 0, 2.02282, 1710104790], "v": "v0.6"}
{"i": [["[\"reduction_layer\", [128, 512, 1024], 2, false]", "cuda -keys=cuda,gpu -arch=sm_86 -max_num_threads=1024 -thread_warp_size=32", [-1, 16, 64, 49152, 2147483647, 1024, 8, 32], "", 0, []], [[], [["SP", 1, 2, 1024, [8], 1], ["AN", 1, 3, 6], ["FU", 1, [0, 1]], ["AN", 1, 0, 5], ["PR", 1, 0, "auto_unroll_max_step$1024"]]]], "r": [[0.000312708], 0, 2.14449, 1710104792], "v": "v0.6"}
{"i": [["[\"reduction_layer\", [128, 512, 1024], 2, false]", "cuda -keys=cuda,gpu -arch=sm_86 -max_num_threads=1024 -thread_warp_size=32", [-1, 16, 64, 49152, 2147483647, 1024, 8, 32], "", 0, []], [[], [["SP", 1, 2, 1024, [4], 1], ["AN", 1, 3, 6], ["FU", 1, [0, 1]], ["AN", 1, 0, 5], ["PR", 1, 0, "auto_unroll_max_step$1024"]]]], "r": [[0.000320926], 0, 1.97931, 1710104793], "v": "v0.6"}
{"i": [["[\"reduction_layer\", [128, 512, 1024], 2, false]", "cuda -keys=cuda,gpu -arch=sm_86 -max_num_threads=1024 -thread_warp_size=32", [-1, 16, 64, 49152, 2147483647, 1024, 8, 32], "", 0, []], [[], [["SP", 1, 2, 1024, [16], 1], ["AN", 1, 3, 6], ["FU", 1, [0, 1]], ["AN", 1, 0, 5], ["PR", 1, 0, "auto_unroll_max_step$0"]]]], "r": [[0.000312531], 0, 2.16397, 1710104795], "v": "v0.6"}
{"i": [["[\"reduction_layer\", [128, 512, 1024], 2, false]", "cuda -keys=cuda,gpu -arch=sm_86 -max_num_threads=1024 -thread_warp_size=32", [-1, 16, 64, 49152, 2147483647, 1024, 8, 32], "", 0, []], [[], [["FU", 1, [0, 1]], ["SP", 1, 0, 65536, [8], 1], ["AN", 1, 0, 5], ["AN", 1, 1, 6], ["PR", 1, 0, "auto_unroll_max_step$512"]]]], "r": [[0.000506951], 0, 1.98977, 1710104796], "v": "v0.6"}
{"i": [["[\"reduction_layer\", [128, 512, 1024], 2, false]", "cuda -keys=cuda,gpu -arch=sm_86 -max_num_threads=1024 -thread_warp_size=32", [-1, 16, 64, 49152, 2147483647, 1024, 8, 32], "", 0, []], [[], [["FU", 1, [0, 1]], ["SP", 1, 0, 65536, [2], 1], ["AN", 1, 0, 5], ["AN", 1, 1, 6], ["PR", 1, 0, "auto_unroll_max_step$0"]]]], "r": [[0.000566289], 0, 2.02327, 1710104797], "v": "v0.6"}
{"i": [["[\"reduction_layer\", [128, 512, 1024], 2, false]", "cuda -keys=cuda,gpu -arch=sm_86 -max_num_threads=1024 -thread_warp_size=32", [-1, 16, 64, 49152, 2147483647, 1024, 8, 32], "", 0, []], [[], [["SP", 1, 2, 1024, [64], 1], ["AN", 1, 3, 6], ["FU", 1, [0, 1]], ["AN", 1, 0, 5], ["PR", 1, 0, "auto_unroll_max_step$64"]]]], "r": [[0.000312522], 0, 2.14356, 1710104799], "v": "v0.6"}
{"i": [["[\"reduction_layer\", [128, 512, 1024], 2, false]", "cuda -keys=cuda,gpu -arch=sm_86 -max_num_threads=1024 -thread_warp_size=32", [-1, 16, 64, 49152, 2147483647, 1024, 8, 32], "", 0, []], [[], [["FU", 1, [0, 1]], ["SP", 1, 0, 65536, [32], 1], ["AN", 1, 0, 5], ["AN", 1, 1, 6], ["PR", 1, 0, "auto_unroll_max_step$0"]]]], "r": [[0.00102364], 0, 2.16043, 1710104801], "v": "v0.6"}
{"i": [["[\"reduction_layer\", [128, 512, 1024], 2, false]", "cuda -keys=cuda,gpu -arch=sm_86 -max_num_threads=1024 -thread_warp_size=32", [-1, 16, 64, 49152, 2147483647, 1024, 8, 32], "", 0, []], [[], [["SP", 1, 2, 1024, [32], 1], ["AN", 1, 3, 6], ["FU", 1, [0, 1]], ["AN", 1, 0, 5], ["PR", 1, 0, "auto_unroll_max_step$64"]]]], "r": [[0.000312423], 0, 2.16199, 1710104802], "v": "v0.6"}
{"i": [["[\"reduction_layer\", [128, 512, 1024], 2, false]", "cuda -keys=cuda,gpu -arch=sm_86 -max_num_threads=1024 -thread_warp_size=32", [-1, 16, 64, 49152, 2147483647, 1024, 8, 32], "", 0, []], [[], [["FU", 1, [0, 1]], ["SP", 1, 0, 65536, [4], 1], ["AN", 1, 0, 5], ["AN", 1, 1, 6], ["PR", 1, 0, "auto_unroll_max_step$1024"]]]], "r": [[0.000637563], 0, 1.99565, 1710104804], "v": "v0.6"}
{"i": [["[\"reduction_layer\", [128, 512, 1024], 2, false]", "cuda -keys=cuda,gpu -arch=sm_86 -max_num_threads=1024 -thread_warp_size=32", [-1, 16, 64, 49152, 2147483647, 1024, 8, 32], "", 0, []], [[], [["FU", 1, [0, 1]], ["SP", 1, 0, 65536, [8], 1], ["AN", 1, 0, 5], ["AN", 1, 1, 6], ["PR", 1, 0, "auto_unroll_max_step$64"]]]], "r": [[0.000559737], 0, 2.15536, 1710104805], "v": "v0.6"}
{"i": [["[\"reduction_layer\", [128, 512, 1024], 2, false]", "cuda -keys=cuda,gpu -arch=sm_86 -max_num_threads=1024 -thread_warp_size=32", [-1, 16, 64, 49152, 2147483647, 1024, 8, 32], "", 0, []], [[], [["FU", 1, [0, 1]], ["SP", 1, 0, 65536, [32], 1], ["AN", 1, 0, 5], ["AN", 1, 1, 6], ["PR", 1, 0, "auto_unroll_max_step$64"]]]], "r": [[0.00102623], 0, 2.01181, 1710104807], "v": "v0.6"}
{"i": [["[\"reduction_layer\", [128, 512, 1024], 2, false]", "cuda -keys=cuda,gpu -arch=sm_86 -max_num_threads=1024 -thread_warp_size=32", [-1, 16, 64, 49152, 2147483647, 1024, 8, 32], "", 0, []], [[], [["SP", 1, 2, 1024, [2], 1], ["AN", 1, 3, 6], ["FU", 1, [0, 1]], ["AN", 1, 0, 5], ["PR", 1, 0, "auto_unroll_max_step$512"]]]], "r": [[0.00050808], 0, 1.99609, 1710104808], "v": "v0.6"}
{"i": [["[\"reduction_layer\", [128, 512, 1024], 2, false]", "cuda -keys=cuda,gpu -arch=sm_86 -max_num_threads=1024 -thread_warp_size=32", [-1, 16, 64, 49152, 2147483647, 1024, 8, 32], "", 0, []], [[], [["FU", 1, [0, 1]], ["SP", 1, 0, 65536, [8], 1], ["AN", 1, 0, 5], ["AN", 1, 1, 6], ["PR", 1, 0, "auto_unroll_max_step$16"]]]], "r": [[0.0005081], 0, 1.99949, 1710104810], "v": "v0.6"}
{"i": [["[\"reduction_layer\", [128, 512, 1024], 2, false]", "cuda -keys=cuda,gpu -arch=sm_86 -max_num_threads=1024 -thread_warp_size=32", [-1, 16, 64, 49152, 2147483647, 1024, 8, 32], "", 0, []], [[], [["SP", 1, 2, 1024, [32], 1], ["AN", 1, 3, 6], ["FU", 1, [0, 1]], ["AN", 1, 0, 5], ["PR", 1, 0, "auto_unroll_max_step$512"]]]], "r": [[0.000312429], 0, 2.15593, 1710104811], "v": "v0.6"}
{"i": [["[\"reduction_layer\", [128, 512, 1024], 2, false]", "cuda -keys=cuda,gpu -arch=sm_86 -max_num_threads=1024 -thread_warp_size=32", [-1, 16, 64, 49152, 2147483647, 1024, 8, 32], "", 0, []], [[], [["FU", 1, [0, 1]], ["SP", 1, 0, 65536, [4], 1], ["AN", 1, 0, 5], ["AN", 1, 1, 6], ["PR", 1, 0, "auto_unroll_max_step$16"]]]], "r": [[0.000637265], 0, 1.98093, 1710104813], "v": "v0.6"}
{"i": [["[\"reduction_layer\", [128, 512, 1024], 2, false]", "cuda -keys=cuda,gpu -arch=sm_86 -max_num_threads=1024 -thread_warp_size=32", [-1, 16, 64, 49152, 2147483647, 1024, 8, 32], "", 0, []], [[], [["SP", 1, 2, 1024, [4], 1], ["AN", 1, 3, 6], ["FU", 1, [0, 1]], ["AN", 1, 0, 5], ["PR", 1, 0, "auto_unroll_max_step$0"]]]], "r": [[0.000321647], 0, 1.97111, 1710104814], "v": "v0.6"}
{"i": [["[\"reduction_layer\", [128, 512, 1024], 2, false]", "cuda -keys=cuda,gpu -arch=sm_86 -max_num_threads=1024 -thread_warp_size=32", [-1, 16, 64, 49152, 2147483647, 1024, 8, 32], "", 0, []], [[], [["SP", 1, 2, 1024, [64], 1], ["AN", 1, 3, 6], ["FU", 1, [0, 1]], ["AN", 1, 0, 5], ["PR", 1, 0, "auto_unroll_max_step$0"]]]], "r": [[0.000312566], 0, 1.73347, 1710104820], "v": "v0.6"}
{"i": [["[\"reduction_layer\", [128, 512, 1024], 2, false]", "cuda -keys=cuda,gpu -arch=sm_86 -max_num_threads=1024 -thread_warp_size=32", [-1, 16, 64, 49152, 2147483647, 1024, 8, 32], "", 0, []], [[], [["FU", 1, [0, 1]], ["SP", 1, 0, 65536, [16], 1], ["AN", 1, 0, 5], ["AN", 1, 1, 6], ["PR", 1, 0, "auto_unroll_max_step$0"]]]], "r": [[0.00070984], 0, 1.78261, 1710104821], "v": "v0.6"}
{"i": [["[\"reduction_layer\", [128, 512, 1024], 2, false]", "cuda -keys=cuda,gpu -arch=sm_86 -max_num_threads=1024 -thread_warp_size=32", [-1, 16, 64, 49152, 2147483647, 1024, 8, 32], "", 0, []], [[], [["FU", 1, [0, 1]], ["SP", 1, 0, 65536, [1], 1], ["AN", 1, 0, 5], ["AN", 1, 1, 6], ["PR", 1, 0, "auto_unroll_max_step$512"]]]], "r": [[0.0011241], 0, 1.79047, 1710104823], "v": "v0.6"}
{"i": [["[\"reduction_layer\", [128, 512, 1024], 2, false]", "cuda -keys=cuda,gpu -arch=sm_86 -max_num_threads=1024 -thread_warp_size=32", [-1, 16, 64, 49152, 2147483647, 1024, 8, 32], "", 0, []], [[], [["FU", 1, [0, 1]], ["SP", 1, 0, 65536, [64], 1], ["AN", 1, 0, 5], ["AN", 1, 1, 6], ["PR", 1, 0, "auto_unroll_max_step$16"]]]], "r": [[0.00112056], 0, 1.95268, 1710104824], "v": "v0.6"}
{"i": [["[\"reduction_layer\", [128, 512, 1024], 2, false]", "cuda -keys=cuda,gpu -arch=sm_86 -max_num_threads=1024 -thread_warp_size=32", [-1, 16, 64, 49152, 2147483647, 1024, 8, 32], "", 0, []], [[], [["SP", 1, 2, 1024, [2], 1], ["AN", 1, 3, 6], ["FU", 1, [0, 1]], ["AN", 1, 0, 5], ["PR", 1, 0, "auto_unroll_max_step$0"]]]], "r": [[0.000508662], 0, 1.77935, 1710104826], "v": "v0.6"}
{"i": [["[\"reduction_layer\", [128, 512, 1024], 2, false]", "cuda -keys=cuda,gpu -arch=sm_86 -max_num_threads=1024 -thread_warp_size=32", [-1, 16, 64, 49152, 2147483647, 1024, 8, 32], "", 0, []], [[], [["SP", 1, 2, 1024, [16], 1], ["AN", 1, 3, 6], ["FU", 1, [0, 1]], ["AN", 1, 0, 5], ["PR", 1, 0, "auto_unroll_max_step$512"]]]], "r": [[0.00031252], 0, 1.95331, 1710104827], "v": "v0.6"}
