benchmarks/microkernels/DpAnsor/log/rtx3080_matmul.log
{"i": [["[\"matmul_layer\", 1, 1024, 1024]", "cuda -keys=cuda,gpu -arch=sm_86 -max_num_threads=1024 -thread_warp_size=32", [-1, 16, 64, 49152, 2147483647, 1024, 8, 32], "", 0, []], [[], [["CHW", 2, "local"], ["SP", 2, 0, 1, [1, 1, 1, 1], 1], ["SP", 2, 5, 1024, [2, 64, 1, 4], 1], ["SP", 2, 10, 1024, [2, 8], 1], ["RE", 2, [0, 5, 1, 6, 2, 7, 10, 11, 3, 8, 12, 4, 9]], ["FSP", 3, 0, 1, 3], ["FSP", 3, 4, 2, 3], ["RE", 3, [0, 4, 1, 5, 2, 6, 3, 7]], ["CA", 2, 3, 5], ["CHR", 1, "shared", [2]], ["CA", 2, 3, 6], ["CHR", 0, "shared", [3]], ["CA", 1, 4, 6], ["FU", 5, [0, 1]], ["AN", 5, 0, 5], ["FU", 5, [1, 2]], ["AN", 5, 1, 4], ["FU", 5, [2, 3]], ["AN", 5, 2, 6], ["FU", 3, [0, 1]], ["SP", 3, 0, 64, [1], 1], ["AN", 3, 1, 2], ["FFSP", 3, 0, [2, 1], 1, 1], ["AN", 3, 1, 6], ["FU", 1, [0, 1]], ["SP", 1, 0, 16, [1], 1], ["AN", 1, 1, 2], ["FFSP", 1, 0, [2, 1], 1, 1], ["AN", 1, 1, 6], ["PR", 4, 0, "auto_unroll_max_step$64"]]]], "r": [[8.40245e-05], 0, 1.19866, 1710093640], "v": "v0.6"}
{"i": [["[\"matmul_layer\", 1, 1024, 1024]", "cuda -keys=cuda,gpu -arch=sm_86 -max_num_threads=1024 -thread_warp_size=32", [-1, 16, 64, 49152, 2147483647, 1024, 8, 32], "", 0, []], [[], [["CHW", 2, "local"], ["SP", 2, 0, 1, [1, 1, 1, 1], 1], ["SP", 2, 5, 1024, [1, 64, 2, 4], 1], ["SP", 2, 10, 1024, [2, 2], 1], ["RE", 2, [0, 5, 1, 6, 2, 7, 10, 11, 3, 8, 12, 4, 9]], ["FSP", 3, 0, 1, 3], ["FSP", 3, 4, 2, 3], ["RE", 3, [0, 4, 1, 5, 2, 6, 3, 7]], ["CA", 2, 3, 5], ["CHR", 1, "shared", [2]], ["CA", 2, 3, 6], ["CHR", 0, "shared", [3]], ["CA", 1, 4, 6], ["FU", 5, [0, 1]], ["AN", 5, 0, 5], ["FU", 5, [1, 2]], ["AN", 5, 1, 4], ["FU", 5, [2, 3]], ["AN", 5, 2, 6], ["FU", 3, [0, 1]], ["SP", 3, 0, 32, [1], 1], ["AN", 3, 1, 2], ["FFSP", 3, 0, [2, 1], 1, 1], ["AN", 3, 1, 6], ["FU", 1, [0, 1]], ["SP", 1, 0, 4, [2], 1], ["AN", 1, 1, 2], ["FFSP", 1, 0, [2, 1], 1, 1], ["AN", 1, 1, 6], ["PR", 4, 0, "auto_unroll_max_step$16"]]]], "r": [[0.000107251], 0, 1.11201, 1710093640], "v": "v0.6"}
{"i": [["[\"matmul_layer\", 1, 1024, 1024]", "cuda -keys=cuda,gpu -arch=sm_86 -max_num_threads=1024 -thread_warp_size=32", [-1, 16, 64, 49152, 2147483647, 1024, 8, 32], "", 0, []], [[], [["CHW", 2, "local"], ["SP", 2, 0, 1, [1, 1, 1, 1], 1], ["SP", 2, 5, 1024, [1, 4, 1, 1], 1], ["SP", 2, 10, 1024, [1, 16], 1], ["RE", 2, [0, 5, 1, 6, 2, 7, 10, 11, 3, 8, 12, 4, 9]], ["FSP", 3, 0, 1, 3], ["FSP", 3, 4, 2, 3], ["RE", 3, [0, 4, 1, 5, 2, 6, 3, 7]], ["CA", 2, 3, 5], ["CHR", 1, "shared", [2]], ["CA", 2, 3, 6], ["CHR", 0, "shared", [3]], ["CA", 1, 4, 6], ["FU", 5, [0, 1]], ["AN", 5, 0, 5], ["FU", 5, [1, 2]], ["AN", 5, 1, 4], ["FU", 5, [2, 3]], ["AN", 5, 2, 6], ["FU", 3, [0, 1]], ["SP", 3, 0, 2, [2], 1], ["AN", 3, 1, 2], ["FFSP", 3, 0, [2, 1], 1, 1], ["AN", 3, 1, 6], ["FU", 1, [0, 1]], ["SP", 1, 0, 2, [2], 1], ["AN", 1, 1, 2], ["FFSP", 1, 0, [2, 1], 1, 1], ["AN", 1, 1, 6], ["PR", 4, 0, "auto_unroll_max_step$1024"]]]], "r": [[1.76198e-05], 0, 1.1006, 1710093641], "v": "v0.6"}
{"i": [["[\"matmul_layer\", 1, 1024, 1024]", "cuda -keys=cuda,gpu -arch=sm_86 -max_num_threads=1024 -thread_warp_size=32", [-1, 16, 64, 49152, 2147483647, 1024, 8, 32], "", 0, []], [[], [["CHW", 2, "local"], ["SP", 2, 0, 1, [1, 1, 1, 1], 1], ["SP", 2, 5, 1024, [1, 128, 4, 1], 1], ["SP", 2, 10, 1024, [1, 2], 1], ["RE", 2, [0, 5, 1, 6, 2, 7, 10, 11, 3, 8, 12, 4, 9]], ["FSP", 3, 0, 1, 3], ["FSP", 3, 4, 2, 3], ["RE", 3, [0, 4, 1, 5, 2, 6, 3, 7]], ["CA", 2, 3, 5], ["CHR", 1, "shared", [2]], ["CA", 2, 3, 6], ["CHR", 0, "shared", [3]], ["CA", 1, 4, 6], ["FU", 5, [0, 1]], ["AN", 5, 0, 5], ["FU", 5, [1, 2]], ["AN", 5, 1, 4], ["FU", 5, [2, 3]], ["AN", 5, 2, 6], ["FU", 3, [0, 1]], ["SP", 3, 0, 8, [2], 1], ["AN", 3, 1, 2], ["FFSP", 3, 0, [2, 1], 1, 1], ["AN", 3, 1, 6], ["FU", 1, [0, 1]], ["SP", 1, 0, 2, [1], 1], ["AN", 1, 1, 2], ["FFSP", 1, 0, [2, 1], 1, 1], ["AN", 1, 1, 6], ["PR", 4, 0, "auto_unroll_max_step$16"]]]], "r": [[9.50323e-05], 0, 1.08614, 1710093641], "v": "v0.6"}
{"i": [["[\"matmul_layer\", 1, 1024, 1024]", "cuda -keys=cuda,gpu -arch=sm_86 -max_num_threads=1024 -thread_warp_size=32", [-1, 16, 64, 49152, 2147483647, 1024, 8, 32], "", 0, []], [[], [["CHW", 2, "local"], ["SP", 2, 0, 1, [1, 1, 1, 1], 1], ["SP", 2, 5, 1024, [2, 64, 2, 2], 1], ["SP", 2, 10, 1024, [8, 2], 1], ["RE", 2, [0, 5, 1, 6, 2, 7, 10, 11, 3, 8, 12, 4, 9]], ["FSP", 3, 0, 1, 3], ["FSP", 3, 4, 2, 3], ["RE", 3, [0, 4, 1, 5, 2, 6, 3, 7]], ["CA", 2, 3, 5], ["CHR", 1, "shared", [2]], ["CA", 2, 3, 6], ["CHR", 0, "shared", [3]], ["CA", 1, 4, 6], ["FU", 5, [0, 1]], ["AN", 5, 0, 5], ["FU", 5, [1, 2]], ["AN", 5, 1, 4], ["FU", 5, [2, 3]], ["AN", 5, 2, 6], ["FU", 3, [0, 1]], ["SP", 3, 0, 8, [4], 1], ["AN", 3, 1, 2], ["FFSP", 3, 0, [2, 1], 1, 1], ["AN", 3, 1, 6], ["FU", 1, [0, 1]], ["SP", 1, 0, 4, [1], 1], ["AN", 1, 1, 2], ["FFSP", 1, 0, [2, 1], 1, 1], ["AN", 1, 1, 6], ["PR", 4, 0, "auto_unroll_max_step$64"]]]], "r": [[6.37788e-05], 0, 1.14861, 1710093642], "v": "v0.6"}
{"i": [["[\"matmul_layer\", 1, 1024, 1024]", "cuda -keys=cuda,gpu -arch=sm_86 -max_num_threads=1024 -thread_warp_size=32", [-1, 16, 64, 49152, 2147483647, 1024, 8, 32], "", 0, []], [[], [["CHW", 2, "local"], ["SP", 2, 0, 1, [1, 1, 1, 1], 1], ["SP", 2, 5, 1024, [1, 64, 1, 2], 1], ["SP", 2, 10, 1024, [2, 1], 1], ["RE", 2, [0, 5, 1, 6, 2, 7, 10, 11, 3, 8, 12, 4, 9]], ["FSP", 3, 0, 1, 3], ["FSP", 3, 4, 2, 3], ["RE", 3, [0, 4, 1, 5, 2, 6, 3, 7]], ["CA", 2, 3, 5], ["CHR", 1, "shared", [2]], ["CA", 2, 3, 6], ["CHR", 0, "shared", [3]], ["CA", 1, 4, 6], ["FU", 5, [0, 1]], ["AN", 5, 0, 5], ["FU", 5, [1, 2]], ["AN", 5, 1, 4], ["FU", 5, [2, 3]], ["AN", 5, 2, 6], ["FU", 3, [0, 1]], ["SP", 3, 0, 4, [1], 1], ["AN", 3, 1, 2], ["FFSP", 3, 0, [2, 1], 1, 1], ["AN", 3, 1, 6], ["FU", 1, [0, 1]], ["SP", 1, 0, 2, [1], 1], ["AN", 1, 1, 2], ["FFSP", 1, 0, [2, 1], 1, 1], ["AN", 1, 1, 6], ["PR", 4, 0, "auto_unroll_max_step$512"]]]], "r": [[4.66757e-05], 0, 1.09087, 1710093642], "v": "v0.6"}
{"i": [["[\"matmul_layer\", 1, 1024, 1024]", "cuda -keys=cuda,gpu -arch=sm_86 -max_num_threads=1024 -thread_warp_size=32", [-1, 16, 64, 49152, 2147483647, 1024, 8, 32], "", 0, []], [[], [["CHW", 2, "local"], ["SP", 2, 0, 1, [1, 1, 1, 1], 1], ["SP", 2, 5, 1024, [1, 32, 16, 1], 1], ["SP", 2, 10, 1024, [4, 2], 1], ["RE", 2, [0, 5, 1, 6, 2, 7, 10, 11, 3, 8, 12, 4, 9]], ["FSP", 3, 0, 1, 3], ["FSP", 3, 4, 2, 3], ["RE", 3, [0, 4, 1, 5, 2, 6, 3, 7]], ["CA", 2, 3, 5], ["CHR", 1, "shared", [2]], ["CA", 2, 3, 6], ["CHR", 0, "shared", [3]], ["CA", 1, 4, 6], ["FU", 5, [0, 1]], ["AN", 5, 0, 5], ["FU", 5, [1, 2]], ["AN", 5, 1, 4], ["FU", 5, [2, 3]], ["AN", 5, 2, 6], ["FU", 3, [0, 1]], ["SP", 3, 0, 128, [1], 1], ["AN", 3, 1, 2], ["FFSP", 3, 0, [2, 1], 1, 1], ["AN", 3, 1, 6], ["FU", 1, [0, 1]], ["SP", 1, 0, 8, [4], 1], ["AN", 1, 1, 2], ["FFSP", 1, 0, [2, 1], 1, 1], ["AN", 1, 1, 6], ["PR", 4, 0, "auto_unroll_max_step$512"]]]], "r": [[0.000152083], 0, 1.49776, 1710093643], "v": "v0.6"}
{"i": [["[\"matmul_layer\", 1, 1024, 1024]", "cuda -keys=cuda,gpu -arch=sm_86 -max_num_threads=1024 -thread_warp_size=32", [-1, 16, 64, 49152, 2147483647, 1024, 8, 32], "", 0, []], [[], [["CHW", 2, "local"], ["SP", 2, 0, 1, [1, 1, 1, 1], 1], ["SP", 2, 5, 1024, [1, 64, 4, 2], 1], ["SP", 2, 10, 1024, [2, 2], 1], ["RE", 2, [0, 5, 1, 6, 2, 7, 10, 11, 3, 8, 12, 4, 9]], ["FSP", 3, 0, 1, 3], ["FSP", 3, 4, 2, 3], ["RE", 3, [0, 4, 1, 5, 2, 6, 3, 7]], ["CA", 2, 3, 5], ["CHR", 1, "shared", [2]], ["CA", 2, 3, 6], ["CHR", 0, "shared", [3]], ["CA", 1, 4, 6], ["FU", 5, [0, 1]], ["AN", 5, 0, 5], ["FU", 5, [1, 2]], ["AN", 5, 1, 4], ["FU", 5, [2, 3]], ["AN", 5, 2, 6], ["FU", 3, [0, 1]], ["SP", 3, 0, 128, [1], 1], ["AN", 3, 1, 2], ["FFSP", 3, 0, [2, 1], 1, 1], ["AN", 3, 1, 6], ["FU", 1, [0, 1]], ["SP", 1, 0, 16, [8], 1], ["AN", 1, 1, 2], ["FFSP", 1, 0, [2, 1], 1, 1], ["AN", 1, 1, 6], ["PR", 4, 0, "auto_unroll_max_step$16"]]]], "r": [[0.000106278], 0, 1.12526, 1710093644], "v": "v0.6"}
{"i": [["[\"matmul_layer\", 1, 1024, 1024]", "cuda -keys=cuda,gpu -arch=sm_86 -max_num_threads=1024 -thread_warp_size=32", [-1, 16, 64, 49152, 2147483647, 1024, 8, 32], "", 0, []], [[], [["CHW", 2, "local"], ["SP", 2, 0, 1, [1, 1, 1, 1], 1], ["SP", 2, 5, 1024, [1, 64, 1, 8], 1], ["SP", 2, 10, 1024, [1, 4], 1], ["RE", 2, [0, 5, 1, 6, 2, 7, 10, 11, 3, 8, 12, 4, 9]], ["FSP", 3, 0, 1, 3], ["FSP", 3, 4, 2, 3], ["RE", 3, [0, 4, 1, 5, 2, 6, 3, 7]], ["CA", 2, 3, 5], ["CHR", 1, "shared", [2]], ["CA", 2, 3, 6], ["CHR", 0, "shared", [3]], ["CA", 1, 4, 6], ["FU", 5, [0, 1]], ["AN", 5, 0, 5], ["FU", 5, [1, 2]], ["AN", 5, 1, 4], ["FU", 5, [2, 3]], ["AN", 5, 2, 6], ["FU", 3, [0, 1]], ["SP", 3, 0, 32, [1], 1], ["AN", 3, 1, 2], ["FFSP", 3, 0, [2, 1], 1, 1], ["AN", 3, 1, 6], ["FU", 1, [0, 1]], ["SP", 1, 0, 16, [1], 1], ["AN", 1, 1, 2], ["FFSP", 1, 0, [2, 1], 1, 1], ["AN", 1, 1, 6], ["PR", 4, 0, "auto_unroll_max_step$64"]]]], "r": [[0.000105586], 0, 1.13446, 1710093644], "v": "v0.6"}
{"i": [["[\"matmul_layer\", 1, 1024, 1024]", "cuda -keys=cuda,gpu -arch=sm_86 -max_num_threads=1024 -thread_warp_size=32", [-1, 16, 64, 49152, 2147483647, 1024, 8, 32], "", 0, []], [[], [["CHW", 2, "local"], ["SP", 2, 0, 1, [1, 1, 1, 1], 1], ["SP", 2, 5, 1024, [4, 64, 1, 2], 1], ["SP", 2, 10, 1024, [4, 4], 1], ["RE", 2, [0, 5, 1, 6, 2, 7, 10, 11, 3, 8, 12, 4, 9]], ["FSP", 3, 0, 1, 3], ["FSP", 3, 4, 2, 3], ["RE", 3, [0, 4, 1, 5, 2, 6, 3, 7]], ["CA", 2, 3, 5], ["CHR", 1, "shared", [2]], ["CA", 2, 3, 6], ["CHR", 0, "shared", [3]], ["CA", 1, 4, 6], ["FU", 5, [0, 1]], ["AN", 5, 0, 5], ["FU", 5, [1, 2]], ["AN", 5, 1, 4], ["FU", 5, [2, 3]], ["AN", 5, 2, 6], ["FU", 3, [0, 1]], ["SP", 3, 0, 32, [1], 1], ["AN", 3, 1, 2], ["FFSP", 3, 0, [2, 1], 1, 1], ["AN", 3, 1, 6], ["FU", 1, [0, 1]], ["SP", 1, 0, 16, [8], 1], ["AN", 1, 1, 2], ["FFSP", 1, 0, [2, 1], 1, 1], ["AN", 1, 1, 6], ["PR", 4, 0, "auto_unroll_max_step$64"]]]], "r": [[7.28961e-05], 0, 1.18971, 1710093645], "v": "v0.6"}
{"i": [["[\"matmul_layer\", 1, 1024, 1024]", "cuda -keys=cuda,gpu -arch=sm_86 -max_num_threads=1024 -thread_warp_size=32", [-1, 16, 64, 49152, 2147483647, 1024, 8, 32], "", 0, []], [[], [["CHW", 2, "local"], ["SP", 2, 0, 1, [1, 1, 1, 1], 1], ["SP", 2, 5, 1024, [4, 16, 1, 2], 1], ["SP", 2, 10, 1024, [2, 16], 1], ["RE", 2, [0, 5, 1, 6, 2, 7, 10, 11, 3, 8, 12, 4, 9]], ["FSP", 3, 0, 1, 3], ["FSP", 3, 4, 2, 3], ["RE", 3, [0, 4, 1, 5, 2, 6, 3, 7]], ["CA", 2, 3, 5], ["CHR", 1, "shared", [2]], ["CA", 2, 3, 6], ["CHR", 0, "shared", [3]], ["CA", 1, 4, 6], ["FU", 5, [0, 1]], ["AN", 5, 0, 5], ["FU", 5, [1, 2]], ["AN", 5, 1, 4], ["FU", 5, [2, 3]], ["AN", 5, 2, 6], ["FU", 3, [0, 1]], ["SP", 3, 0, 64, [1], 1], ["AN", 3, 1, 2], ["FFSP", 3, 0, [2, 1], 1, 1], ["AN", 3, 1, 6], ["FU", 1, [0, 1]], ["SP", 1, 0, 32, [2], 1], ["AN", 1, 1, 2], ["FFSP", 1, 0, [2, 1], 1, 1], ["AN", 1, 1, 6], ["PR", 4, 0, "auto_unroll_max_step$1024"]]]], "r": [[5.84299e-05], 0, 2.14306, 1710093645], "v": "v0.6"}
{"i": [["[\"matmul_layer\", 1, 1024, 1024]", "cuda -keys=cuda,gpu -arch=sm_86 -max_num_threads=1024 -thread_warp_size=32", [-1, 16, 64, 49152, 2147483647, 1024, 8, 32], "", 0, []], [[], [["CHW", 2, "local"], ["SP", 2, 0, 1, [1, 1, 1, 1], 1], ["SP", 2, 5, 1024, [8, 32, 1, 2], 1], ["SP", 2, 10, 1024, [16, 1], 1], ["RE", 2, [0, 5, 1, 6, 2, 7, 10, 11, 3, 8, 12, 4, 9]], ["FSP", 3, 0, 1, 3], ["FSP", 3, 4, 2, 3], ["RE", 3, [0, 4, 1, 5, 2, 6, 3, 7]], ["CA", 2, 3, 5], ["CHR", 1, "shared", [2]], ["CA", 2, 3, 6], ["CHR", 0, "shared", [3]], ["CA", 1, 4, 6], ["FU", 5, [0, 1]], ["AN", 5, 0, 5], ["FU", 5, [1, 2]], ["AN", 5, 1, 4], ["FU", 5, [2, 3]], ["AN", 5, 2, 6], ["FU", 3, [0, 1]], ["SP", 3, 0, 32, [1], 1], ["AN", 3, 1, 2], ["FFSP", 3, 0, [2, 1], 1, 1], ["AN", 3, 1, 6], ["FU", 1, [0, 1]], ["SP", 1, 0, 16, [4], 1], ["AN", 1, 1, 2], ["FFSP", 1, 0, [2, 1], 1, 1], ["AN", 1, 1, 6], ["PR", 4, 0, "auto_unroll_max_step$512"]]]], "r": [[0.000107256], 0, 2.02889, 1710093646], "v": "v0.6"}
{"i": [["[\"matmul_layer\", 1, 1024, 1024]", "cuda -keys=cuda,gpu -arch=sm_86 -max_num_threads=1024 -thread_warp_size=32", [-1, 16, 64, 49152, 2147483647, 1024, 8, 32], "", 0, []], [[], [["CHW", 2, "local"], ["SP", 2, 0, 1, [1, 1, 1, 1], 1], ["SP", 2, 5, 1024, [4, 128, 1, 1], 1], ["SP", 2, 10, 1024, [1, 2], 1], ["RE", 2, [0, 5, 1, 6, 2, 7, 10, 11, 3, 8, 12, 4, 9]], ["FSP", 3, 0, 1, 3], ["FSP", 3, 4, 2, 3], ["RE", 3, [0, 4, 1, 5, 2, 6, 3, 7]], ["CA", 2, 3, 5], ["CHR", 1, "shared", [2]], ["CA", 2, 3, 6], ["CHR", 0, "shared", [3]], ["CA", 1, 4, 6], ["FU", 5, [0, 1]], ["AN", 5, 0, 5], ["FU", 5, [1, 2]], ["AN", 5, 1, 4], ["FU", 5, [2, 3]], ["AN", 5, 2, 6], ["FU", 3, [0, 1]], ["SP", 3, 0, 4, [1], 1], ["AN", 3, 1, 2], ["FFSP", 3, 0, [2, 1], 1, 1], ["AN", 3, 1, 6], ["FU", 1, [0, 1]], ["SP", 1, 0, 2, [1], 1], ["AN", 1, 1, 2], ["FFSP", 1, 0, [2, 1], 1, 1], ["AN", 1, 1, 6], ["PR", 4, 0, "auto_unroll_max_step$0"]]]], "r": [[0.000124018], 0, 1.04806, 1710093646], "v": "v0.6"}
{"i": [["[\"matmul_layer\", 1, 1024, 1024]", "cuda -keys=cuda,gpu -arch=sm_86 -max_num_threads=1024 -thread_warp_size=32", [-1, 16, 64, 49152, 2147483647, 1024, 8, 32], "", 0, []], [[], [["CHW", 2, "local"], ["SP", 2, 0, 1, [1, 1, 1, 1], 1], ["SP", 2, 5, 1024, [2, 4, 16, 2], 1], ["SP", 2, 10, 1024, [2, 16], 1], ["RE", 2, [0, 5, 1, 6, 2, 7, 10, 11, 3, 8, 12, 4, 9]], ["FSP", 3, 0, 1, 3], ["FSP", 3, 4, 2, 3], ["RE", 3, [0, 4, 1, 5, 2, 6, 3, 7]], ["CA", 2, 3, 5], ["CHR", 1, "shared", [2]], ["CA", 2, 3, 6], ["CHR", 0, "shared", [3]], ["CA", 1, 4, 6], ["FU", 5, [0, 1]], ["AN", 5, 0, 5], ["FU", 5, [1, 2]], ["AN", 5, 1, 4], ["FU", 5, [2, 3]], ["AN", 5, 2, 6], ["FU", 3, [0, 1]], ["SP", 3, 0, 64, [1], 1], ["AN", 3, 1, 2], ["FFSP", 3, 0, [2, 1], 1, 1], ["AN", 3, 1, 6], ["FU", 1, [0, 1]], ["SP", 1, 0, 32, [1], 1], ["AN", 1, 1, 2], ["FFSP", 1, 0, [2, 1], 1, 1], ["AN", 1, 1, 6], ["PR", 4, 0, "auto_unroll_max_step$64"]]]], "r": [[0.000754157], 0, 1.27401, 1710093646], "v": "v0.6"}
{"i": [["[\"matmul_layer\", 1, 1024, 1024]", "cuda -keys=cuda,gpu -arch=sm_86 -max_num_threads=1024 -thread_warp_size=32", [-1, 16, 64, 49152, 2147483647, 1024, 8, 32], "", 0, []], [[], [["CHW", 2, "local"], ["SP", 2, 0, 1, [1, 1, 1, 1], 1], ["SP", 2, 5, 1024, [2, 64, 1, 2], 1], ["SP", 2, 10, 1024, [2, 2], 1], ["RE", 2, [0, 5, 1, 6, 2, 7, 10, 11, 3, 8, 12, 4, 9]], ["FSP", 3, 0, 1, 3], ["FSP", 3, 4, 2, 3], ["RE", 3, [0, 4, 1, 5, 2, 6, 3, 7]], ["CA", 2, 3, 5], ["CHR", 1, "shared", [2]], ["CA", 2, 3, 6], ["CHR", 0, "shared", [3]], ["CA", 1, 4, 6], ["FU", 5, [0, 1]], ["AN", 5, 0, 5], ["FU", 5, [1, 2]], ["AN", 5, 1, 4], ["FU", 5, [2, 3]], ["AN", 5, 2, 6], ["FU", 3, [0, 1]], ["SP", 3, 0, 64, [1], 1], ["AN", 3, 1, 2], ["FFSP", 3, 0, [2, 1], 1, 1], ["AN", 3, 1, 6], ["FU", 1, [0, 1]], ["SP", 1, 0, 32, [4], 1], ["AN", 1, 1, 2], ["FFSP", 1, 0, [2, 1], 1, 1], ["AN", 1, 1, 6], ["PR", 4, 0, "auto_unroll_max_step$64"]]]], "r": [[7.35274e-05], 0, 1.11329, 1710093647], "v": "v0.6"}
{"i": [["[\"matmul_layer\", 1, 1024, 1024]", "cuda -keys=cuda,gpu -arch=sm_86 -max_num_threads=1024 -thread_warp_size=32", [-1, 16, 64, 49152, 2147483647, 1024, 8, 32], "", 0, []], [[], [["CHW", 2, "local"], ["SP", 2, 0, 1, [1, 1, 1, 1], 1], ["SP", 2, 5, 1024, [2, 64, 1, 2], 1], ["SP", 2, 10, 1024, [2, 2], 1], ["RE", 2, [0, 5, 1, 6, 2, 7, 10, 11, 3, 8, 12, 4, 9]], ["FSP", 3, 0, 1, 3], ["FSP", 3, 4, 2, 3], ["RE", 3, [0, 4, 1, 5, 2, 6, 3, 7]], ["CA", 2, 3, 5], ["CHR", 1, "shared", [2]], ["CA", 2, 3, 6], ["CHR", 0, "shared", [3]], ["CA", 1, 4, 6], ["FU", 5, [0, 1]], ["AN", 5, 0, 5], ["FU", 5, [1, 2]], ["AN", 5, 1, 4], ["FU", 5, [2, 3]], ["AN", 5, 2, 6], ["FU", 3, [0, 1]], ["SP", 3, 0, 8, [1], 1], ["AN", 3, 1, 2], ["FFSP", 3, 0, [2, 1], 1, 1], ["AN", 3, 1, 6], ["FU", 1, [0, 1]], ["SP", 1, 0, 4, [2], 1], ["AN", 1, 1, 2], ["FFSP", 1, 0, [2, 1], 1, 1], ["AN", 1, 1, 6], ["PR", 4, 0, "auto_unroll_max_step$512"]]]], "r": [[6.99051e-05], 0, 1.08297, 1710093647], "v": "v0.6"}
{"i": [["[\"matmul_layer\", 1, 1024, 1024]", "cuda -keys=cuda,gpu -arch=sm_86 -max_num_threads=1024 -thread_warp_size=32", [-1, 16, 64, 49152, 2147483647, 1024, 8, 32], "", 0, []], [[], [["CHW", 2, "local"], ["SP", 2, 0, 1, [1, 1, 1, 1], 1], ["SP", 2, 5, 1024, [1, 16, 1, 4], 1], ["SP", 2, 10, 1024, [4, 8], 1], ["RE", 2, [0, 5, 1, 6, 2, 7, 10, 11, 3, 8, 12, 4, 9]], ["FSP", 3, 0, 1, 3], ["FSP", 3, 4, 2, 3], ["RE", 3, [0, 4, 1, 5, 2, 6, 3, 7]], ["CA", 2, 3, 5], ["CHR", 1, "shared", [2]], ["CA", 2, 3, 6], ["CHR", 0, "shared", [3]], ["CA", 1, 4, 6], ["FU", 5, [0, 1]], ["AN", 5, 0, 5], ["FU", 5, [1, 2]], ["AN", 5, 1, 4], ["FU", 5, [2, 3]], ["AN", 5, 2, 6], ["FU", 3, [0, 1]], ["SP", 3, 0, 128, [2], 1], ["AN", 3, 1, 2], ["FFSP", 3, 0, [2, 1], 1, 1], ["AN", 3, 1, 6], ["FU", 1, [0, 1]], ["SP", 1, 0, 32, [1], 1], ["AN", 1, 1, 2], ["FFSP", 1, 0, [2, 1], 1, 1], ["AN", 1, 1, 6], ["PR", 4, 0, "auto_unroll_max_step$1024"]]]], "r": [[2.31652e-05], 0, 1.3274, 1710093648], "v": "v0.6"}
{"i": [["[\"matmul_layer\", 1, 1024, 1024]", "cuda -keys=cuda,gpu -arch=sm_86 -max_num_threads=1024 -thread_warp_size=32", [-1, 16, 64, 49152, 2147483647, 1024, 8, 32], "", 0, []], [[], [["CHW", 2, "local"], ["SP", 2, 0, 1, [1, 1, 1, 1], 1], ["SP", 2, 5, 1024, [1, 4, 1, 1], 1], ["SP", 2, 10, 1024, [16, 4], 1], ["RE", 2, [0, 5, 1, 6, 2, 7, 10, 11, 3, 8, 12, 4, 9]], ["FSP", 3, 0, 1, 3], ["FSP", 3, 4, 2, 3], ["RE", 3, [0, 4, 1, 5, 2, 6, 3, 7]], ["CA", 2, 3, 5], ["CHR", 1, "shared", [2]], ["CA", 2, 3, 6], ["CHR", 0, "shared", [3]], ["CA", 1, 4, 6], ["FU", 5, [0, 1]], ["AN", 5, 0, 5], ["FU", 5, [1, 2]], ["AN", 5, 1, 4], ["FU", 5, [2, 3]], ["AN", 5, 2, 6], ["FU", 3, [0, 1]], ["SP", 3, 0, 64, [1], 1], ["AN", 3, 1, 2], ["FFSP", 3, 0, [2, 1], 1, 1], ["AN", 3, 1, 6], ["FU", 1, [0, 1]], ["SP", 1, 0, 64, [1], 1], ["AN", 1, 1, 2], ["FFSP", 1, 0, [2, 1], 1, 1], ["AN", 1, 1, 6], ["PR", 4, 0, "auto_unroll_max_step$0"]]]], "r": [[1.81775e-05], 0, 1.17776, 1710093648], "v": "v0.6"}
{"i": [["[\"matmul_layer\", 1, 1024, 1024]", "cuda -keys=cuda,gpu -arch=sm_86 -max_num_threads=1024 -thread_warp_size=32", [-1, 16, 64, 49152, 2147483647, 1024, 8, 32], "", 0, []], [[], [["CHW", 2, "local"], ["SP", 2, 0, 1, [1, 1, 1, 1], 1], ["SP", 2, 5, 1024, [2, 32, 1, 2], 1], ["SP", 2, 10, 1024, [2, 16], 1], ["RE", 2, [0, 5, 1, 6, 2, 7, 10, 11, 3, 8, 12, 4, 9]], ["FSP", 3, 0, 1, 3], ["FSP", 3, 4, 2, 3], ["RE", 3, [0, 4, 1, 5, 2, 6, 3, 7]], ["CA", 2, 3, 5], ["CHR", 1, "shared", [2]], ["CA", 2, 3, 6], ["CHR", 0, "shared", [3]], ["CA", 1, 4, 6], ["FU", 5, [0, 1]], ["AN", 5, 0, 5], ["FU", 5, [1, 2]], ["AN", 5, 1, 4], ["FU", 5, [2, 3]], ["AN", 5, 2, 6], ["FU", 3, [0, 1]], ["SP", 3, 0, 64, [1], 1], ["AN", 3, 1, 2], ["FFSP", 3, 0, [2, 1], 1, 1], ["AN", 3, 1, 6], ["FU", 1, [0, 1]], ["SP", 1, 0, 32, [1], 1], ["AN", 1, 1, 2], ["FFSP", 1, 0, [2, 1], 1, 1], ["AN", 1, 1, 6], ["PR", 4, 0, "auto_unroll_max_step$1024"]]]], "r": [[2.89125e-05], 0, 1.44159, 1710093649], "v": "v0.6"}
{"i": [["[\"matmul_layer\", 1, 1024, 1024]", "cuda -keys=cuda,gpu -arch=sm_86 -max_num_threads=1024 -thread_warp_size=32", [-1, 16, 64, 49152, 2147483647, 1024, 8, 32], "", 0, []], [[], [["CHW", 2, "local"], ["SP", 2, 0, 1, [1, 1, 1, 1], 1], ["SP", 2, 5, 1024, [4, 32, 1, 1], 1], ["SP", 2, 10, 1024, [4, 2], 1], ["RE", 2, [0, 5, 1, 6, 2, 7, 10, 11, 3, 8, 12, 4, 9]], ["FSP", 3, 0, 1, 3], ["FSP", 3, 4, 2, 3], ["RE", 3, [0, 4, 1, 5, 2, 6, 3, 7]], ["CA", 2, 3, 5], ["CHR", 1, "shared", [2]], ["CA", 2, 3, 6], ["CHR", 0, "shared", [3]], ["CA", 1, 4, 6], ["FU", 5, [0, 1]], ["AN", 5, 0, 5], ["FU", 5, [1, 2]], ["AN", 5, 1, 4], ["FU", 5, [2, 3]], ["AN", 5, 2, 6], ["FU", 3, [0, 1]], ["SP", 3, 0, 8, [4], 1], ["AN", 3, 1, 2], ["FFSP", 3, 0, [2, 1], 1, 1], ["AN", 3, 1, 6], ["FU", 1, [0, 1]], ["SP", 1, 0, 8, [2], 1], ["AN", 1, 1, 2], ["FFSP", 1, 0, [2, 1], 1, 1], ["AN", 1, 1, 6], ["PR", 4, 0, "auto_unroll_max_step$0"]]]], "r": [[4.41622e-05], 0, 1.08047, 1710093649], "v": "v0.6"}
{"i": [["[\"matmul_layer\", 1, 1024, 1024]", "cuda -keys=cuda,gpu -arch=sm_86 -max_num_threads=1024 -thread_warp_size=32", [-1, 16, 64, 49152, 2147483647, 1024, 8, 32], "", 0, []], [[], [["CHW", 2, "local"], ["SP", 2, 0, 1, [1, 1, 1, 1], 1], ["SP", 2, 5, 1024, [1, 32, 8, 2], 1], ["SP", 2, 10, 1024, [16, 1], 1], ["RE", 2, [0, 5, 1, 6, 2, 7, 10, 11, 3, 8, 12, 4, 9]], ["FSP", 3, 0, 1, 3], ["FSP", 3, 4, 2, 3], ["RE", 3, [0, 4, 1, 5, 2, 6, 3, 7]], ["CA", 2, 3, 5], ["CHR", 1, "shared", [2]], ["CA", 2, 3, 6], ["CHR", 0, "shared", [3]], ["CA", 1, 4, 6], ["FU", 5, [0, 1]], ["AN", 5, 0, 5], ["FU", 5, [1, 2]], ["AN", 5, 1, 4], ["FU", 5, [2, 3]], ["AN", 5, 2, 6], ["FU", 3, [0, 1]], ["SP", 3, 0, 128, [4], 1], ["AN", 3, 1, 2], ["FFSP", 3, 0, [2, 1], 1, 1], ["AN", 3, 1, 6], ["FU", 1, [0, 1]], ["SP", 1, 0, 16, [4], 1], ["AN", 1, 1, 2], ["FFSP", 1, 0, [2, 1], 1, 1], ["AN", 1, 1, 6], ["PR", 4, 0, "auto_unroll_max_step$16"]]]], "r": [[0.000137795], 0, 1.17689, 1710093650], "v": "v0.6"}
{"i": [["[\"matmul_layer\", 1, 1024, 1024]", "cuda -keys=cuda,gpu -arch=sm_86 -max_num_threads=1024 -thread_warp_size=32", [-1, 16, 64, 49152, 2147483647, 1024, 8, 32], "", 0, []], [[], [["CHW", 2, "local"], ["SP", 2, 0, 1, [1, 1, 1, 1], 1], ["SP", 2, 5, 1024, [1, 64, 8, 1], 1], ["SP", 2, 10, 1024, [1, 1], 1], ["RE", 2, [0, 5, 1, 6, 2, 7, 10, 11, 3, 8, 12, 4, 9]], ["FSP", 3, 0, 1, 3], ["FSP", 3, 4, 2, 3], ["RE", 3, [0, 4, 1, 5, 2, 6, 3, 7]], ["CA", 2, 3, 5], ["CHR", 1, "shared", [2]], ["CA", 2, 3, 6], ["CHR", 0, "shared", [3]], ["CA", 1, 4, 6], ["FU", 5, [0, 1]], ["AN", 5, 0, 5], ["FU", 5, [1, 2]], ["AN", 5, 1, 4], ["FU", 5, [2, 3]], ["AN", 5, 2, 6], ["FU", 3, [0, 1]], ["SP", 3, 0, 16, [1], 1], ["AN", 3, 1, 2], ["FFSP", 3, 0, [2, 1], 1, 1], ["AN", 3, 1, 6], ["FU", 1, [0, 1]], ["SP", 1, 0, 2, [2], 1], ["AN", 1, 1, 2], ["FFSP", 1, 0, [2, 1], 1, 1], ["AN", 1, 1, 6], ["PR", 4, 0, "auto_unroll_max_step$512"]]]], "r": [[0.000194797], 0, 1.08316, 1710093650], "v": "v0.6"}
{"i": [["[\"matmul_layer\", 1, 1024, 1024]", "cuda -keys=cuda,gpu -arch=sm_86 -max_num_threads=1024 -thread_warp_size=32", [-1, 16, 64, 49152, 2147483647, 1024, 8, 32], "", 0, []], [[], [["CHW", 2, "local"], ["SP", 2, 0, 1, [1, 1, 1, 1], 1], ["SP", 2, 5, 1024, [8, 32, 1, 1], 1], ["SP", 2, 10, 1024, [16, 1], 1], ["RE", 2, [0, 5, 1, 6, 2, 7, 10, 11, 3, 8, 12, 4, 9]], ["FSP", 3, 0, 1, 3], ["FSP", 3, 4, 2, 3], ["RE", 3, [0, 4, 1, 5, 2, 6, 3, 7]], ["CA", 2, 3, 5], ["CHR", 1, "shared", [2]], ["CA", 2, 3, 6], ["CHR", 0, "shared", [3]], ["CA", 1, 4, 6], ["FU", 5, [0, 1]], ["AN", 5, 0, 5], ["FU", 5, [1, 2]], ["AN", 5, 1, 4], ["FU", 5, [2, 3]], ["AN", 5, 2, 6], ["FU", 3, [0, 1]], ["SP", 3, 0, 16, [1], 1], ["AN", 3, 1, 2], ["FFSP", 3, 0, [2, 1], 1, 1], ["AN", 3, 1, 6], ["FU", 1, [0, 1]], ["SP", 1, 0, 16, [2], 1], ["AN", 1, 1, 2], ["FFSP", 1, 0, [2, 1], 1, 1], ["AN", 1, 1, 6], ["PR", 4, 0, "auto_unroll_max_step$64"]]]], "r": [[6.5788e-05], 0, 1.09942, 1710093651], "v": "v0.6"}
{"i": [["[\"matmul_layer\", 1, 1024, 1024]", "cuda -keys=cuda,gpu -arch=sm_86 -max_num_threads=1024 -thread_warp_size=32", [-1, 16, 64, 49152, 2147483647, 1024, 8, 32], "", 0, []], [[], [["CHW", 2, "local"], ["SP", 2, 0, 1, [1, 1, 1, 1], 1], ["SP", 2, 5, 1024, [2, 64, 1, 4], 1], ["SP", 2, 10, 1024, [2, 8], 1], ["RE", 2, [0, 5, 1, 6, 2, 7, 10, 11, 3, 8, 12, 4, 9]], ["FSP", 3, 0, 1, 3], ["FSP", 3, 4, 2, 3], ["RE", 3, [0, 4, 1, 5, 2, 6, 3, 7]], ["CA", 2, 3, 5], ["CHR", 1, "shared", [2]], ["CA", 2, 3, 6], ["CHR", 0, "shared", [3]], ["CA", 1, 4, 6], ["FU", 5, [0, 1]], ["AN", 5, 0, 5], ["FU", 5, [1, 2]], ["AN", 5, 1, 4], ["FU", 5, [2, 3]], ["AN", 5, 2, 6], ["FU", 3, [0, 1]], ["SP", 3, 0, 64, [1], 1], ["AN", 3, 1, 2], ["FFSP", 3, 0, [2, 1], 1, 1], ["AN", 3, 1, 6], ["FU", 1, [0, 1]], ["SP", 1, 0, 16, [8], 1], ["AN", 1, 1, 2], ["FFSP", 1, 0, [2, 1], 1, 1], ["AN", 1, 1, 6], ["PR", 4, 0, "auto_unroll_max_step$64"]]]], "r": [[7.35614e-05], 0, 1.22133, 1710093651], "v": "v0.6"}
{"i": [["[\"matmul_layer\", 1, 1024, 1024]", "cuda -keys=cuda,gpu -arch=sm_86 -max_num_threads=1024 -thread_warp_size=32", [-1, 16, 64, 49152, 2147483647, 1024, 8, 32], "", 0, []], [[], [["CHW", 2, "local"], ["SP", 2, 0, 1, [1, 1, 1, 1], 1], ["SP", 2, 5, 1024, [1, 64, 2, 4], 1], ["SP", 2, 10, 1024, [4, 2], 1], ["RE", 2, [0, 5, 1, 6, 2, 7, 10, 11, 3, 8, 12, 4, 9]], ["FSP", 3, 0, 1, 3], ["FSP", 3, 4, 2, 3], ["RE", 3, [0, 4, 1, 5, 2, 6, 3, 7]], ["CA", 2, 3, 5], ["CHR", 1, "shared", [2]], ["CA", 2, 3, 6], ["CHR", 0, "shared", [3]], ["CA", 1, 4, 6], ["FU", 5, [0, 1]], ["AN", 5, 0, 5], ["FU", 5, [1, 2]], ["AN", 5, 1, 4], ["FU", 5, [2, 3]], ["AN", 5, 2, 6], ["FU", 3, [0, 1]], ["SP", 3, 0, 16, [1], 1], ["AN", 3, 1, 2], ["FFSP", 3, 0, [2, 1], 1, 1], ["AN", 3, 1, 6], ["FU", 1, [0, 1]], ["SP", 1, 0, 4, [1], 1], ["AN", 1, 1, 2], ["FFSP", 1, 0, [2, 1], 1, 1], ["AN", 1, 1, 6], ["PR", 4, 0, "auto_unroll_max_step$512"]]]], "r": [[9.14081e-05], 0, 1.2216, 1710093652], "v": "v0.6"}
{"i": [["[\"matmul_layer\", 1, 1024, 1024]", "cuda -keys=cuda,gpu -arch=sm_86 -max_num_threads=1024 -thread_warp_size=32", [-1, 16, 64, 49152, 2147483647, 1024, 8, 32], "", 0, []], [[], [["CHW", 2, "local"], ["SP", 2, 0, 1, [1, 1, 1, 1], 1], ["SP", 2, 5, 1024, [1, 1, 1, 2], 1], ["SP", 2, 10, 1024, [1, 4], 1], ["RE", 2, [0, 5, 1, 6, 2, 7, 10, 11, 3, 8, 12, 4, 9]], ["FSP", 3, 0, 1, 3], ["FSP", 3, 4, 2, 3], ["RE", 3, [0, 4, 1, 5, 2, 6, 3, 7]], ["CA", 2, 3, 5], ["CHR", 1, "shared", [2]], ["CA", 2, 3, 6], ["CHR", 0, "shared", [3]], ["CA", 1, 4, 6], ["FU", 5, [0, 1]], ["AN", 5, 0, 5], ["FU", 5, [1, 2]], ["AN", 5, 1, 4], ["FU", 5, [2, 3]], ["AN", 5, 2, 6], ["FU", 3, [0, 1]], ["SP", 3, 0, 16, [1], 1], ["AN", 3, 1, 2], ["FFSP", 3, 0, [2, 1], 1, 1], ["AN", 3, 1, 6], ["FU", 1, [0, 1]], ["SP", 1, 0, 4, [1], 1], ["AN", 1, 1, 2], ["FFSP", 1, 0, [2, 1], 1, 1], ["AN", 1, 1, 6], ["PR", 4, 0, "auto_unroll_max_step$1024"]]]], "r": [[4.7664e-05], 0, 1.08937, 1710093652], "v": "v0.6"}
{"i": [["[\"matmul_layer\", 1, 1024, 1024]", "cuda -keys=cuda,gpu -arch=sm_86 -max_num_threads=1024 -thread_warp_size=32", [-1, 16, 64, 49152, 2147483647, 1024, 8, 32], "", 0, []], [[], [["CHW", 2, "local"], ["SP", 2, 0, 1, [1, 1, 1, 1], 1], ["SP", 2, 5, 1024, [4, 32, 1, 1], 1], ["SP", 2, 10, 1024, [4, 16], 1], ["RE", 2, [0, 5, 1, 6, 2, 7, 10, 11, 3, 8, 12, 4, 9]], ["FSP", 3, 0, 1, 3], ["FSP", 3, 4, 2, 3], ["RE", 3, [0, 4, 1, 5, 2, 6, 3, 7]], ["CA", 2, 3, 5], ["CHR", 1, "shared", [2]], ["CA", 2, 3, 6], ["CHR", 0, "shared", [3]], ["CA", 1, 4, 6], ["FU", 5, [0, 1]], ["AN", 5, 0, 5], ["FU", 5, [1, 2]], ["AN", 5, 1, 4], ["FU", 5, [2, 3]], ["AN", 5, 2, 6], ["FU", 3, [0, 1]], ["SP", 3, 0, 64, [1], 1], ["AN", 3, 1, 2], ["FFSP", 3, 0, [2, 1], 1, 1], ["AN", 3, 1, 6], ["FU", 1, [0, 1]], ["SP", 1, 0, 64, [1], 1], ["AN", 1, 1, 2], ["FFSP", 1, 0, [2, 1], 1, 1], ["AN", 1, 1, 6], ["PR", 4, 0, "auto_unroll_max_step$0"]]]], "r": [[3.91705e-05], 0, 1.17187, 1710093653], "v": "v0.6"}
{"i": [["[\"matmul_layer\", 1, 1024, 1024]", "cuda -keys=cuda,gpu -arch=sm_86 -max_num_threads=1024 -thread_warp_size=32", [-1, 16, 64, 49152, 2147483647, 1024, 8, 32], "", 0, []], [[], [["CHW", 2, "local"], ["SP", 2, 0, 1, [1, 1, 1, 1], 1], ["SP", 2, 5, 1024, [1, 32, 1, 1], 1], ["SP", 2, 10, 1024, [64, 1], 1], ["RE", 2, [0, 5, 1, 6, 2, 7, 10, 11, 3, 8, 12, 4, 9]], ["FSP", 3, 0, 1, 3], ["FSP", 3, 4, 2, 3], ["RE", 3, [0, 4, 1, 5, 2, 6, 3, 7]], ["CA", 2, 3, 5], ["CHR", 1, "shared", [2]], ["CA", 2, 3, 6], ["CHR", 0, "shared", [3]], ["CA", 1, 4, 6], ["FU", 5, [0, 1]], ["AN", 5, 0, 5], ["FU", 5, [1, 2]], ["AN", 5, 1, 4], ["FU", 5, [2, 3]], ["AN", 5, 2, 6], ["FU", 3, [0, 1]], ["SP", 3, 0, 64, [1], 1], ["AN", 3, 1, 2], ["FFSP", 3, 0, [2, 1], 1, 1], ["AN", 3, 1, 6], ["FU", 1, [0, 1]], ["SP", 1, 0, 64, [1], 1], ["AN", 1, 1, 2], ["FFSP", 1, 0, [2, 1], 1, 1], ["AN", 1, 1, 6], ["PR", 4, 0, "auto_unroll_max_step$0"]]]], "r": [[1.1375e-05], 0, 1.10521, 1710093653], "v": "v0.6"}
{"i": [["[\"matmul_layer\", 1, 1024, 1024]", "cuda -keys=cuda,gpu -arch=sm_86 -max_num_threads=1024 -thread_warp_size=32", [-1, 16, 64, 49152, 2147483647, 1024, 8, 32], "", 0, []], [[], [["CHW", 2, "local"], ["SP", 2, 0, 1, [1, 1, 1, 1], 1], ["SP", 2, 5, 1024, [2, 64, 2, 1], 1], ["SP", 2, 10, 1024, [2, 2], 1], ["RE", 2, [0, 5, 1, 6, 2, 7, 10, 11, 3, 8, 12, 4, 9]], ["FSP", 3, 0, 1, 3], ["FSP", 3, 4, 2, 3], ["RE", 3, [0, 4, 1, 5, 2, 6, 3, 7]], ["CA", 2, 3, 5], ["CHR", 1, "shared", [2]], ["CA", 2, 3, 6], ["CHR", 0, "shared", [3]], ["CA", 1, 4, 6], ["FU", 5, [0, 1]], ["AN", 5, 0, 5], ["FU", 5, [1, 2]], ["AN", 5, 1, 4], ["FU", 5, [2, 3]], ["AN", 5, 2, 6], ["FU", 3, [0, 1]], ["SP", 3, 0, 8, [1], 1], ["AN", 3, 1, 2], ["FFSP", 3, 0, [2, 1], 1, 1], ["AN", 3, 1, 6], ["FU", 1, [0, 1]], ["SP", 1, 0, 4, [2], 1], ["AN", 1, 1, 2], ["FFSP", 1, 0, [2, 1], 1, 1], ["AN", 1, 1, 6], ["PR", 4, 0, "auto_unroll_max_step$64"]]]], "r": [[7.0479e-05], 0, 1.03854, 1710093654], "v": "v0.6"}
{"i": [["[\"matmul_layer\", 1, 1024, 1024]", "cuda -keys=cuda,gpu -arch=sm_86 -max_num_threads=1024 -thread_warp_size=32", [-1, 16, 64, 49152, 2147483647, 1024, 8, 32], "", 0, []], [[], [["CHW", 2, "local"], ["SP", 2, 0, 1, [1, 1, 1, 1], 1], ["SP", 2, 5, 1024, [2, 256, 2, 1], 1], ["SP", 2, 10, 1024, [2, 4], 1], ["RE", 2, [0, 5, 1, 6, 2, 7, 10, 11, 3, 8, 12, 4, 9]], ["FSP", 3, 0, 1, 3], ["FSP", 3, 4, 2, 3], ["RE", 3, [0, 4, 1, 5, 2, 6, 3, 7]], ["CA", 2, 3, 5], ["CHR", 1, "shared", [2]], ["CA", 2, 3, 6], ["CHR", 0, "shared", [3]], ["CA", 1, 4, 6], ["FU", 5, [0, 1]], ["AN", 5, 0, 5], ["FU", 5, [1, 2]], ["AN", 5, 1, 4], ["FU", 5, [2, 3]], ["AN", 5, 2, 6], ["FU", 3, [0, 1]], ["SP", 3, 0, 16, [1], 1], ["AN", 3, 1, 2], ["FFSP", 3, 0, [2, 1], 1, 1], ["AN", 3, 1, 6], ["FU", 1, [0, 1]], ["SP", 1, 0, 8, [1], 1], ["AN", 1, 1, 2], ["FFSP", 1, 0, [2, 1], 1, 1], ["AN", 1, 1, 6], ["PR", 4, 0, "auto_unroll_max_step$64"]]]], "r": [[0.000116364], 0, 1.05701, 1710093654], "v": "v0.6"}
{"i": [["[\"matmul_layer\", 1, 1024, 1024]", "cuda -keys=cuda,gpu -arch=sm_86 -max_num_threads=1024 -thread_warp_size=32", [-1, 16, 64, 49152, 2147483647, 1024, 8, 32], "", 0, []], [[], [["CHW", 2, "local"], ["SP", 2, 0, 1, [1, 1, 1, 1], 1], ["SP", 2, 5, 1024, [1, 4, 16, 16], 1], ["SP", 2, 10, 1024, [1, 8], 1], ["RE", 2, [0, 5, 1, 6, 2, 7, 10, 11, 3, 8, 12, 4, 9]], ["FSP", 3, 0, 1, 3], ["FSP", 3, 4, 2, 3], ["RE", 3, [0, 4, 1, 5, 2, 6, 3, 7]], ["CA", 2, 3, 5], ["CHR", 1, "shared", [2]], ["CA", 2, 3, 6], ["CHR", 0, "shared", [3]], ["CA", 1, 4, 6], ["FU", 5, [0, 1]], ["AN", 5, 0, 5], ["FU", 5, [1, 2]], ["AN", 5, 1, 4], ["FU", 5, [2, 3]], ["AN", 5, 2, 6], ["FU", 3, [0, 1]], ["SP", 3, 0, 128, [1], 1], ["AN", 3, 1, 2], ["FFSP", 3, 0, [2, 1], 1, 1], ["AN", 3, 1, 6], ["FU", 1, [0, 1]], ["SP", 1, 0, 8, [1], 1], ["AN", 1, 1, 2], ["FFSP", 1, 0, [2, 1], 1, 1], ["AN", 1, 1, 6], ["PR", 4, 0, "auto_unroll_max_step$16"]]]], "r": [[0.00208503], 0, 1.06877, 1710093655], "v": "v0.6"}
{"i": [["[\"matmul_layer\", 1, 1024, 1024]", "cuda -keys=cuda,gpu -arch=sm_86 -max_num_threads=1024 -thread_warp_size=32", [-1, 16, 64, 49152, 2147483647, 1024, 8, 32], "", 0, []], [[], [["CHW", 2, "local"], ["SP", 2, 0, 1, [1, 1, 1, 1], 1], ["SP", 2, 5, 1024, [4, 32, 2, 4], 1], ["SP", 2, 10, 1024, [1, 2], 1], ["RE", 2, [0, 5, 1, 6, 2, 7, 10, 11, 3, 8, 12, 4, 9]], ["FSP", 3, 0, 1, 3], ["FSP", 3, 4, 2, 3], ["RE", 3, [0, 4, 1, 5, 2, 6, 3, 7]], ["CA", 2, 3, 5], ["CHR", 1, "shared", [2]], ["CA", 2, 3, 6], ["CHR", 0, "shared", [3]], ["CA", 1, 4, 6], ["FU", 5, [0, 1]], ["AN", 5, 0, 5], ["FU", 5, [1, 2]], ["AN", 5, 1, 4], ["FU", 5, [2, 3]], ["AN", 5, 2, 6], ["FU", 3, [0, 1]], ["SP", 3, 0, 16, [1], 1], ["AN", 3, 1, 2], ["FFSP", 3, 0, [2, 1], 1, 1], ["AN", 3, 1, 6], ["FU", 1, [0, 1]], ["SP", 1, 0, 2, [1], 1], ["AN", 1, 1, 2], ["FFSP", 1, 0, [2, 1], 1, 1], ["AN", 1, 1, 6], ["PR", 4, 0, "auto_unroll_max_step$0"]]]], "r": [[0.000360848], 0, 0.974344, 1710093655], "v": "v0.6"}
{"i": [["[\"matmul_layer\", 1, 1024, 1024]", "cuda -keys=cuda,gpu -arch=sm_86 -max_num_threads=1024 -thread_warp_size=32", [-1, 16, 64, 49152, 2147483647, 1024, 8, 32], "", 0, []], [[], [["CHW", 2, "local"], ["SP", 2, 0, 1, [1, 1, 1, 1], 1], ["SP", 2, 5, 1024, [4, 32, 4, 2], 1], ["SP", 2, 10, 1024, [1, 8], 1], ["RE", 2, [0, 5, 1, 6, 2, 7, 10, 11, 3, 8, 12, 4, 9]], ["FSP", 3, 0, 1, 3], ["FSP", 3, 4, 2, 3], ["RE", 3, [0, 4, 1, 5, 2, 6, 3, 7]], ["CA", 2, 3, 5], ["CHR", 1, "shared", [2]], ["CA", 2, 3, 6], ["CHR", 0, "shared", [3]], ["CA", 1, 4, 6], ["FU", 5, [0, 1]], ["AN", 5, 0, 5], ["FU", 5, [1, 2]], ["AN", 5, 1, 4], ["FU", 5, [2, 3]], ["AN", 5, 2, 6], ["FU", 3, [0, 1]], ["SP", 3, 0, 64, [1], 1], ["AN", 3, 1, 2], ["FFSP", 3, 0, [2, 1], 1, 1], ["AN", 3, 1, 6], ["FU", 1, [0, 1]], ["SP", 1, 0, 8, [1], 1], ["AN", 1, 1, 2], ["FFSP", 1, 0, [2, 1], 1, 1], ["AN", 1, 1, 6], ["PR", 4, 0, "auto_unroll_max_step$1024"]]]], "r": [[0.000251438], 0, 1.98844, 1710093664], "v": "v0.6"}
{"i": [["[\"matmul_layer\", 1, 1024, 1024]", "cuda -keys=cuda,gpu -arch=sm_86 -max_num_threads=1024 -thread_warp_size=32", [-1, 16, 64, 49152, 2147483647, 1024, 8, 32], "", 0, []], [[], [["CHW", 2, "local"], ["SP", 2, 0, 1, [1, 1, 1, 1], 1], ["SP", 2, 5, 1024, [1, 8, 1, 64], 1], ["SP", 2, 10, 1024, [16, 1], 1], ["RE", 2, [0, 5, 1, 6, 2, 7, 10, 11, 3, 8, 12, 4, 9]], ["FSP", 3, 0, 1, 3], ["FSP", 3, 4, 2, 3], ["RE", 3, [0, 4, 1, 5, 2, 6, 3, 7]], ["CA", 2, 3, 5], ["CHR", 1, "shared", [2]], ["CA", 2, 3, 6], ["CHR", 0, "shared", [3]], ["CA", 1, 4, 6], ["FU", 5, [0, 1]], ["AN", 5, 0, 5], ["FU", 5, [1, 2]], ["AN", 5, 1, 4], ["FU", 5, [2, 3]], ["AN", 5, 2, 6], ["FU", 3, [0, 1]], ["SP", 3, 0, 32, [1], 1], ["AN", 3, 1, 2], ["FFSP", 3, 0, [2, 1], 1, 1], ["AN", 3, 1, 6], ["FU", 1, [0, 1]], ["SP", 1, 0, 16, [8], 1], ["AN", 1, 1, 2], ["FFSP", 1, 0, [2, 1], 1, 1], ["AN", 1, 1, 6], ["PR", 4, 0, "auto_unroll_max_step$1024"]]]], "r": [[0.000417901], 0, 6.4504, 1710093664], "v": "v0.6"}
{"i": [["[\"matmul_layer\", 1, 1024, 1024]", "cuda -keys=cuda,gpu -arch=sm_86 -max_num_threads=1024 -thread_warp_size=32", [-1, 16, 64, 49152, 2147483647, 1024, 8, 32], "", 0, []], [[], [["CHW", 2, "local"], ["SP", 2, 0, 1, [1, 1, 1, 1], 1], ["SP", 2, 5, 1024, [1, 32, 1, 1], 1], ["SP", 2, 10, 1024, [4, 16], 1], ["RE", 2, [0, 5, 1, 6, 2, 7, 10, 11, 3, 8, 12, 4, 9]], ["FSP", 3, 0, 1, 3], ["FSP", 3, 4, 2, 3], ["RE", 3, [0, 4, 1, 5, 2, 6, 3, 7]], ["CA", 2, 3, 5], ["CHR", 1, "shared", [2]], ["CA", 2, 3, 6], ["CHR", 0, "shared", [3]], ["CA", 1, 4, 6], ["FU", 5, [0, 1]], ["AN", 5, 0, 5], ["FU", 5, [1, 2]], ["AN", 5, 1, 4], ["FU", 5, [2, 3]], ["AN", 5, 2, 6], ["FU", 3, [0, 1]], ["SP", 3, 0, 64, [1], 1], ["AN", 3, 1, 2], ["FFSP", 3, 0, [2, 1], 1, 1], ["AN", 3, 1, 6], ["FU", 1, [0, 1]], ["SP", 1, 0, 64, [1], 1], ["AN", 1, 1, 2], ["FFSP", 1, 0, [2, 1], 1, 1], ["AN", 1, 1, 6], ["PR", 4, 0, "auto_unroll_max_step$64"]]]], "r": [[1.12784e-05], 0, 1.19442, 1710093665], "v": "v0.6"}
{"i": [["[\"matmul_layer\", 1, 1024, 1024]", "cuda -keys=cuda,gpu -arch=sm_86 -max_num_threads=1024 -thread_warp_size=32", [-1, 16, 64, 49152, 2147483647, 1024, 8, 32], "", 0, []], [[], [["CHW", 2, "local"], ["SP", 2, 0, 1, [1, 1, 1, 1], 1], ["SP", 2, 5, 1024, [1, 64, 1, 1], 1], ["SP", 2, 10, 1024, [1, 32], 1], ["RE", 2, [0, 5, 1, 6, 2, 7, 10, 11, 3, 8, 12, 4, 9]], ["FSP", 3, 0, 1, 3], ["FSP", 3, 4, 2, 3], ["RE", 3, [0, 4, 1, 5, 2, 6, 3, 7]], ["CA", 2, 3, 5], ["CHR", 1, "shared", [2]], ["CA", 2, 3, 6], ["CHR", 0, "shared", [3]], ["CA", 1, 4, 6], ["FU", 5, [0, 1]], ["AN", 5, 0, 5], ["FU", 5, [1, 2]], ["AN", 5, 1, 4], ["FU", 5, [2, 3]], ["AN", 5, 2, 6], ["FU", 3, [0, 1]], ["SP", 3, 0, 128, [1], 1], ["AN", 3, 1, 2], ["FFSP", 3, 0, [2, 1], 1, 1], ["AN", 3, 1, 6], ["FU", 1, [0, 1]], ["SP", 1, 0, 128, [1], 1], ["AN", 1, 1, 2], ["FFSP", 1, 0, [2, 1], 1, 1], ["AN", 1, 1, 6], ["PR", 4, 0, "auto_unroll_max_step$1024"]]]], "r": [[1.48844e-05], 0, 1.13348, 1710093665], "v": "v0.6"}
{"i": [["[\"matmul_layer\", 1, 1024, 1024]", "cuda -keys=cuda,gpu -arch=sm_86 -max_num_threads=1024 -thread_warp_size=32", [-1, 16, 64, 49152, 2147483647, 1024, 8, 32], "", 0, []], [[], [["CHW", 2, "local"], ["SP", 2, 0, 1, [1, 1, 1, 1], 1], ["SP", 2, 5, 1024, [2, 64, 4, 1], 1], ["SP", 2, 10, 1024, [4, 2], 1], ["RE", 2, [0, 5, 1, 6, 2, 7, 10, 11, 3, 8, 12, 4, 9]], ["FSP", 3, 0, 1, 3], ["FSP", 3, 4, 2, 3], ["RE", 3, [0, 4, 1, 5, 2, 6, 3, 7]], ["CA", 2, 3, 5], ["CHR", 1, "shared", [2]], ["CA", 2, 3, 6], ["CHR", 0, "shared", [3]], ["CA", 1, 4, 6], ["FU", 5, [0, 1]], ["AN", 5, 0, 5], ["FU", 5, [1, 2]], ["AN", 5, 1, 4], ["FU", 5, [2, 3]], ["AN", 5, 2, 6], ["FU", 3, [0, 1]], ["SP", 3, 0, 32, [2], 1], ["AN", 3, 1, 2], ["FFSP", 3, 0, [2, 1], 1, 1], ["AN", 3, 1, 6], ["FU", 1, [0, 1]], ["SP", 1, 0, 8, [4], 1], ["AN", 1, 1, 2], ["FFSP", 1, 0, [2, 1], 1, 1], ["AN", 1, 1, 6], ["PR", 4, 0, "auto_unroll_max_step$1024"]]]], "r": [[7.7812e-05], 0, 1.23532, 1710093666], "v": "v0.6"}
{"i": [["[\"matmul_layer\", 1, 1024, 1024]", "cuda -keys=cuda,gpu -arch=sm_86 -max_num_threads=1024 -thread_warp_size=32", [-1, 16, 64, 49152, 2147483647, 1024, 8, 32], "", 0, []], [[], [["CHW", 2, "local"], ["SP", 2, 0, 1, [1, 1, 1, 1], 1], ["SP", 2, 5, 1024, [1, 8, 4, 8], 1], ["SP", 2, 10, 1024, [2, 2], 1], ["RE", 2, [0, 5, 1, 6, 2, 7, 10, 11, 3, 8, 12, 4, 9]], ["FSP", 3, 0, 1, 3], ["FSP", 3, 4, 2, 3], ["RE", 3, [0, 4, 1, 5, 2, 6, 3, 7]], ["CA", 2, 3, 5], ["CHR", 1, "shared", [2]], ["CA", 2, 3, 6], ["CHR", 0, "shared", [3]], ["CA", 1, 4, 6], ["FU", 5, [0, 1]], ["AN", 5, 0, 5], ["FU", 5, [1, 2]], ["AN", 5, 1, 4], ["FU", 5, [2, 3]], ["AN", 5, 2, 6], ["FU", 3, [0, 1]], ["SP", 3, 0, 8, [1], 1], ["AN", 3, 1, 2], ["FFSP", 3, 0, [2, 1], 1, 1], ["AN", 3, 1, 6], ["FU", 1, [0, 1]], ["SP", 1, 0, 4, [2], 1], ["AN", 1, 1, 2], ["FFSP", 1, 0, [2, 1], 1, 1], ["AN", 1, 1, 6], ["PR", 4, 0, "auto_unroll_max_step$64"]]]], "r": [[0.000287669], 0, 1.19102, 1710093666], "v": "v0.6"}
{"i": [["[\"matmul_layer\", 1, 1024, 1024]", "cuda -keys=cuda,gpu -arch=sm_86 -max_num_threads=1024 -thread_warp_size=32", [-1, 16, 64, 49152, 2147483647, 1024, 8, 32], "", 0, []], [[], [["CHW", 2, "local"], ["SP", 2, 0, 1, [1, 1, 1, 1], 1], ["SP", 2, 5, 1024, [1, 64, 1, 2], 1], ["SP", 2, 10, 1024, [1, 1], 1], ["RE", 2, [0, 5, 1, 6, 2, 7, 10, 11, 3, 8, 12, 4, 9]], ["FSP", 3, 0, 1, 3], ["FSP", 3, 4, 2, 3], ["RE", 3, [0, 4, 1, 5, 2, 6, 3, 7]], ["CA", 2, 3, 5], ["CHR", 1, "shared", [2]], ["CA", 2, 3, 6], ["CHR", 0, "shared", [3]], ["CA", 1, 4, 6], ["FU", 5, [0, 1]], ["AN", 5, 0, 5], ["FU", 5, [1, 2]], ["AN", 5, 1, 4], ["FU", 5, [2, 3]], ["AN", 5, 2, 6], ["FU", 3, [0, 1]], ["SP", 3, 0, 8, [1], 1], ["AN", 3, 1, 2], ["FFSP", 3, 0, [2, 1], 1, 1], ["AN", 3, 1, 6], ["FU", 1, [0, 1]], ["SP", 1, 0, 4, [2], 1], ["AN", 1, 1, 2], ["FFSP", 1, 0, [2, 1], 1, 1], ["AN", 1, 1, 6], ["PR", 4, 0, "auto_unroll_max_step$512"]]]], "r": [[7.32652e-05], 0, 1.09009, 1710093667], "v": "v0.6"}
{"i": [["[\"matmul_layer\", 1, 1024, 1024]", "cuda -keys=cuda,gpu -arch=sm_86 -max_num_threads=1024 -thread_warp_size=32", [-1, 16, 64, 49152, 2147483647, 1024, 8, 32], "", 0, []], [[], [["CHW", 2, "local"], ["SP", 2, 0, 1, [1, 1, 1, 1], 1], ["SP", 2, 5, 1024, [2, 64, 2, 1], 1], ["SP", 2, 10, 1024, [2, 2], 1], ["RE", 2, [0, 5, 1, 6, 2, 7, 10, 11, 3, 8, 12, 4, 9]], ["FSP", 3, 0, 1, 3], ["FSP", 3, 4, 2, 3], ["RE", 3, [0, 4, 1, 5, 2, 6, 3, 7]], ["CA", 2, 3, 5], ["CHR", 1, "shared", [2]], ["CA", 2, 3, 6], ["CHR", 0, "shared", [3]], ["CA", 1, 4, 6], ["FU", 5, [0, 1]], ["AN", 5, 0, 5], ["FU", 5, [1, 2]], ["AN", 5, 1, 4], ["FU", 5, [2, 3]], ["AN", 5, 2, 6], ["FU", 3, [0, 1]], ["SP", 3, 0, 8, [1], 1], ["AN", 3, 1, 2], ["FFSP", 3, 0, [2, 1], 1, 1], ["AN", 3, 1, 6], ["FU", 1, [0, 1]], ["SP", 1, 0, 4, [1], 1], ["AN", 1, 1, 2], ["FFSP", 1, 0, [2, 1], 1, 1], ["AN", 1, 1, 6], ["PR", 4, 0, "auto_unroll_max_step$64"]]]], "r": [[7.35321e-05], 0, 1.08901, 1710093667], "v": "v0.6"}
{"i": [["[\"matmul_layer\", 1, 1024, 1024]", "cuda -keys=cuda,gpu -arch=sm_86 -max_num_threads=1024 -thread_warp_size=32", [-1, 16, 64, 49152, 2147483647, 1024, 8, 32], "", 0, []], [[], [["CHW", 2, "local"], ["SP", 2, 0, 1, [1, 1, 1, 1], 1], ["SP", 2, 5, 1024, [4, 64, 1, 1], 1], ["SP", 2, 10, 1024, [4, 4], 1], ["RE", 2, [0, 5, 1, 6, 2, 7, 10, 11, 3, 8, 12, 4, 9]], ["FSP", 3, 0, 1, 3], ["FSP", 3, 4, 2, 3], ["RE", 3, [0, 4, 1, 5, 2, 6, 3, 7]], ["CA", 2, 3, 5], ["CHR", 1, "shared", [2]], ["CA", 2, 3, 6], ["CHR", 0, "shared", [3]], ["CA", 1, 4, 6], ["FU", 5, [0, 1]], ["AN", 5, 0, 5], ["FU", 5, [1, 2]], ["AN", 5, 1, 4], ["FU", 5, [2, 3]], ["AN", 5, 2, 6], ["FU", 3, [0, 1]], ["SP", 3, 0, 32, [1], 1], ["AN", 3, 1, 2], ["FFSP", 3, 0, [2, 1], 1, 1], ["AN", 3, 1, 6], ["FU", 1, [0, 1]], ["SP", 1, 0, 16, [1], 1], ["AN", 1, 1, 2], ["FFSP", 1, 0, [2, 1], 1, 1], ["AN", 1, 1, 6], ["PR", 4, 0, "auto_unroll_max_step$1024"]]]], "r": [[4.58785e-05], 0, 1.24824, 1710093668], "v": "v0.6"}
{"i": [["[\"matmul_layer\", 1, 1024, 1024]", "cuda -keys=cuda,gpu -arch=sm_86 -max_num_threads=1024 -thread_warp_size=32", [-1, 16, 64, 49152, 2147483647, 1024, 8, 32], "", 0, []], [[], [["CHW", 2, "local"], ["SP", 2, 0, 1, [1, 1, 1, 1], 1], ["SP", 2, 5, 1024, [1, 64, 2, 8], 1], ["SP", 2, 10, 1024, [2, 2], 1], ["RE", 2, [0, 5, 1, 6, 2, 7, 10, 11, 3, 8, 12, 4, 9]], ["FSP", 3, 0, 1, 3], ["FSP", 3, 4, 2, 3], ["RE", 3, [0, 4, 1, 5, 2, 6, 3, 7]], ["CA", 2, 3, 5], ["CHR", 1, "shared", [2]], ["CA", 2, 3, 6], ["CHR", 0, "shared", [3]], ["CA", 1, 4, 6], ["FU", 5, [0, 1]], ["AN", 5, 0, 5], ["FU", 5, [1, 2]], ["AN", 5, 1, 4], ["FU", 5, [2, 3]], ["AN", 5, 2, 6], ["FU", 3, [0, 1]], ["SP", 3, 0, 16, [1], 1], ["AN", 3, 1, 2], ["FFSP", 3, 0, [2, 1], 1, 1], ["AN", 3, 1, 6], ["FU", 1, [0, 1]], ["SP", 1, 0, 4, [2], 1], ["AN", 1, 1, 2], ["FFSP", 1, 0, [2, 1], 1, 1], ["AN", 1, 1, 6], ["PR", 4, 0, "auto_unroll_max_step$1024"]]]], "r": [[0.000208681], 0, 1.24592, 1710093668], "v": "v0.6"}
{"i": [["[\"matmul_layer\", 1, 1024, 1024]", "cuda -keys=cuda,gpu -arch=sm_86 -max_num_threads=1024 -thread_warp_size=32", [-1, 16, 64, 49152, 2147483647, 1024, 8, 32], "", 0, []], [[], [["CHW", 2, "local"], ["SP", 2, 0, 1, [1, 1, 1, 1], 1], ["SP", 2, 5, 1024, [4, 32, 1, 2], 1], ["SP", 2, 10, 1024, [2, 1], 1], ["RE", 2, [0, 5, 1, 6, 2, 7, 10, 11, 3, 8, 12, 4, 9]], ["FSP", 3, 0, 1, 3], ["FSP", 3, 4, 2, 3], ["RE", 3, [0, 4, 1, 5, 2, 6, 3, 7]], ["CA", 2, 3, 5], ["CHR", 1, "shared", [2]], ["CA", 2, 3, 6], ["CHR", 0, "shared", [3]], ["CA", 1, 4, 6], ["FU", 5, [0, 1]], ["AN", 5, 0, 5], ["FU", 5, [1, 2]], ["AN", 5, 1, 4], ["FU", 5, [2, 3]], ["AN", 5, 2, 6], ["FU", 3, [0, 1]], ["SP", 3, 0, 8, [1], 1], ["AN", 3, 1, 2], ["FFSP", 3, 0, [2, 1], 1, 1], ["AN", 3, 1, 6], ["FU", 1, [0, 1]], ["SP", 1, 0, 2, [1], 1], ["AN", 1, 1, 2], ["FFSP", 1, 0, [2, 1], 1, 1], ["AN", 1, 1, 6], ["PR", 4, 0, "auto_unroll_max_step$1024"]]]], "r": [[0.00012915], 0, 1.12662, 1710093669], "v": "v0.6"}
{"i": [["[\"matmul_layer\", 1, 1024, 1024]", "cuda -keys=cuda,gpu -arch=sm_86 -max_num_threads=1024 -thread_warp_size=32", [-1, 16, 64, 49152, 2147483647, 1024, 8, 32], "", 0, []], [[], [["CHW", 2, "local"], ["SP", 2, 0, 1, [1, 1, 1, 1], 1], ["SP", 2, 5, 1024, [1, 32, 1, 8], 1], ["SP", 2, 10, 1024, [2, 2], 1], ["RE", 2, [0, 5, 1, 6, 2, 7, 10, 11, 3, 8, 12, 4, 9]], ["FSP", 3, 0, 1, 3], ["FSP", 3, 4, 2, 3], ["RE", 3, [0, 4, 1, 5, 2, 6, 3, 7]], ["CA", 2, 3, 5], ["CHR", 1, "shared", [2]], ["CA", 2, 3, 6], ["CHR", 0, "shared", [3]], ["CA", 1, 4, 6], ["FU", 5, [0, 1]], ["AN", 5, 0, 5], ["FU", 5, [1, 2]], ["AN", 5, 1, 4], ["FU", 5, [2, 3]], ["AN", 5, 2, 6], ["FU", 3, [0, 1]], ["SP", 3, 0, 8, [1], 1], ["AN", 3, 1, 2], ["FFSP", 3, 0, [2, 1], 1, 1], ["AN", 3, 1, 6], ["FU", 1, [0, 1]], ["SP", 1, 0, 1, [1], 1], ["AN", 1, 1, 2], ["FFSP", 1, 0, [2, 1], 1, 1], ["AN", 1, 1, 6], ["PR", 4, 0, "auto_unroll_max_step$64"]]]], "r": [[9.42872e-05], 0, 1.14091, 1710093669], "v": "v0.6"}
{"i": [["[\"matmul_layer\", 1, 1024, 1024]", "cuda -keys=cuda,gpu -arch=sm_86 -max_num_threads=1024 -thread_warp_size=32", [-1, 16, 64, 49152, 2147483647, 1024, 8, 32], "", 0, []], [[], [["CHW", 2, "local"], ["SP", 2, 0, 1, [1, 1, 1, 1], 1], ["SP", 2, 5, 1024, [1, 32, 1, 1], 1], ["SP", 2, 10, 1024, [1, 1], 1], ["RE", 2, [0, 5, 1, 6, 2, 7, 10, 11, 3, 8, 12, 4, 9]], ["FSP", 3, 0, 1, 3], ["FSP", 3, 4, 2, 3], ["RE", 3, [0, 4, 1, 5, 2, 6, 3, 7]], ["CA", 2, 3, 5], ["CHR", 1, "shared", [2]], ["CA", 2, 3, 6], ["CHR", 0, "shared", [3]], ["CA", 1, 4, 6], ["FU", 5, [0, 1]], ["AN", 5, 0, 5], ["FU", 5, [1, 2]], ["AN", 5, 1, 4], ["FU", 5, [2, 3]], ["AN", 5, 2, 6], ["FU", 3, [0, 1]], ["SP", 3, 0, 2, [2], 1], ["AN", 3, 1, 2], ["FFSP", 3, 0, [2, 1], 1, 1], ["AN", 3, 1, 6], ["FU", 1, [0, 1]], ["SP", 1, 0, 2, [2], 1], ["AN", 1, 1, 2], ["FFSP", 1, 0, [2, 1], 1, 1], ["AN", 1, 1, 6], ["PR", 4, 0, "auto_unroll_max_step$64"]]]], "r": [[7.20357e-05], 0, 1.07962, 1710093670], "v": "v0.6"}
{"i": [["[\"matmul_layer\", 1, 1024, 1024]", "cuda -keys=cuda,gpu -arch=sm_86 -max_num_threads=1024 -thread_warp_size=32", [-1, 16, 64, 49152, 2147483647, 1024, 8, 32], "", 0, []], [[], [["CHW", 2, "local"], ["SP", 2, 0, 1, [1, 1, 1, 1], 1], ["SP", 2, 5, 1024, [8, 32, 2, 1], 1], ["SP", 2, 10, 1024, [1, 8], 1], ["RE", 2, [0, 5, 1, 6, 2, 7, 10, 11, 3, 8, 12, 4, 9]], ["FSP", 3, 0, 1, 3], ["FSP", 3, 4, 2, 3], ["RE", 3, [0, 4, 1, 5, 2, 6, 3, 7]], ["CA", 2, 3, 5], ["CHR", 1, "shared", [2]], ["CA", 2, 3, 6], ["CHR", 0, "shared", [3]], ["CA", 1, 4, 6], ["FU", 5, [0, 1]], ["AN", 5, 0, 5], ["FU", 5, [1, 2]], ["AN", 5, 1, 4], ["FU", 5, [2, 3]], ["AN", 5, 2, 6], ["FU", 3, [0, 1]], ["SP", 3, 0, 2, [1], 1], ["AN", 3, 1, 2], ["FFSP", 3, 0, [2, 1], 1, 1], ["AN", 3, 1, 6], ["FU", 1, [0, 1]], ["SP", 1, 0, 1, [1], 1], ["AN", 1, 1, 2], ["FFSP", 1, 0, [2, 1], 1, 1], ["AN", 1, 1, 6], ["PR", 4, 0, "auto_unroll_max_step$512"]]]], "r": [[0.000109042], 0, 1.51497, 1710093670], "v": "v0.6"}
{"i": [["[\"matmul_layer\", 1, 1024, 1024]", "cuda -keys=cuda,gpu -arch=sm_86 -max_num_threads=1024 -thread_warp_size=32", [-1, 16, 64, 49152, 2147483647, 1024, 8, 32], "", 0, []], [[], [["CHW", 2, "local"], ["SP", 2, 0, 1, [1, 1, 1, 1], 1], ["SP", 2, 5, 1024, [4, 32, 2, 2], 1], ["SP", 2, 10, 1024, [8, 2], 1], ["RE", 2, [0, 5, 1, 6, 2, 7, 10, 11, 3, 8, 12, 4, 9]], ["FSP", 3, 0, 1, 3], ["FSP", 3, 4, 2, 3], ["RE", 3, [0, 4, 1, 5, 2, 6, 3, 7]], ["CA", 2, 3, 5], ["CHR", 1, "shared", [2]], ["CA", 2, 3, 6], ["CHR", 0, "shared", [3]], ["CA", 1, 4, 6], ["FU", 5, [0, 1]], ["AN", 5, 0, 5], ["FU", 5, [1, 2]], ["AN", 5, 1, 4], ["FU", 5, [2, 3]], ["AN", 5, 2, 6], ["FU", 3, [0, 1]], ["SP", 3, 0, 64, [4], 1], ["AN", 3, 1, 2], ["FFSP", 3, 0, [2, 1], 1, 1], ["AN", 3, 1, 6], ["FU", 1, [0, 1]], ["SP", 1, 0, 16, [1], 1], ["AN", 1, 1, 2], ["FFSP", 1, 0, [2, 1], 1, 1], ["AN", 1, 1, 6], ["PR", 4, 0, "auto_unroll_max_step$64"]]]], "r": [[8.13084e-05], 0, 1.26633, 1710093671], "v": "v0.6"}
{"i": [["[\"matmul_layer\", 1, 1024, 1024]", "cuda -keys=cuda,gpu -arch=sm_86 -max_num_threads=1024 -thread_warp_size=32", [-1, 16, 64, 49152, 2147483647, 1024, 8, 32], "", 0, []], [[], [["CHW", 2, "local"], ["SP", 2, 0, 1, [1, 1, 1, 1], 1], ["SP", 2, 5, 1024, [4, 32, 1, 2], 1], ["SP", 2, 10, 1024, [1, 1], 1], ["RE", 2, [0, 5, 1, 6, 2, 7, 10, 11, 3, 8, 12, 4, 9]], ["FSP", 3, 0, 1, 3], ["FSP", 3, 4, 2, 3], ["RE", 3, [0, 4, 1, 5, 2, 6, 3, 7]], ["CA", 2, 3, 5], ["CHR", 1, "shared", [2]], ["CA", 2, 3, 6], ["CHR", 0, "shared", [3]], ["CA", 1, 4, 6], ["FU", 5, [0, 1]], ["AN", 5, 0, 5], ["FU", 5, [1, 2]], ["AN", 5, 1, 4], ["FU", 5, [2, 3]], ["AN", 5, 2, 6], ["FU", 3, [0, 1]], ["SP", 3, 0, 8, [1], 1], ["AN", 3, 1, 2], ["FFSP", 3, 0, [2, 1], 1, 1], ["AN", 3, 1, 6], ["FU", 1, [0, 1]], ["SP", 1, 0, 1, [1], 1], ["AN", 1, 1, 2], ["FFSP", 1, 0, [2, 1], 1, 1], ["AN", 1, 1, 6], ["PR", 4, 0, "auto_unroll_max_step$16"]]]], "r": [[0.000141395], 0, 1.08587, 1710093671], "v": "v0.6"}
{"i": [["[\"matmul_layer\", 1, 1024, 1024]", "cuda -keys=cuda,gpu -arch=sm_86 -max_num_threads=1024 -thread_warp_size=32", [-1, 16, 64, 49152, 2147483647, 1024, 8, 32], "", 0, []], [[], [["CHW", 2, "local"], ["SP", 2, 0, 1, [1, 1, 1, 1], 1], ["SP", 2, 5, 1024, [1, 64, 2, 2], 1], ["SP", 2, 10, 1024, [1, 4], 1], ["RE", 2, [0, 5, 1, 6, 2, 7, 10, 11, 3, 8, 12, 4, 9]], ["FSP", 3, 0, 1, 3], ["FSP", 3, 4, 2, 3], ["RE", 3, [0, 4, 1, 5, 2, 6, 3, 7]], ["CA", 2, 3, 5], ["CHR", 1, "shared", [2]], ["CA", 2, 3, 6], ["CHR", 0, "shared", [3]], ["CA", 1, 4, 6], ["FU", 5, [0, 1]], ["AN", 5, 0, 5], ["FU", 5, [1, 2]], ["AN", 5, 1, 4], ["FU", 5, [2, 3]], ["AN", 5, 2, 6], ["FU", 3, [0, 1]], ["SP", 3, 0, 16, [4], 1], ["AN", 3, 1, 2], ["FFSP", 3, 0, [2, 1], 1, 1], ["AN", 3, 1, 6], ["FU", 1, [0, 1]], ["SP", 1, 0, 4, [2], 1], ["AN", 1, 1, 2], ["FFSP", 1, 0, [2, 1], 1, 1], ["AN", 1, 1, 6], ["PR", 4, 0, "auto_unroll_max_step$1024"]]]], "r": [[4.97811e-05], 0, 1.07526, 1710093672], "v": "v0.6"}
{"i": [["[\"matmul_layer\", 1, 1024, 1024]", "cuda -keys=cuda,gpu -arch=sm_86 -max_num_threads=1024 -thread_warp_size=32", [-1, 16, 64, 49152, 2147483647, 1024, 8, 32], "", 0, []], [[], [["CHW", 2, "local"], ["SP", 2, 0, 1, [1, 1, 1, 1], 1], ["SP", 2, 5, 1024, [1, 32, 4, 1], 1], ["SP", 2, 10, 1024, [4, 16], 1], ["RE", 2, [0, 5, 1, 6, 2, 7, 10, 11, 3, 8, 12, 4, 9]], ["FSP", 3, 0, 1, 3], ["FSP", 3, 4, 2, 3], ["RE", 3, [0, 4, 1, 5, 2, 6, 3, 7]], ["CA", 2, 3, 5], ["CHR", 1, "shared", [2]], ["CA", 2, 3, 6], ["CHR", 0, "shared", [3]], ["CA", 1, 4, 6], ["FU", 5, [0, 1]], ["AN", 5, 0, 5], ["FU", 5, [1, 2]], ["AN", 5, 1, 4], ["FU", 5, [2, 3]], ["AN", 5, 2, 6], ["FU", 3, [0, 1]], ["SP", 3, 0, 64, [1], 1], ["AN", 3, 1, 2], ["FFSP", 3, 0, [2, 1], 1, 1], ["AN", 3, 1, 6], ["FU", 1, [0, 1]], ["SP", 1, 0, 64, [2], 1], ["AN", 1, 1, 2], ["FFSP", 1, 0, [2, 1], 1, 1], ["AN", 1, 1, 6], ["PR", 4, 0, "auto_unroll_max_step$0"]]]], "r": [[3.58531e-05], 0, 1.16707, 1710093672], "v": "v0.6"}
{"i": [["[\"matmul_layer\", 1, 1024, 1024]", "cuda -keys=cuda,gpu -arch=sm_86 -max_num_threads=1024 -thread_warp_size=32", [-1, 16, 64, 49152, 2147483647, 1024, 8, 32], "", 0, []], [[], [["CHW", 2, "local"], ["SP", 2, 0, 1, [1, 1, 1, 1], 1], ["SP", 2, 5, 1024, [1, 64, 1, 8], 1], ["SP", 2, 10, 1024, [1, 16], 1], ["RE", 2, [0, 5, 1, 6, 2, 7, 10, 11, 3, 8, 12, 4, 9]], ["FSP", 3, 0, 1, 3], ["FSP", 3, 4, 2, 3], ["RE", 3, [0, 4, 1, 5, 2, 6, 3, 7]], ["CA", 2, 3, 5], ["CHR", 1, "shared", [2]], ["CA", 2, 3, 6], ["CHR", 0, "shared", [3]], ["CA", 1, 4, 6], ["FU", 5, [0, 1]], ["AN", 5, 0, 5], ["FU", 5, [1, 2]], ["AN", 5, 1, 4], ["FU", 5, [2, 3]], ["AN", 5, 2, 6], ["FU", 3, [0, 1]], ["SP", 3, 0, 32, [1], 1], ["AN", 3, 1, 2], ["FFSP", 3, 0, [2, 1], 1, 1], ["AN", 3, 1, 6], ["FU", 1, [0, 1]], ["SP", 1, 0, 16, [1], 1], ["AN", 1, 1, 2], ["FFSP", 1, 0, [2, 1], 1, 1], ["AN", 1, 1, 6], ["PR", 4, 0, "auto_unroll_max_step$64"]]]], "r": [[7.85531e-05], 0, 1.16309, 1710093673], "v": "v0.6"}
{"i": [["[\"matmul_layer\", 1, 1024, 1024]", "cuda -keys=cuda,gpu -arch=sm_86 -max_num_threads=1024 -thread_warp_size=32", [-1, 16, 64, 49152, 2147483647, 1024, 8, 32], "", 0, []], [[], [["CHW", 2, "local"], ["SP", 2, 0, 1, [1, 1, 1, 1], 1], ["SP", 2, 5, 1024, [4, 32, 1, 2], 1], ["SP", 2, 10, 1024, [4, 4], 1], ["RE", 2, [0, 5, 1, 6, 2, 7, 10, 11, 3, 8, 12, 4, 9]], ["FSP", 3, 0, 1, 3], ["FSP", 3, 4, 2, 3], ["RE", 3, [0, 4, 1, 5, 2, 6, 3, 7]], ["CA", 2, 3, 5], ["CHR", 1, "shared", [2]], ["CA", 2, 3, 6], ["CHR", 0, "shared", [3]], ["CA", 1, 4, 6], ["FU", 5, [0, 1]], ["AN", 5, 0, 5], ["FU", 5, [1, 2]], ["AN", 5, 1, 4], ["FU", 5, [2, 3]], ["AN", 5, 2, 6], ["FU", 3, [0, 1]], ["SP", 3, 0, 64, [1], 1], ["AN", 3, 1, 2], ["FFSP", 3, 0, [2, 1], 1, 1], ["AN", 3, 1, 6], ["FU", 1, [0, 1]], ["SP", 1, 0, 16, [8], 1], ["AN", 1, 1, 2], ["FFSP", 1, 0, [2, 1], 1, 1], ["AN", 1, 1, 6], ["PR", 4, 0, "auto_unroll_max_step$64"]]]], "r": [[5.97642e-05], 0, 1.14959, 1710093673], "v": "v0.6"}
{"i": [["[\"matmul_layer\", 1, 1024, 1024]", "cuda -keys=cuda,gpu -arch=sm_86 -max_num_threads=1024 -thread_warp_size=32", [-1, 16, 64, 49152, 2147483647, 1024, 8, 32], "", 0, []], [[], [["CHW", 2, "local"], ["SP", 2, 0, 1, [1, 1, 1, 1], 1], ["SP", 2, 5, 1024, [1, 64, 8, 1], 1], ["SP", 2, 10, 1024, [2, 4], 1], ["RE", 2, [0, 5, 1, 6, 2, 7, 10, 11, 3, 8, 12, 4, 9]], ["FSP", 3, 0, 1, 3], ["FSP", 3, 4, 2, 3], ["RE", 3, [0, 4, 1, 5, 2, 6, 3, 7]], ["CA", 2, 3, 5], ["CHR", 1, "shared", [2]], ["CA", 2, 3, 6], ["CHR", 0, "shared", [3]], ["CA", 1, 4, 6], ["FU", 5, [0, 1]], ["AN", 5, 0, 5], ["FU", 5, [1, 2]], ["AN", 5, 1, 4], ["FU", 5, [2, 3]], ["AN", 5, 2, 6], ["FU", 3, [0, 1]], ["SP", 3, 0, 16, [1], 1], ["AN", 3, 1, 2], ["FFSP", 3, 0, [2, 1], 1, 1], ["AN", 3, 1, 6], ["FU", 1, [0, 1]], ["SP", 1, 0, 8, [1], 1], ["AN", 1, 1, 2], ["FFSP", 1, 0, [2, 1], 1, 1], ["AN", 1, 1, 6], ["PR", 4, 0, "auto_unroll_max_step$16"]]]], "r": [[9.14104e-05], 0, 1.18117, 1710093674], "v": "v0.6"}
{"i": [["[\"matmul_layer\", 1, 1024, 1024]", "cuda -keys=cuda,gpu -arch=sm_86 -max_num_threads=1024 -thread_warp_size=32", [-1, 16, 64, 49152, 2147483647, 1024, 8, 32], "", 0, []], [[], [["CHW", 2, "local"], ["SP", 2, 0, 1, [1, 1, 1, 1], 1], ["SP", 2, 5, 1024, [8, 32, 2, 1], 1], ["SP", 2, 10, 1024, [8, 2], 1], ["RE", 2, [0, 5, 1, 6, 2, 7, 10, 11, 3, 8, 12, 4, 9]], ["FSP", 3, 0, 1, 3], ["FSP", 3, 4, 2, 3], ["RE", 3, [0, 4, 1, 5, 2, 6, 3, 7]], ["CA", 2, 3, 5], ["CHR", 1, "shared", [2]], ["CA", 2, 3, 6], ["CHR", 0, "shared", [3]], ["CA", 1, 4, 6], ["FU", 5, [0, 1]], ["AN", 5, 0, 5], ["FU", 5, [1, 2]], ["AN", 5, 1, 4], ["FU", 5, [2, 3]], ["AN", 5, 2, 6], ["FU", 3, [0, 1]], ["SP", 3, 0, 16, [1], 1], ["AN", 3, 1, 2], ["FFSP", 3, 0, [2, 1], 1, 1], ["AN", 3, 1, 6], ["FU", 1, [0, 1]], ["SP", 1, 0, 16, [1], 1], ["AN", 1, 1, 2], ["FFSP", 1, 0, [2, 1], 1, 1], ["AN", 1, 1, 6], ["PR", 4, 0, "auto_unroll_max_step$16"]]]], "r": [[0.000106236], 0, 1.18663, 1710093677], "v": "v0.6"}
{"i": [["[\"matmul_layer\", 1, 1024, 1024]", "cuda -keys=cuda,gpu -arch=sm_86 -max_num_threads=1024 -thread_warp_size=32", [-1, 16, 64, 49152, 2147483647, 1024, 8, 32], "", 0, []], [[], [["CHW", 2, "local"], ["SP", 2, 0, 1, [1, 1, 1, 1], 1], ["SP", 2, 5, 1024, [8, 32, 1, 2], 1], ["SP", 2, 10, 1024, [16, 1], 1], ["RE", 2, [0, 5, 1, 6, 2, 7, 10, 11, 3, 8, 12, 4, 9]], ["FSP", 3, 0, 1, 3], ["FSP", 3, 4, 2, 3], ["RE", 3, [0, 4, 1, 5, 2, 6, 3, 7]], ["CA", 2, 3, 5], ["CHR", 1, "shared", [2]], ["CA", 2, 3, 6], ["CHR", 0, "shared", [3]], ["CA", 1, 4, 6], ["FU", 5, [0, 1]], ["AN", 5, 0, 5], ["FU", 5, [1, 2]], ["AN", 5, 1, 4], ["FU", 5, [2, 3]], ["AN", 5, 2, 6], ["FU", 3, [0, 1]], ["SP", 3, 0, 32, [1], 1], ["AN", 3, 1, 2], ["FFSP", 3, 0, [2, 1], 1, 1], ["AN", 3, 1, 6], ["FU", 1, [0, 1]], ["SP", 1, 0, 16, [1], 1], ["AN", 1, 1, 2], ["FFSP", 1, 0, [2, 1], 1, 1], ["AN", 1, 1, 6], ["PR", 4, 0, "auto_unroll_max_step$16"]]]], "r": [[0.000105096], 0, 1.19509, 1710093678], "v": "v0.6"}
{"i": [["[\"matmul_layer\", 1, 1024, 1024]", "cuda -keys=cuda,gpu -arch=sm_86 -max_num_threads=1024 -thread_warp_size=32", [-1, 16, 64, 49152, 2147483647, 1024, 8, 32], "", 0, []], [[], [["CHW", 2, "local"], ["SP", 2, 0, 1, [1, 1, 1, 1], 1], ["SP", 2, 5, 1024, [1, 1, 128, 2], 1], ["SP", 2, 10, 1024, [2, 16], 1], ["RE", 2, [0, 5, 1, 6, 2, 7, 10, 11, 3, 8, 12, 4, 9]], ["FSP", 3, 0, 1, 3], ["FSP", 3, 4, 2, 3], ["RE", 3, [0, 4, 1, 5, 2, 6, 3, 7]], ["CA", 2, 3, 5], ["CHR", 1, "shared", [2]], ["CA", 2, 3, 6], ["CHR", 0, "shared", [3]], ["CA", 1, 4, 6], ["FU", 5, [0, 1]], ["AN", 5, 0, 5], ["FU", 5, [1, 2]], ["AN", 5, 1, 4], ["FU", 5, [2, 3]], ["AN", 5, 2, 6], ["FU", 3, [0, 1]], ["SP", 3, 0, 128, [2], 1], ["AN", 3, 1, 2], ["FFSP", 3, 0, [2, 1], 1, 1], ["AN", 3, 1, 6], ["FU", 1, [0, 1]], ["SP", 1, 0, 32, [1], 1], ["AN", 1, 1, 2], ["FFSP", 1, 0, [2, 1], 1, 1], ["AN", 1, 1, 6], ["PR", 4, 0, "auto_unroll_max_step$512"]]]], "r": [[0.00344848], 0, 1.25959, 1710093678], "v": "v0.6"}
{"i": [["[\"matmul_layer\", 1, 1024, 1024]", "cuda -keys=cuda,gpu -arch=sm_86 -max_num_threads=1024 -thread_warp_size=32", [-1, 16, 64, 49152, 2147483647, 1024, 8, 32], "", 0, []], [[], [["CHW", 2, "local"], ["SP", 2, 0, 1, [1, 1, 1, 1], 1], ["SP", 2, 5, 1024, [4, 32, 2, 2], 1], ["SP", 2, 10, 1024, [8, 1], 1], ["RE", 2, [0, 5, 1, 6, 2, 7, 10, 11, 3, 8, 12, 4, 9]], ["FSP", 3, 0, 1, 3], ["FSP", 3, 4, 2, 3], ["RE", 3, [0, 4, 1, 5, 2, 6, 3, 7]], ["CA", 2, 3, 5], ["CHR", 1, "shared", [2]], ["CA", 2, 3, 6], ["CHR", 0, "shared", [3]], ["CA", 1, 4, 6], ["FU", 5, [0, 1]], ["AN", 5, 0, 5], ["FU", 5, [1, 2]], ["AN", 5, 1, 4], ["FU", 5, [2, 3]], ["AN", 5, 2, 6], ["FU", 3, [0, 1]], ["SP", 3, 0, 64, [1], 1], ["AN", 3, 1, 2], ["FFSP", 3, 0, [2, 1], 1, 1], ["AN", 3, 1, 6], ["FU", 1, [0, 1]], ["SP", 1, 0, 16, [1], 1], ["AN", 1, 1, 2], ["FFSP", 1, 0, [2, 1], 1, 1], ["AN", 1, 1, 6], ["PR", 4, 0, "auto_unroll_max_step$1024"]]]], "r": [[0.000109321], 0, 1.36787, 1710093679], "v": "v0.6"}
{"i": [["[\"matmul_layer\", 1, 1024, 1024]", "cuda -keys=cuda,gpu -arch=sm_86 -max_num_threads=1024 -thread_warp_size=32", [-1, 16, 64, 49152, 2147483647, 1024, 8, 32], "", 0, []], [[], [["CHW", 2, "local"], ["SP", 2, 0, 1, [1, 1, 1, 1], 1], ["SP", 2, 5, 1024, [1, 64, 1, 4], 1], ["SP", 2, 10, 1024, [8, 4], 1], ["RE", 2, [0, 5, 1, 6, 2, 7, 10, 11, 3, 8, 12, 4, 9]], ["FSP", 3, 0, 1, 3], ["FSP", 3, 4, 2, 3], ["RE", 3, [0, 4, 1, 5, 2, 6, 3, 7]], ["CA", 2, 3, 5], ["CHR", 1, "shared", [2]], ["CA", 2, 3, 6], ["CHR", 0, "shared", [3]], ["CA", 1, 4, 6], ["FU", 5, [0, 1]], ["AN", 5, 0, 5], ["FU", 5, [1, 2]], ["AN", 5, 1, 4], ["FU", 5, [2, 3]], ["AN", 5, 2, 6], ["FU", 3, [0, 1]], ["SP", 3, 0, 128, [4], 1], ["AN", 3, 1, 2], ["FFSP", 3, 0, [2, 1], 1, 1], ["AN", 3, 1, 6], ["FU", 1, [0, 1]], ["SP", 1, 0, 32, [1], 1], ["AN", 1, 1, 2], ["FFSP", 1, 0, [2, 1], 1, 1], ["AN", 1, 1, 6], ["PR", 4, 0, "auto_unroll_max_step$1024"]]]], "r": [[3.25623e-05], 0, 1.2151, 1710093679], "v": "v0.6"}
{"i": [["[\"matmul_layer\", 1, 1024, 1024]", "cuda -keys=cuda,gpu -arch=sm_86 -max_num_threads=1024 -thread_warp_size=32", [-1, 16, 64, 49152, 2147483647, 1024, 8, 32], "", 0, []], [[], [["CHW", 2, "local"], ["SP", 2, 0, 1, [1, 1, 1, 1], 1], ["SP", 2, 5, 1024, [8, 1, 2, 1], 1], ["SP", 2, 10, 1024, [8, 2], 1], ["RE", 2, [0, 5, 1, 6, 2, 7, 10, 11, 3, 8, 12, 4, 9]], ["FSP", 3, 0, 1, 3], ["FSP", 3, 4, 2, 3], ["RE", 3, [0, 4, 1, 5, 2, 6, 3, 7]], ["CA", 2, 3, 5], ["CHR", 1, "shared", [2]], ["CA", 2, 3, 6], ["CHR", 0, "shared", [3]], ["CA", 1, 4, 6], ["FU", 5, [0, 1]], ["AN", 5, 0, 5], ["FU", 5, [1, 2]], ["AN", 5, 1, 4], ["FU", 5, [2, 3]], ["AN", 5, 2, 6], ["FU", 3, [0, 1]], ["SP", 3, 0, 16, [2], 1], ["AN", 3, 1, 2], ["FFSP", 3, 0, [2, 1], 1, 1], ["AN", 3, 1, 6], ["FU", 1, [0, 1]], ["SP", 1, 0, 16, [1], 1], ["AN", 1, 1, 2], ["FFSP", 1, 0, [2, 1], 1, 1], ["AN", 1, 1, 6], ["PR", 4, 0, "auto_unroll_max_step$16"]]]], "r": [[0.00020447], 0, 1.14962, 1710093680], "v": "v0.6"}
{"i": [["[\"matmul_layer\", 1, 1024, 1024]", "cuda -keys=cuda,gpu -arch=sm_86 -max_num_threads=1024 -thread_warp_size=32", [-1, 16, 64, 49152, 2147483647, 1024, 8, 32], "", 0, []], [[], [["CHW", 2, "local"], ["SP", 2, 0, 1, [1, 1, 1, 1], 1], ["SP", 2, 5, 1024, [1, 128, 2, 1], 1], ["SP", 2, 10, 1024, [1, 2], 1], ["RE", 2, [0, 5, 1, 6, 2, 7, 10, 11, 3, 8, 12, 4, 9]], ["FSP", 3, 0, 1, 3], ["FSP", 3, 4, 2, 3], ["RE", 3, [0, 4, 1, 5, 2, 6, 3, 7]], ["CA", 2, 3, 5], ["CHR", 1, "shared", [2]], ["CA", 2, 3, 6], ["CHR", 0, "shared", [3]], ["CA", 1, 4, 6], ["FU", 5, [0, 1]], ["AN", 5, 0, 5], ["FU", 5, [1, 2]], ["AN", 5, 1, 4], ["FU", 5, [2, 3]], ["AN", 5, 2, 6], ["FU", 3, [0, 1]], ["SP", 3, 0, 4, [1], 1], ["AN", 3, 1, 2], ["FFSP", 3, 0, [2, 1], 1, 1], ["AN", 3, 1, 6], ["FU", 1, [0, 1]], ["SP", 1, 0, 2, [1], 1], ["AN", 1, 1, 2], ["FFSP", 1, 0, [2, 1], 1, 1], ["AN", 1, 1, 6], ["PR", 4, 0, "auto_unroll_max_step$512"]]]], "r": [[5.89897e-05], 0, 1.00875, 1710093680], "v": "v0.6"}
{"i": [["[\"matmul_layer\", 1, 1024, 1024]", "cuda -keys=cuda,gpu -arch=sm_86 -max_num_threads=1024 -thread_warp_size=32", [-1, 16, 64, 49152, 2147483647, 1024, 8, 32], "", 0, []], [[], [["CHW", 2, "local"], ["SP", 2, 0, 1, [1, 1, 1, 1], 1], ["SP", 2, 5, 1024, [2, 128, 2, 1], 1], ["SP", 2, 10, 1024, [2, 8], 1], ["RE", 2, [0, 5, 1, 6, 2, 7, 10, 11, 3, 8, 12, 4, 9]], ["FSP", 3, 0, 1, 3], ["FSP", 3, 4, 2, 3], ["RE", 3, [0, 4, 1, 5, 2, 6, 3, 7]], ["CA", 2, 3, 5], ["CHR", 1, "shared", [2]], ["CA", 2, 3, 6], ["CHR", 0, "shared", [3]], ["CA", 1, 4, 6], ["FU", 5, [0, 1]], ["AN", 5, 0, 5], ["FU", 5, [1, 2]], ["AN", 5, 1, 4], ["FU", 5, [2, 3]], ["AN", 5, 2, 6], ["FU", 3, [0, 1]], ["SP", 3, 0, 32, [1], 1], ["AN", 3, 1, 2], ["FFSP", 3, 0, [2, 1], 1, 1], ["AN", 3, 1, 6], ["FU", 1, [0, 1]], ["SP", 1, 0, 16, [1], 1], ["AN", 1, 1, 2], ["FFSP", 1, 0, [2, 1], 1, 1], ["AN", 1, 1, 6], ["PR", 4, 0, "auto_unroll_max_step$512"]]]], "r": [[6.88847e-05], 0, 1.04642, 1710093681], "v": "v0.6"}
{"i": [["[\"matmul_layer\", 1, 1024, 1024]", "cuda -keys=cuda,gpu -arch=sm_86 -max_num_threads=1024 -thread_warp_size=32", [-1, 16, 64, 49152, 2147483647, 1024, 8, 32], "", 0, []], [[], [["CHW", 2, "local"], ["SP", 2, 0, 1, [1, 1, 1, 1], 1], ["SP", 2, 5, 1024, [4, 32, 2, 2], 1], ["SP", 2, 10, 1024, [8, 2], 1], ["RE", 2, [0, 5, 1, 6, 2, 7, 10, 11, 3, 8, 12, 4, 9]], ["FSP", 3, 0, 1, 3], ["FSP", 3, 4, 2, 3], ["RE", 3, [0, 4, 1, 5, 2, 6, 3, 7]], ["CA", 2, 3, 5], ["CHR", 1, "shared", [2]], ["CA", 2, 3, 6], ["CHR", 0, "shared", [3]], ["CA", 1, 4, 6], ["FU", 5, [0, 1]], ["AN", 5, 0, 5], ["FU", 5, [1, 2]], ["AN", 5, 1, 4], ["FU", 5, [2, 3]], ["AN", 5, 2, 6], ["FU", 3, [0, 1]], ["SP", 3, 0, 64, [1], 1], ["AN", 3, 1, 2], ["FFSP", 3, 0, [2, 1], 1, 1], ["AN", 3, 1, 6], ["FU", 1, [0, 1]], ["SP", 1, 0, 16, [1], 1], ["AN", 1, 1, 2], ["FFSP", 1, 0, [2, 1], 1, 1], ["AN", 1, 1, 6], ["PR", 4, 0, "auto_unroll_max_step$64"]]]], "r": [[0.000103596], 0, 1.02598, 1710093681], "v": "v0.6"}
{"i": [["[\"matmul_layer\", 1, 1024, 1024]", "cuda -keys=cuda,gpu -arch=sm_86 -max_num_threads=1024 -thread_warp_size=32", [-1, 16, 64, 49152, 2147483647, 1024, 8, 32], "", 0, []], [[], [["CHW", 2, "local"], ["SP", 2, 0, 1, [1, 1, 1, 1], 1], ["SP", 2, 5, 1024, [1, 256, 1, 1], 1], ["SP", 2, 10, 1024, [8, 4], 1], ["RE", 2, [0, 5, 1, 6, 2, 7, 10, 11, 3, 8, 12, 4, 9]], ["FSP", 3, 0, 1, 3], ["FSP", 3, 4, 2, 3], ["RE", 3, [0, 4, 1, 5, 2, 6, 3, 7]], ["CA", 2, 3, 5], ["CHR", 1, "shared", [2]], ["CA", 2, 3, 6], ["CHR", 0, "shared", [3]], ["CA", 1, 4, 6], ["FU", 5, [0, 1]], ["AN", 5, 0, 5], ["FU", 5, [1, 2]], ["AN", 5, 1, 4], ["FU", 5, [2, 3]], ["AN", 5, 2, 6], ["FU", 3, [0, 1]], ["SP", 3, 0, 32, [1], 1], ["AN", 3, 1, 2], ["FFSP", 3, 0, [2, 1], 1, 1], ["AN", 3, 1, 6], ["FU", 1, [0, 1]], ["SP", 1, 0, 32, [1], 1], ["AN", 1, 1, 2], ["FFSP", 1, 0, [2, 1], 1, 1], ["AN", 1, 1, 6], ["PR", 4, 0, "auto_unroll_max_step$1024"]]]], "r": [[3.96012e-05], 0, 1.09772, 1710093699], "v": "v0.6"}
{"i": [["[\"matmul_layer\", 1, 1024, 1024]", "cuda -keys=cuda,gpu -arch=sm_86 -max_num_threads=1024 -thread_warp_size=32", [-1, 16, 64, 49152, 2147483647, 1024, 8, 32], "", 0, []], [[], [["CHW", 2, "local"], ["SP", 2, 0, 1, [1, 1, 1, 1], 1], ["SP", 2, 5, 1024, [1, 256, 1, 1], 1], ["SP", 2, 10, 1024, [1, 8], 1], ["RE", 2, [0, 5, 1, 6, 2, 7, 10, 11, 3, 8, 12, 4, 9]], ["FSP", 3, 0, 1, 3], ["FSP", 3, 4, 2, 3], ["RE", 3, [0, 4, 1, 5, 2, 6, 3, 7]], ["CA", 2, 3, 5], ["CHR", 1, "shared", [2]], ["CA", 2, 3, 6], ["CHR", 0, "shared", [3]], ["CA", 1, 4, 6], ["FU", 5, [0, 1]], ["AN", 5, 0, 5], ["FU", 5, [1, 2]], ["AN", 5, 1, 4], ["FU", 5, [2, 3]], ["AN", 5, 2, 6], ["FU", 3, [0, 1]], ["SP", 3, 0, 8, [4], 1], ["AN", 3, 1, 2], ["FFSP", 3, 0, [2, 1], 1, 1], ["AN", 3, 1, 6], ["FU", 1, [0, 1]], ["SP", 1, 0, 8, [4], 1], ["AN", 1, 1, 2], ["FFSP", 1, 0, [2, 1], 1, 1], ["AN", 1, 1, 6], ["PR", 4, 0, "auto_unroll_max_step$64"]]]], "r": [[3.79739e-05], 0, 1.07419, 1710093700], "v": "v0.6"}
{"i": [["[\"matmul_layer\", 1, 1024, 1024]", "cuda -keys=cuda,gpu -arch=sm_86 -max_num_threads=1024 -thread_warp_size=32", [-1, 16, 64, 49152, 2147483647, 1024, 8, 32], "", 0, []], [[], [["CHW", 2, "local"], ["SP", 2, 0, 1, [1, 1, 1, 1], 1], ["SP", 2, 5, 1024, [2, 64, 2, 2], 1], ["SP", 2, 10, 1024, [4, 2], 1], ["RE", 2, [0, 5, 1, 6, 2, 7, 10, 11, 3, 8, 12, 4, 9]], ["FSP", 3, 0, 1, 3], ["FSP", 3, 4, 2, 3], ["RE", 3, [0, 4, 1, 5, 2, 6, 3, 7]], ["CA", 2, 3, 5], ["CHR", 1, "shared", [2]], ["CA", 2, 3, 6], ["CHR", 0, "shared", [3]], ["CA", 1, 4, 6], ["FU", 5, [0, 1]], ["AN", 5, 0, 5], ["FU", 5, [1, 2]], ["AN", 5, 1, 4], ["FU", 5, [2, 3]], ["AN", 5, 2, 6], ["FU", 3, [0, 1]], ["SP", 3, 0, 8, [4], 1], ["AN", 3, 1, 2], ["FFSP", 3, 0, [2, 1], 1, 1], ["AN", 3, 1, 6], ["FU", 1, [0, 1]], ["SP", 1, 0, 4, [4], 1], ["AN", 1, 1, 2], ["FFSP", 1, 0, [2, 1], 1, 1], ["AN", 1, 1, 6], ["PR", 4, 0, "auto_unroll_max_step$64"]]]], "r": [[7.55467e-05], 0, 1.15219, 1710093700], "v": "v0.6"}
