benchmarks/microkernels/DpAnsor/log/rtx3080_relu.log_droplet.log
{"i": [["[\"relu_layer\", 4096, 4096]", "cuda -keys=cuda,gpu -arch=sm_86 -max_num_threads=1024 -thread_warp_size=32", [-1, 16, 64, 49152, 2147483647, 1024, 8, 32], "", 0, []], [[], [["FU", 1, [0, 1]], ["SP", 1, 0, 16777216, [64], 1], ["AN", 1, 0, 5], ["AN", 1, 1, 6]]]], "r": [[0.000172183], 0, 1.22484, 1710104850], "v": "v0.6"}
{"i": [["[\"relu_layer\", 4096, 4096]", "cuda -keys=cuda,gpu -arch=sm_86 -max_num_threads=1024 -thread_warp_size=32", [-1, 16, 64, 49152, 2147483647, 1024, 8, 32], "", 0, []], [[], [["FU", 1, [0, 1]], ["SP", 1, 0, 16777216, [64], 1], ["AN", 1, 0, 5], ["AN", 1, 1, 6]]]], "r": [[0.00018432, 0.00018432, 0.000183808], 0, 0.959932, 1710124597], "v": "v0.6"}
